32	 Neque enim putandum est, quod antiquis iustis sola quae semper erat diuinitas Christi, non etiam quae nondum erat eius humanitas reuelata profuerit. illud enim, quod ait dominus Iesus: Abraham concupiuit diem meum uidere et uidit et gauisus est, si diem suum uoluit suum tempus intellegi, testimonium profecto perhibuit Abrahae, quod fide fuerit incarnationis eius inbutus. secundum hanc enim 10 cf. I Cor. 11, 8 11 I Tim. 2, 5 25 Ioh. 8, 56 2 suos om. C 4 et om. MC 5 dutiubitare C 7 deo] ideo P 8 in xpo omnes P 9 ideo autem uiuificantur in xpo quoniam sqq. V 10 pertinent V 11 esse] est V 13 resurectione C 15 sancte iusteque uixissent V 23 fuit V 24 erat om. CChT reuelata om. M profuit M uoce Illud incipit cap. XXVII b 27 significari TCh (in mg. m . 2 intelligi) habuit V Abraam b 28 fuerat M enim hunc ChTPb hunc MC habet tempus; diuinitas uero eius omne tempus excedit, quia per illam uniuersa facta sunt tempora. quod etsi quisquam de die sempiterno accipiendum putauerit, qui nullo finitur crastino, nullo praeuenitur hesterno, hoc est de ipsa aeternitate, in qua coaeternus est patri, quomodo id uere concupisceret Abraham, nisi eius nosset futuram mortalitatem, cuius quaesiuit aeternitatem? aut si ad hoc aliquis horum uerborum sensum coartat, ut dicat nihil intellegendum in eo quod ait dominus \'quaesiuit diem meum\' nisi \'quaesiuit me, qui sum dies permanens, hoc est lumen indeficiens\' — uelut cum dicimus uitam filii, de qua loquitur euangelium dicens: sic dedit et filio uitam h abere in semet ipso, non aliud ipsum, aliud eius uitam, sed eundem ipsum filium intellegimus uitam, qui dixit: ego sum uia, ueritas et uita, et de quo dictum est: ipse est uerus deus et uita aeterna, ut hanc eius aequalem patri diuinitatem uidere cupiuerit Abraham nequaquam incarnatione eius praecognita, sicut eum nonnulli etiam philosophi quaesiuerunt, qui nihil de eius carne didicerunt — numquid et illud, quod iubet Abraham ponere manum seruum suum sub femore suo et iurare per deum caeli, aliter quisquam recte intellecturus est nisi Abraham scisse in qua uenturus esset deus caeli carnem de illo femore propagari? 
33	 Cuius carnis et sanguinis, quando ipsum Abraham benedixit, Melchisedech etiam testimonium christianis fidelibus notissimum protulit, ut tanto post Christo diceretur in psalmis, quod nondum factum, sed adhuc futurum, eadem tamen ipsa 11 Ioh. 5, 26 13 Ioh. 14, 6 14 I Ioh. 5, 20 19 cf. Gen. 24, 2. 3 23 cf. Gen. 14, 18-20 1 diuinitas tempus M omnem tempus Ch om6n tep\' C 2 illum b et om. V 4 puenitur (in mg. m, 1) C esterno C 5 habraham M abraam C 8 nihil aliud intelligendum V 9 sum uita C 10 quo M 11 habere uitam M 16 cupierit Tbd abraam C eius incarnatione CChP eius om. M 18 eiusj illius MC uoce Numquid incipit cap. XXVIII in b nunquid P numquit C 23 abraam C 24 etiam melchisedech M 25 tanto prius de xpo V in psalmis om. V 2G factum sit V factum est b futurum erat V et patrum quae nostra est fides una cantabat: tu es sacerdos in aeternum secundum ordinem Melchisedech. in Adam quippe inuenientibus mortem per hoc prodest Christus, . quod est mediator ad uitam; non autem per hoc mediator est, quod aequalis est patri. per hoc enim quantum pater tantum et ipse distat a nobis. et quomodo erit medietas, ubi eadem ipsa distantia est? ideo apostolus non ait: unus mediator dei et hominum Christus Iesus, sed homo Christus Iesus. per hoc ergo mediator, per quod homo; inferior patre per quod nobis propinquior, superior nobis per quod patri propinquior. quod apertius ita dicitur: inferior patre, quia in forma serui, superior nobis, quia sine labe peccati. 
34	 Quapropter quisquis humanam contendit in qualibet aetate naturam non indigere medico secundo Adam, quia non est uitiata in primo Adam, non in aliqua quaestione, in qua dubitari uel errari salua fide potest, sed in ipsa regula fidei, qua christiani sumus, gratiae dei conuincitur inimicus. quale est autem, quod ab istis illa quae ante legem fuit uelut adhuc minus malis moribus uitiata hominum natura laudatur? neque respiciunt tantis tamquam intolerabilibus peccatis homines tunc fuisse submersos, ut excepto uno homine dei et eius coniuge . \' tribusque filiis et totidem nuribus iusto iudicio dei sicut igne postea terra exigua Sodomorum ita totus mundus diluuio deleretur. ex quo tempore igitur perunum hominem peccatum intrauit in mundum et per peccatum mors, et ita in 1 Ps. 109, 4 7 I Tim. 2, 5 11 cf. Phil. 2, 7 21 cf. Gen. 7, 13 et c. 19 24 tfom. 5, 12 1 patrum erat V fides qua cantabant V 3 per om. V 4 qui V mediator dei et hominum et aequalis patri est per hoc sqq. V 5 est om. C 6 et pr. om. PV mediaetas C 8 Iesus onto b 9 ergo om. C alt . per om. C 10 fin . per quod per qŲQą Ch patri] deo C 11 quod (o s. ras. m. 2) C apertius (a s. ras. m. 2) C dicatur m. 1 C 15 quia (ia s. ras. m. 2) C 18 legem om. CChTPVbd 19 laudatur natura Tbd 20 tamquam] et tam C tanquam P 25 in pro om. m. 1 T XXXXII Aug. Sect. VIII pars II. 13 omnes homines pertransiit, in quo omnes peccauerunt, profecto uniuersa massa perditionis facta est possessio perditoris. nemo itaque, nemo prorsus inde liberatus est aut liberatur aut liberabitur nisi gratia redemptoris. 
35	 Et ante Abraham quidem utrum aliquo corporali et uisibili sacramento iusti uel eorum paruuli signarentur, scriptura non exprimit. ipse tamen Abraham signum accepit circumcisionis signaculum iustitiae fidei et sic accepit, ut deinceps etiam omnes paruulos domus suae circumcidere iuberetur, recentissimos a uisceribus matrum octauo die natiuitatis eorum, ut etiam hi, qui corde ad iustitiam credere nondum possent, tamen iustitiae fidei signaculum sumerent. quod sub terrore tanto est imperatum, ut diceret deus animam illam de suo populo perituram, cuius octauo die praeputii circumcisio facta non fuisset. huius tam horribilis poenae iustitia si quaeratur, nonne istorum omnis de libero arbitrio et laudabili sanitate et puritate naturae quantumlibet arguta sit argumentatio repercussa et confracta dissiliet? quid enim mali, quaeso, paruulus propria uoluntate commisit, ut alio neglegente et eum non circumcidente ipse damnetur damnatione tam seuera, ut pereat anima illa de populo suo? neque enim temporalis mortis terror incussus est, cum de iustis, quando moriebantur, tunc. potius diceretur: et appositus est ad populum suum uel appositus est ad patres suos, quoniam deinceps homini nulla. temptatio formidatur, quae illum separet a populo suo, si populus eius ipse est populus dei. 7 cf. Rom. 4, 11 13 cf. Gen. 17, 11-14 23 Gen. 25, 17 24 I Mach. 2, 69. 2 perditiois C perditioris (nis ?) T possesio C 3 prorsus omnino C 4 redemptoris] dei V 5 abraam (sec semper) C quod C corporali] temporali C 6 scriptura sup. exp . natura C 9 domi M circumcidi V circumdere P 10 iuberet V iuberet## Ch a uisceribus om. m. 1 C 11 illorum M hii P corde om. V 12 possunt M iustitiae tamen CChTPVbd 15 non facta P tam om. M 16 arbitrio om. C 18 dissilet M 26 est] sit C 
36	 Quid sibi ergo uult pro nullo propriae uoluntatis admisso tanta damnatio? neque enim, sicut nonnulli secundum Platonicos opinantur, hoc uniuscuiusque infantis animae redditur, quod ante istam uitam sua uoluntate commisit, cum haberet ante hoc corpus uel bene uel male uiuendi liberum arbitrium, cum Paulus apostolus apertissime dicat nondum natos nihil egisse boni uel mali. unde ergo recte infans illa perditione punitur, nisi quia pertinet ad massam perditionis et iuste intellegitur ex Adam natus antiqui debiti obligatione damnatus, nisi inde fuerit non secundum debitum, sed secundum gratiam liberatus? quam gratiam nisi gratiam dei per Iesum Chri stum dominum nostrum, quem profecto inter cetera ueterum sacramenta etiam ipsa praeputii circumcisio prophetauit? dies enim octauus est in hebdomadum recursibus dies dominicus, quo resurrexit dominus, et petra erat Christus. unde circumcisionis cultellus est petrinus et caro praeputii corpus peccati. 
37	 Mutatis proinde sacramentis posteaquam uenit qui eis significabatur esse uenturus, non tamen mutato mediatoris auxilio, qui etiam priusquam uenisset in carne, antiqua sua membra liberabat suae incarnationis fide, et nos cum essemus mortui delictis et praeputio- carnis nostrae, conuiuificati sumus Christo, in quo circumcisi sumus circumcisione non manu facta, quam figurabat circumcisio manu facta, ut euacuaretur corpus peccati, cum quo sumus ex Adam nati. damnatae originis propagatio nos 6 cf. Rom. 9, 11 11 Rom. 7, 25 15 I Cor. 10, 4 16 cf. Ios. 5, 3 21 cf. Col. 2, 13. 11 25 Rom. 6, 6 2 ammisso M 3 hoc] habet V anima V redditur om. V 4 istam om. Y cum] quoniam CChPb habere P 5 non potest ante P liberum uiuendi TVbd uenandi M 6 apertissime om. C 7 uel boni uel mali C 8 massam perttnet; (7 9 ex om. M dapnatus C 13 ueterum] uenturum PCh m. 1 circumcisio praeputii C 14 ebdomadarum CChP hebdomadarum TVbd 16 est om. CChTPVbd 18 deinde V 19 tamen] tantum V 26 nos] ne M 18* damnat, nisi mundemur similitudine carnis peccati, in qua missus est sine peccato, qui tamen de peccato damnaret peccatum; factus est enim pro nobis peccatum. unde dicit apostolus: obsecramus pro Christo, reconciliamini deo. eum qui non nouerat peccatumpro nobis peccatum fecit, utnos simusiustitia in ipso in ipso. deus ergo, cui per eum reconciliamur, fecit eum pro nobis peccatum, id est sacrificium per quod dimitterentur nostra peccata, quoniam peccata uocantur sacrificia pro peccatis. et utique ipse pro peccatis nostris est immolatus nullum habens uitium solus in hominibus, quale quaerebatur etiam tunc in pecoribus, quo significabatur unus sine uitio ad uitia sananda uenturus. quocumque igitur die suae natiuitatis infans baptizatur in Christo, tamquam octauo circumciditur die, quoniam in illo circumciditur, qui tertio quidem ex quo crucifixus est, sed octauo in hebdomadibus resurrexit die. circumciditur autem in expoliationem corporis carnis, id est ut debitum, quod contagio carnalis generationis attraxit, gratia spiritalis regenerationis absoluat; nullus enim est mundus a sorde — qua, obsecro, sorde nisi peccati? — nec infans, cuius est unius diei uita super terram. 
38	 Sic autem argumentantur dicentes: \'ergo malum sunt nuptiae et non est opus dei homo quem generant nuptiae?\' quasi nuptiarum bonum sit morbus concupiscentiae, in quo uxores diligunt qui ignorant deum, quod apostolus prohibet. ac non potius pudicitia coniugalis, qua in bonos usus ordinate filios procreandi redigitur libido carnalis, aut uero possit esse 1 cf. Rom. 8, 3 4 II Cor. 5, 20. 21 16 cf. Col. 2, 11 19 Iob 14, 4 25 cf. I Thess. 4, 5 2 damnauit Vbd, m. 2 Ch dapnaret C 3 est enim om. Vd enim om. b 4 reconciliari M 6 per eum om. CChTPVbd 7 sacrificium pr9 }}Çççjş C 8 peccata nostra C 9 immolatus est Vbd 10 qualis V 11 etiam om. b 13 infanx m. 1 Ch baptizetur CClI TPVbd baptizaretur P in octauo b 15 ebdomadibus CCltP (-bdomatibus M 16 exspoliatione M 17 quo M 19 mundus est ChPb 26 impudicitia P ordinante P 27 procreandi otn. C homo nisi opus dei non solum qui de coniugio, uerum etiam qui de fornicatione uel de adulterio procreatur. sed in hac quaestione, ubi quaeritur non cui rei creator, sed cui saluator sit necessarius, non intuendum est quid boni sit in procreatione naturae, sed quid in peccato mali, quo certum est uitiatam esse naturam. simul autem utrumque propagatur, et natura et naturae uitium, quorum est unum bonum, alterum malum. illud de conditoris largitate sumitur, hoc de origine damnationis attrahitur; illi est causa bona uoluntas dei summi, huic mala uoluntas hominis primi; illud indicat deum creaturae institu torem, hoc indicat deum inoboedientiae punitorem. denique idem ipse Christus propter illud creandum factor est hominis, propter hoc sanandum factus est homo. 
39	 Bonum ergo sunt nuptiae in omnibus quae sunt propria nuptiarum. haec autem tria sunt: generandi ordinatio, fides pudicitiae, conubii sacramentum. propter ordinationem generandi scriptum est: uolo iuniores nubere, filios procreare, matres familias esse; propter fidem pudicitiae: uxor non habet potestatem corporis sui, sed uir; similiter et uir non habet potestatem corporis sui, sed mulier; propter conubii sacramentum: quod deus coniunxit, homo non separet. de quibus in aliis opusculis nostris, quae uobis non sunt incognita, quantum domino adiuuante potuimus, satis nos disseruisse meminimus. propter haec omnia honorabiles nuptiae in omnibus et torus inmaculatus. in quantum enim nuptiae bonae sunt, in tantum faciunt plurimum boni etiam de libidinis malo, quoniam libidine non bene utitur libido, sed ratio. libido est 17 I Tim. 5, 14 19 I Cor. 7, 4 21 Matth. 19, 6 24 cf. de bono coni. CSEL XXXXI 190 sqq. 25 Hebr. 13, 4 1 quod C 2 quod C 3 quaeritur om. C 5 quo] quod M 7 unum est b unum ] alium (i supra exp . t) C et alterum b 8 originis damnatione d 10 creatore M 12 idemque C 15 sunt tria CChTPVbd 19 sui corporis TVbd 20 sui corporis ChPTVbd 28 utitur bene C est auteiu in motu illo quem uocat V autem in illa quam notat apostolus repugnante legi mentis inoboedientium lege membrorum, ratio uero bene utens libidine ipsa est in lege nuptiarum. nam si nullum de malo bonum fieri posset, nec deus ex adulterino concubitu hominem conderet. sicut ergo adulterii damnabile malum, quando et inde homo nascitur, non inputatur deo, qui certe in opere hominum malo facit ipse opus bonum, ita quicquid est pudendum in membrorum illa inoboedientia, de qua erubuerunt qui post peccatum foliis ficulneis eadem membra texerunt, non nuptiis inputatur, propter quas concubitus coniugalis non solum est licitus, uerum etiam utilis et honestus, sed inputatur peccato inoboedientiae, cuius haec poena est consecuta, ut homo inoboediens deo sua quoque sibi inoboedientia membra sentiret. de quibus erubescens, quod non ad arbitrium uoluntatis eius, sed ad libidinis incentiuum uelut arbitrio proprio mouerentur, quae pudenda iudicauit, operienda curauit. non enim confundi debuit homo de opere dei aut ullo modo fuerant creato erubescenda, quae instituenda uisa sunt creatori. itaque nec deo nec homini illa simplex nuditas displicebat, quando nihil erat pudendum, quia nihil praecesserat puniendum. 
40	 Essent autem procul dubio nuptiae etiam non praecedente peccato, quia neque ob aliam causam uiro adiutorium non alius uir, sed femina facta est et illa dei uerba: crescite et multiplicamini, non est damnandorum praedictio peccatorum sed fecundatarum benedictio nuptiarum. his enim deus ineffabilibus suis uerbis, id est diuinis rationibus in suae sapientiae per quam facta sunt omnia ueritate uiuentibus uim seminis indidit primis hominibus. si autem peccato non fuisset dehonestata natura, absit ut opinemur tales futuras fuisse nuptias in paradiso, ut in eis ad prolem seminandam 1 cf. Rom. 7, 28 8 cf. Gen. 3, 7 24 Gen. 1, 28 27 cf. I Cor.l,24;Ioh.],3 1 uocat b repugnantem b 2 inobedienti legi V ue 0] autein C 4 ne-w. 1 Ch 6 hominum om. b 14 uolunt V 17 creata Tx 19 nichil C 25 hiis PGlt m. 1 29 esset C honestata M deonestata C prima natura C \' non nutu uoluntatis, sicut pes ad. ambulandum, manus ad operandum, lingua ad loquendum, sed aestu libidinis membra genitalia mouerentur nec, sicut nunc fit, uirginitatis integritas ad concipiendos fetus ui turbidi uitiaretur ardoris, sed obsequeretur imperio tranquillissimae caritatis et eo modo non esset dolor et cruor uirginis concumbentis, quomodo non esset etiam matris gemitus parientis. haec ideo non creduntur, quia in ista mortalitatis conditione inexperta sunt. in deterius quippe uitio mutata natura non inuenit primae illius puritatis exemplum. sed fidelibus loquimur, qui nouerunt credere diuinis eloquiis etiam nullis adhibitis expertae ueritatis exemplis. quomodo enim nunc ostendam sine ullis parentibus de puluere hominem factum eique de suo latere coniugem? et tamen quod oculus iam non inuenit, fides credit. 
41	 Sic ergo et primarum nuptiarum sine libidinis passione tranquillitas et motus genitalium sicut aliorum membrorum non ad effrenati caloris incitamentum, sed ad uoluntatis arbitrium — quales nuptiae perseuerassent, si peccati non interuenisset obprobrium — nunc ostendi non potest, sed ex his quae diuina auctoritate conscripta sunt non immerito credi potest. sic enim modo non inuenio sine pruriente libidine concumbentem; sicut non inuenio sine dolore et gemitu parturientem, sine futura morte nascentem, et tamen secundum scripturarum sanctarum ueritatem gemitus parturientis et mors hominis non fuissent, si peccatum non praecessisset; sic nec illud unde erubuerunt, qui membra illa texerunt, quia et hoc in eisdem sanctis litteris praecedente peccato scriptum est consecutum. membra quippe illa nisi indecens motus oculis 12 cf. Gen. 2, 1. 22 * 1 natu M natura cet. et b; cf. de nuptiis et concup . 17 2 operandum] tangendum V 4 foetus 0 uiciaretur CP incitaretur V 6 quomodo] quando V 8 mortalitis C 11 ex parte b quomodo] sicut V 12 enim om. C 13 eiusque b suo om. C . 17 effrenati. C 19 ex om. P 20 hiis ChP 22 et gemitu] gementem M 25 fuisset b eorum non utique clausis, sed in hoc non apertis, hoc est non attentis, animaduertenda nuntiasset, nihil in suo corpore, quod utique totum deus laudabile fecerat, pudendum uelandumque sensissent, quia nisi praeisset facinus, quod inoboedientia est ausa committere, non sequeretur dedecus, quod uerecundia uellet abscondere. 
42	 Clarum est igitur hoc non esse nuptiis inputandum, quod etsi non esset, nuptiae tamen essent, quarum bonum non aufertur isto malo, sed ab eis et hoc malum in usum uertitur bonum. uerum quia iam ista conditione mortalium nunc simul aguntur concubitus et libido, eo fit, ut cum libido reprehenditur, etiam nuptialis concubitus licitus et honestus reprehendi putetur ab eis, qui nolunt discernere ista uel nesciunt. nec attendunt illud esse nuptiarum bonum, unde gloriantur nuptiae, id est proles, pudicitia, sacramentum, illud autem non esse nuptiarum, sed carnalis concupiscentiae malum, de quo erubescunt et nuptiae. sed quia sine illo malo fieri non potest nuptiarum bonum, hoc est propagatio filiorum, ubi ad huius modi opus uenitur, secreta quaeruntur, arbitri remouentur, filiorum quoque ipsorum, si iam inde aliqui nati sunt, cum per aetatem sentire ista iam coeperint, praesentia deuitatur, atque ita nuptiae sinuntur exercere quod licet, ut non neglegant occultare quod dedecet. hinc est, quod infantes etiam qui peccare non possunt, non tamen sine peccati contagione nascuntur, non ex hoc quod licet, sed ex eo quod dedecet. nam ex hoc quod licet natura nascitur, ex illo quod dedecet uitium. naturae nascentis est auctor deus, qui hominem condidit et qui uirum ac feminam nuptiali iure coniunxit, uitii uero auctor est diaboli decipientis calliditas et hominis consentientis uoluntas. 
43	 Vbi nihil deus fecit, nisi quod hominem 1 hec est CP 5 decus M 8 esset] eseent b 9 et om. b 10 ista iam CP 12 l\'ępQęŲQiF in textu pro reprehendi putetur C 19 arbitrii M 21 ista sentire C 23 decet M etiam ante quod in C 25 decet M 27 actor C 31 qui C . uoluntate peccantem iusto iudicio cum stirpe damnauit, et ideo ibi quicquid etiam nondum erat natum mento est in praeuaricatrice radice damnatum, in qua stirpe damnata tenet hominem generatio carnalis, unde sola liberat regeneratio spiritalis. ideo regeneratis parentibus, si tamen in eadem gratia perseuerauerint, procul dubio libido ista propter remissionem peccatorum, quae in eis facta est, non nocebit, nisi cum ea male utuntur non solum in omnibus inlicitis corruptelis, uerum etiam in ipsis coniugibus, quando non propagandi uoluntate operam creandis filiis inpendunt, sed lasciuiendi uoluptate exsaturandae cupidini inseruiunt. quod propter uitandas fornicationes maritis et uxoribus ne fraudent inuicem nisi ex consensu ad tempus, ut orationibus uacent, secundum ueniam, non secundum imperium concedit apostolus. euidenter quippe dum tribuit ueniam, denotat culpam. nuptialis autem concubitus, quem matrimoniales quoque indicant tabulae causa procreandorum fieri filiorum, per se ipsum prorsus, non in comparatione fornicationis est bonus. qui tametsi propter corpus mortis, quod nondum est resurrectione renouatum, sine quodam bestiali motu, de quo natura erubescit humana, non potest fieri, tamen ipse concubitus non est peccatum, ubi ratio libidine utitur ad bonum, non superatur ad malum. 
44	 Obesset ista carnis concupiscentia etiam tantummodo quod inesset, nisi peccatorum remissio sic prodesset, ut quae in eis est, et nato et renato, nato quidem et inesse et obesse, renato autem inesse quidem, sed non obesse possit. in tantum autem obest natis, ut, nisi renascantur, nihil possit prodesse, si nati sunt de renatis. manet quippe in prole, ita ut ream faciat originis uitium, etiam si in parente reatus 12 I Cor. 7, 5. 6 2 quicquit C natum] natura V praeuaricatoris V 4 hominem om. V libera m. 1 C 6 libido om. CChTPVbd 8 omnibus] moribus V corruptelis om. V 10 creandae proli V 18 est] et M 23 ista] tamen V 25 nato et renato om. V renato—obesse om. M 27 autetn] enim CChTPVbd 28 si] quod V 29\'reatum b uitium om. V rCtatus M eiusdem uitii remissione ablutus est peccatorum, donec omne uitium, cui consentiendo peccatur, regeneratione nouissima consumatur, id est ipsius etiam renouatione carnis, quae in eius resurrectione futura promittitur, ubi non solum nulla peccata faciamus, sed nec habeamus ulla desideria uitiosa, quibus consentiendo peccemus, ad quam beatam perfectionem huius quod nunc datur sancti lauacri gratia peruenitur. qua enim regeneratione spiritus modo fit, ut peccata omnia peccata remittantur, eius merito fiet etiam regeneratio carnis in aeternam uitam, qua in ipsa carne incorruptibiliter resurgente peccatorum omnium incitamenta sanentur. sed ea salus adhuc in spe facta est, non tenetur in re neque per praesentiam possidetur, sed expectatur per patientiam. Ac per hoc non solum peccata omnia, quorum nunc remissio fit in baptismo, quae reos faciunt, dum desideriis uitiosis consentitur atque peccatur, uerum etiam ipsa desideria uitiosa, quibus si non consentitur, nullus peccati reatus contrahitur, quae non in ista, sed in alia uita nulla erunt, eodem lauacro baptismatis uniuersa purgantur. 
45	Reatus itaque uitii eius, de quo loquimur, in regeneratorum prole carnali tamdiu manebit, donec et illic lauacro regenerationis abluatur. regeneratus quippe non regenerat filios carnis, sed generat ac per hoc in eos non quod regeneratus, sed quod generatus est traicit. sic igitur siue reus infidelis siue absolutus fidelis non generat absolutos uterque, sed reos, quomodo non solum oleastri, sed etiam oleae semina non oleas generant,- sed oleastros. sic itaque in damnatione hominem prima natiuitas tenet, unde nisi secunda non liberat. tenet ergo diabolus, liberat Christus; tenet deceptor Euae, liberat filius Mariae; tenet qui per coniugem uenit ad uirum, liberat qui \' 1 abaolutus F 7 praeuenitur V 9 dimittantur C 10 incorrubti- Biliter C 12 possidetur per praesentiam CChTPVbd 14 non solum oin.- V 15 dum] de V 16 consentientes V om. C ■ peccantes V 20 huius uitii CP eius] huius CTt - regenaeratorum Ch 21 illo P 24.trahicit MCChP ergo P 25 regenerat b -80 peruenit CTP liberat-feminae om. V de coniuge natus est, quae non pertulit uirum; tenet qui causam libidinis intulit feminae, liberat qui sine libidine est conceptus in femina. omnes ille prorsus per unum tenere potuit nec ab eius dominatione liberat nisi unus, quem tenere non potuit. denique ipsa ecclesiae sacramenta, quae tam priscae traditionis auctoritate concelebrat, ut ea isti, quamuis in paruulis existiment simulatorie potius quam ueraciter fieri. non tamen audeant aperta inprobatione respuere — ipsa, inquam, sanctae ecclesiae sacramenta satis indicant paruulos a partu etiam recentissimos per gratiam Christi de diaboli seruitio liberari. excepto enim quod in peccatorum remissionem non fallaci, sed fideli mysterio baptizantur, etiam prius exorcizatur in eis et exsufflatur potestas contraria, cui etiam uerbis eorum a quibus portantur se renuntiare respondent. quibus omnibus rerum occultarum sacratis et euidentibus signis a captiuatore pessimo ad optimum redemptorem transire monstrantur, qui pro nobis infirmitate suscepta alligauit fortem, ut uasa eius eriperet, quia infirmum dei non solum est hominibus, uerum et angelis fortius. liberans itaque deus pusillos cum magnis in utrisque ostendit quod locuta est per apostolum ueritas; non enim solos aetate maiores, sed etiam pusillos eruit a potestate tenebrarum, ut transferat in regnum filii caritatis suae.. 
