2.12	Quapropter si causa incontinentiae non sunt excusanda adulteria, quanto minus excusantur procreandorum causa filiorum!\' Illi quippe infirmitati, hoc est incontinentiae uoluit apostolus subuenire honestate nuptiarum. non enim ait: si filios non habet, nubat, sed: si se non continet, nubat. filiorum quidem propagatione conpensatur, quod incontinentiae nubendo ceditur. nam utique incontinentia uitium est,- coniugium autem non est uitium; et ideo fit per hoc bonum, ut illud ueniale sit malum. cum sint ergo nuptiae causa generandi institutae, ea causa fiebant a patribus, qui tantum officio generandi feminis, sed non inlicite, miscebantur. erat enim tunc quaedam propagandi necessitas, quae nunc non est, quoniam tempus amplectendi, sicut scriptum est, quod utique tunc fuit, et tempus continendi ab amplexu, quod nunc est. de quo tempore apostolus loquens ait: de cetero, fratres, tempus breue est; reliquum est, ut et qui 16 I Cor. 7, 9 24 cf. Eccle. 8, 5 26 I Cor. 7, 29. 1 uxore om. S ducere eit peccatum VEMSN1 3 caasa procreandorum R . 5 eligendum pudice (cę E) VEMNS 6 quod si S sinantur sua uoluntate adulteri VEMSN1 7 saecundae B 9 alteras] adulterae BN1 11 quod propter Tl 15 subueniri Nbd honeatati N 17 progagine bd 18 caeditur B . 19 sic fit M sic ait Nl aut M 20 sit ueniale S 21 flebat VES \' a om. BT1ES . 22 generandi? (s exp. m . 2) T 23 non s. I. B om. Tl 24 tempus est B quod om. VESN1 25 tempus est B quod om. VESN1 27 uti E habent uxores, tamquam non habentes sint. unde nunc certissime dicitur: quae potest capere, capiat; quae autem se non continet, nubat. tunc ergo etiam continentia propter propagationem filiorum in nuptias descendebat officio; nunc autem uinculum nuptiale incontinentiae subuenit uitio, ut ab eis, qui se non continent, non per turpitudinem stuprorum, sed per honestatem coniugiorum fiat propagatio filiorum. cur ergo non dixit apostolus: si filios non habet, nubat? quia scilicet hoc tempore continendi ab amplexu non est necesse filios propagare. et quare dixit: si se non continet, nubat? utique propterea, ne per incontinentiam cogatur adulterare. si ergo se continet, nec nubat nec generet; si autem se non continet, licite nubat, ne turpiter generet aut turpius concumbendo non generet. quamquam hoc, quod ultimum dixi, nonnulli faciant etiam licite coniugati. inlicite namque et turpiter etiam cum legitima uxore concumbitur. ubi prolis conceptio deuitatur. quod faciebat Aunan filius Iudae, et occidit illum propter hoc deus. propagatio itaque filiorum ipsa est prima et naturalis et legitima causa nuptiarum. ac per hoc qui propter incontinentiam coniunguntur, non sic debent temperare malum suum, ut bonum exterminent nuptiarum, id est propagationem filiorum. de incontinentibus quippe loquebatur apostolus, ubi ait: uolo igitur iuniores nubere, filios procreare, matres familias esse, nullam occasionem dare aduersario maledicti gratia. iam enim quaedam conuersae sunt retro post 2 Matth. 19, 12 10 I Cor. 7, 9 17 cf. Gen. 38, 8-10 28 I Tim. 5, 14. 15 2 rectissime VBN2bd qui VEMNSbd (item 3) 4 nuptiarum M 5 officium R 6 ris] his S . per 8. 1. TN, om. B 11 non T1 per] propter R per eam N 13 non 8. l. B om. T1 15 etiam cum R coniugatis R 16 qqq (8. l . cQ) N 17 ubi-deuitatur add. MRbd, in mg. N ceteri om . aunan (8. l . m. al . t onan) BT onan VEMNRSbd 20 iunguntur S coniugantur N2bd 22 propaginem IPbd 24 nubere. filios procreare om. VESN1 26 conueraae quaedam Vbd retrorsuin S aathanan NRS satanam bel . satanan. cum itaque dicebat: uolo iuniores nubere, hoc utique monebat propter ruinam continentiae fulciendam. sed ne forte ab eis sola carnalis concupiscentiae cogitaretur infirmitas, cui tantummodo esset opere conubii seruiendum, nuptiarum autem uel contemneretur uel neglegeretur bonum, continuo subiunxit: filios procreare, matres familias esse. qui uero eligunt continere, aliquid utique melius eligunt. quam est nuptiarum bonum; hoc est generatio filiorum. unde si eligitur continentia, ut bono nuptiarum melius aliquid capessatur, quanto potius custodienda est, ut adulterium caueatur! cum enim dixisset apostolus: quodsi se non continet, nubat, melius est enim, inquit, nubere quam uri, non dixit \'melius est moechari quam uri\'. 
2.13	 Non est igitur, ad quod exhortemur eos qui reconciliari timent coniugibus adulteris paenitendo sanatis nisi ad custodiendam continentiam, quoniam mulier alligata, quamdiu siue moechus siue castus uir eius uiuit, moechatur, si alteri nupserit, et uir alligatus, quamdiu siue moecha . siue casta uxor eius uiuit, moechatur, si alteram duxerit. haec namque alligatio quandoquidem non soluitur, etiamsi per repudium coniux a casto coniuge separetur, multo minus soluitur, si non separata moechetur. ac per hoc non eam soluit nisi mors coniugis non in adulterium corruentis, sed de corpore exeuntis. quapropter si recesserit mulier ab adultero uiro et ei reconciliari non uult, maneat innupta; et si dimiserit uir adulteram mulierem et eam non uult recipere nec post paenitentiam, custodiat continentiam, etsi 11 I Cor. 7, 9 2 itaque VES1 incontinentiae MRNaSabd 4 tamen modo B in opere B conubiis BTlEMN 6 subiuierit Tl 7 itaque M om. R 8 nuptiale S 9 bona TNIMz 10 capessantur MN1 custodiendum VEMS 11 se om. 8 12 inquit om. TEMNlRS 14 exortemur BlTN exhortaemua M 15 adulteris coniugibus T 16 alligata est BTESN1 17 quamdiu post castus T 18 uir ęiv.ş N alligatus est T 20 nanque R 21 coniunx R casta. YES 22 moechatur (a 8. e m. 1) T 26 recipere non nult T . non ex uoluntate eligendi potioris boni, certe ex necessitate uitandi perniciosi mali. ad hoc exhortarer, etiamsi uxor esset in languore insanabili atque diuturno, etiamsi alicubi esset corpore separata, quo maritus non posset accedere; postremo ad hoc exhortarer, etiamsi mulier uolens uiuere continenter, quamuis contra disciplinam, quia non ex consensu, tamen pudicum pudica dimitteret. puto enim christianum neminem reluctari adulterum esse, qui uel diu languente uel diu absente uel continenter uiuere cupiente sua uxore alteri commixtus est feminae. sic ergo et dimissa adultera adulter est cum altera, quoniam non ille aut ille, sed omnis qui dimittit uxorem suam et ducit alteram, moechatur. quapropter si a coniugali uinculo inmunis minus adpetitur uita sanctorum, exhorreatur poena moechorum et timore saltem frenetur concupiscentia, si amore non eligitur continentia. si enim, ubi est timor, operetur labor, ubi erat labor, erit et amor. non enim confidendum est de nostris uiribus; sed oratio adiungenda conatibus, ut inpleat bonis, qui deterret a malis. 
2.14	 Respondeamus etiam ad illud, ubi putas maritos ad puniendas adulteras sine ulla miseratione conpelli, cum uolunt eas mori, si eis uiuentibus non eis licet alteras ducere. quam crudelitatem uolens exaggerare dixisti: (non mihi uidetur, amantissime pater, hic diuinus esse sensus, ubi benignitas et pietas excluditur\'. ita istuc dicis, quasi propterea mariti parcere debeant adulteris feminis. 11 Luc. 16, 18 23 Pollent. 2 ad hoc] ac per hoc ad hoc BVRSEMN1 eiortarer BTG 4 corpora N 5 adhuc D exortarer TM nolens mulier T continenter uiuere T 7 pudica pudicum T neminem christiauum T 8 adulterium BlEl adulterum eum S 9 uel om. TNl 11 alteraj adultera VENBS 13 a om. TVEMSN1 14 eiorreatur N moechorum ex monachorum S saltim B 18 impleatur M 22 licet eis Vbd 24 ama.tissime N 25 pietas et benignitas T ista EMRSN istud Vbd isti (8. fin . i add . a) T 26 adicis T quia licet eis alteras ducere, ut, si non licet, non parcant, ut liceat. quin immo propterea debent peccatricibus praebere misericordiam, ut et ipsi pro suis peccatis misericordiam consequantur. et multo magis hoc eis faciendum est, qui dimissis uxoribus adulteris cupiunt uiuere continenter. tanto quippe debent esse misericordiores, quanto uolunt esse sanctiores, ut castitate in se ipsis seruanda diuinitus adiuuentur, dum castitatem ab uxoribus uiolatam nec ipsi humanitus ulciscuntur. et maxime uox illa dominica eis est in memoriam reuocanda: qui sine peccato est, prior in illam lapidem iaciat. non qui sine ipso peccato est. quoniam loquimur de pudicis uiris, sed qui sine peccato est: quod si esse se dixerint. se ipsos seducunt, et ueritas in eis non est. porro si se non seducunt et est in eis ueritas, non erit in eis cruenta seueritas. scientes enim se non esse sine peccato, dimittunt, ut dimittatur eis, nec ab eis benignitas et pietas excluditur. magis enim haec excluduntur, si peccatis coniugum ab eis impetret ueniam licentia libidinis, non cura pietatis; id est ut propterea parcant, quia licet eis alteras ducere, et non potius propterea, quia uolunt et sibi dominum parcere. 
2.15	Quanto itaque melius, honestius, christiana denique professione dignius, ut parcant adulterarum sanguini uxorum, quod scriptum est eis dicimus. dimitte iniustitiam proximo tuo, et tunc precanti tibi peccata soluentur. homo homini conseruat iram et a domino quaerit 10 Ioh. 8, 7 13 cf. I Ioh. 1, 8 23 Eccli. 28, 2-5 1 adulteras VEN1 ut] aut VEMNS parcunt T 2 qui immo VETI 4 eis om. EV illis 8. I. S 6 miaedicordes Sl 7 ut] ut et ad bd ut ad RN2 castitatem VEMNRSbd seruando BVEMS aeruandam NRbd adiubentur T 8 huraanius B humanitus (s. 1. ante hu l in) T 9 uoxj axpr (8. I . uox) B uxor T est eis Ybd in om. B memoria B 11 ipso om. R peccato isto R 14 non se Nbd nosse ducunt Bl nosse dicunt corr. al. m. B 15 non essej nosse B 16 ne S 17 excludatur VEMSN1 peccatum R 19 eis 8. 1. T 21 et honestius B2NlVEMSbd 23 est om. S 24 tunc om. Tl 25 seruat VEMNS medellam? super hominem similem sibi non habet misericordiam et de peccatis suis deprecatur? cum ipse caro sit, conseruat iracundiam, quis propitiabitur peccatis illius? et de euangelio: dimittite, et dimittetur uobis — ut possimus dicere: dimitte nobis debita nostra, sicut et nos dimittimus debitoribus nostris — et de apostolo: nulli malum pro malo reddentes et si qua sunt huius modi in scripturis sanctis, quibus ad ulciscendum quando humanus animus excitatur, quia christianus est, mitigatur. Quanto, inquam, ista melius dicimus, quam ut dicamus: tantum adulteras istas dimittite, et earum nolite sanguinem quaerere; quidquid doloris ex earum flagitiis habetis, consolabuntur uos aliae, quas duxeritis; merito enim uelletis istas de uiuentium numero auferre, si earum uita inpedimento esset, quominus alias duceretis. nunc uero etiam istis uiuentibus cum liceat alia uobis matrimonia prouidere, quid eas tantopere uultis occidere? haec si dicimus, nonne adtendis, quam nostra suasio longe sit a charactere christiano? qui et falsum dicimus eis licere, quod non licet, hoc est istis uiuentibus, ut aliis copulentur, et si propterea illis pepercerint, non parcunt propter pietatem, sed propter aliarum nuptiarum liberam potestatem. postremo quaero abs te, utrum marito christiano liceat uel secundum ueterem dei legem uel romanis legibus adulteram occidere. si licet, melius est, ut ab utroque 4 Luc. 6, 37 5 Mattb. 6, 12 7 Rom. 12, 17 1 mede*lain B medelam TVEMNRSbd 2 deprecatur ueniam R 3 seruat VEMN qui Bl 4 demitte Bl dimitte E 9 ulcescendum B 10 qui EMSN1 11 melius ista Ybd 12 dimittere R sanguinem nolite 8 13 quicquid TEMRS 15 aufferre T impedimentQ S 16 nobis esset R 17 uobis alia TR 18 si] cd VES si s. I. TN 19 longe nostra suasio T caractere S qui] quia ВN2bd 20 licere alt. B hoc est] ut MNS est om. BT istis] ut illis R ut istis E 21 ut om. TREMN181 aliis om. TBVEMNtSl non] ut non T 22 parcant TNl parcent RN2bd 25 legibv? N occidere del . et t. I. add . addici N . se temperet, id est et a licito illa peccante supplicio et ab inlicito illa uiuente coniugio. quodsi alterutrum eligere perseuerat, satius est ei facere quod licet, ut adultera puniatur, quam id quod non licet, ut ipsa uiua ille moechetur. si autem, quod uerius dicitur, non licet homini christiano adulteram coniugem occidere, sed tantum dimittere, quis est tam demens, qui ei dicat: fac, quod non licet, ut tibi liceat quod non licet? cum enim utrumque secundum legem Christi inlicitum sit, siue adulteram occidere siue illa uiuente alteram ducere, ab utroque abstinendum est, non inlicitum pro inlicito faciendum. si enim facturus est, quod non licet, iam faciat adulterium et non faciat homicidium, ut uiuente uxore alteram ducat et non humanum sanguinem fundat. quodsi est utrumque nefarium, non debet alterum pro altero perpetrare, sed utrumque uitare. 
2.16	 Hic uideo, quid dici ab incontinentibus possit: quod uidelicet qui dimittit et uiuere permittit adulteram, si alteram duxerit, quamdiu illa prior uiuit, perpetuus adulter est nec agit paenitentiam fructuosam a flagitio non recedens; nec, si catechumenus est, ad baptismum admittitur, quoniam ab eo quod inpedit non mutatur; nec reconciliari paenitens potest in eadem nequitia perseuerans: si autem accusando adulteram occiderit, hoc peccatum, quoniam transactum est et in eo non permanetur, et, si a catechumeno factum est, baptismate abluitur et, si a baptizato, paenitentia et reconciliatione sanatur. sed numquid propterea dicturi sumus adulterium non esse adulterium, quod sine dubio committitur, si coniuge adultera uiuente altera ducitur? sed hoc adulterii genere excepto nempe non dubitas esse adulterium, si quisquam ducat 2 uiuente] iuuentute N alterum EMS alterutrfi (trft s. I.) N eligendum B 9 adulteram ducere VNlE 16 quid] quod M 17 qui mitti et B 18 prior illa Vbd 20 cathecuminus MR cathicuminua E est om. VEMS aipmittatur (8. qi add. m. 2 d) T 22 perseaeras S 24 permanet BVJRSbd a om. TE cathicumino E 25 abluatur T reconciliatine T 29 dicat T XXXXI Aug. Sect. V para III. 26 uiuentis uxorem a uiro suo per libellum repudii sine ulla mulieris fornicatione dimissam. quid ergo? cum uiderit se nec ad baptismum admitti, si catechumenus est, nec utiliter agere paenitentiam, si baptizatus hoc fecit, non corrigendo et relinquendo quod fecit, si eum uoluerit et potuerit occidere, cuius duxit uxorem, ut hoc scelus uel baptismate diluatur uel paenitendo soluatur atque ita etiam illud adulterium non permaneat euacuata muliere a lege uiri post mortem uiri. sed de transacto quod factum est per paenitentiam satis fiat uel regeneratione deleatur: numquid propterea est accusanda lex Christi, tamquam conpulerit fieri homicidium, cum sine crimine fornicationis repudiatam ducere dicit esse adulterium? 
2.17	Hic enim, si parum quid loquamur adtendimus, multo grauiora dici possunt quam ipse dixisti. nam tu dum non uis esse adulteria, si aliae ducantur dimissis adulteris, hoc inuenisti: (quoniam si haec adulteria dixerimus. cogentur mariti occidere adulteras, quarum uita inpediuntur alteras ducere\'. atque, ut hoc exaggerares. dixisti: \'non mihi uidetur, amantissime pater, hic diuinus esse sensus, ubi benignitas et pietas excluditur\'. si ergo quispiam nolens credere esse adulterium. quando a marito sine fornicationis crimine repudiata ab altero ducitur, et hoc contra te inueniat, quia ista ratione suadetur hominibus homicidia perpetrare et earum maritos, quas eo modo repudiatas duxerint, uel insidiis, quibus potuerint, uel calumniis adpetere uel aliquibus ueris criminibus accusare et 16 Pollent. 2 uideris M si T esse M 3 cathecuminas B cathicuminas E est om. TRbd e§t N 4 fecerit (er 8. I.) N 5 occidit T 6 dnxerit TVEMS ut] et VES 7 saluatur Tl 8 euacuta T* 9 dej et ES 10 generatione TEN1 accusanda est TEMS accusanda ţŞt A 18 multa T 14 posse VES 15 djcantur (s. i add . u) B 18 eiaggeraris Nl 19 ama-tissime N pater omnibus BVE, (omnibus exp. m. 2) T, NS his VEM 21 quispiam (quia add. 8. I. m. al.) B pium T 22 fornicationes B 23 hoc 8. I. T 25 calumpniis S occidere, ut eis mortuis possint esse coniugia, quae uiuis fuerant adulteria, nonne id exaggerando tibi dicturus est: (non mihi uidetur, amantissime pater, hic diuinus esse sensus, ubi non solum benignitas et pietas excluditur, sed etiam ingens malignitas et inpietas excitatur?\' quandoquidem multo est leuius et tolerabilius, ut adulteras mariti, quam ut maritos adulteri occidant. placetne tibi, ut propter hanc uanissimam inuidiam dominicae defensionem sententiae deseramus uel eam insuper accusemus, dicentes non debere adulterium iudicari, etiamsi praeter causam fornicationis repudiata a uiro alteri coniugetur, ne maritum eius, a quo dimissa est, conpellatur occidere, dum adulterium in conubium cupit uiri prioris morte conuertere? scio tibi hoc non placere, ut propter hanc uanissimam inuidiam lex Christi, cum uera inueniatur et sana, dura et inhumana dicatur. sic itaque non tibi debet uideri ideo negandum esse adulterium, quando uxore adultera uiuente ducitur altera, quia potest maritus per hoc cogi adulteram occidere, dum cupit sibi licere illa extincta alteram ducere, si hoc ea uiuente non licet facere. quid? si enim et illud dicant christianae fidei detractores, cogi homines occidere uxores suas insidiarum sceleribus, quas molestas ferre non possunt, siue diuturno languore laborantes et pati concubitum non ualentes siue pauperes siue steriles siue deformes, aliarum spe ducendarum, sanarum, opulentarum, fecundarum, pulcherrimarum, quia eas, quas perpeti nolunt, praeter causam fornicationis repudiare non licet et alteras ducere, ne perpetuo 1 esse possint Vbd quae prius M 3 amtutissime N pater BVEMNXS: frater TNzli!bd 6 tollerabilius T maritis M 7 adulterii Tl adultere RS adultere EM placetne-15 dicatur in mg. add. N 8 hanc om. bd 9 deferamus M differamus VES inaccusemus (exp. m. 2) T 10 adulteram VE uindicari NM\'bd propter VERS 11 coniungetur BT coniungatur VEMS coniungitur R 12 adulterum E 13 huc tibi VNbd hoc om. T non 8. 1. T minime YES 17 altera ducitur TVbd 18 exstincta BVbd 20 detractatores E 22 connubitum S 24 ducandarum T 25 quia] qui BTVEMRNISI causas B 26 fornicationum VEM 26* deuincti adulterio nec baptizari possint nec paenitendo sanari, numquid propterea, ne ista homicidiorum scelera perpetrentur, dicturi sumus non esse adulteria repudiatis. praeter causam fornicationis uxoribus sibi alteras copulare? 
2.18	 Iam uero ex hoc, quod sapis non esse adulterium, si uir uxorem causa fornicationis abiecerit et alteram duxerit, nonne arbitraris cauendum, ne discant uiri uxores suas, quas propter alias innumerabiles causas ferre non possunt, moechari cogere, ut ab eis uinculo coniugali per fornicationem, sicut putas, soluto liceat eis alteras ducere, et ex eo, quod illas moechari coegerunt, aut baptismate ablui aut paenitendo sanari, quoniam illis et gratia et medicina negabitur, quamdiu cum adulteris uiuent, si prioribus praeter causam fornicationis repudiatis alteras duxerint? nisi forte quis dicat neminem posse uxorem suam moechari facere, si pudica est. et tamen dominus, omnis qui dimiserit, inquit, uxorem suam praeter causam fornicationis facit eam moechari. utique propterea, quia cum esset pudica cum uiro, tamen dimissa cogitur per incontinentiam uiuo priore alteri copulari, et hoc est moechari. quodsi hoc ista non fecerit. tamen ille, quantum in ipso est, facere conpulit; et hoc ei deus peccatum, etiamsi illa casta permaneat, inputabit. sed quis nesciat, quam sint rarissimae, quae ita pudice uiuant cum uiris, ut, etiamsi ab eis dimittantur, alios non quaerant? incomparabiliter quippe numerus est amplior feminarum, quae cum pudice adhaereant maritis, tamen, si dimissae fuerint a maritis, non differunt nubere. cum ergo crediderint homines 16 Matth. 5, 32 3 adnlterium S si repudiatis 8 4 si sibi VES copalauerint VES 6 adiecerit P 10 solito (8. i add . u) TS illas om. P 11 cogerunt TNlP ablui om. M ablai aut] abluant P 12 sanari non possint VE sanari possint (i ex u) S 13 uiuunt BTMS repndiatis praeter causam fornicationis R 15 facere moechari S 21 ipsoj illo T 22 peccatum deus T permanet P imputanit BT 23 pudicae B 24 querant E requirant N\'bd 25 numerus quippe T 26 pudicae B domino dicenti: omnis qui dimiserit uxorem suam praeter causam fornicationis facit eam moechari, si crediderint et tibi dicenti muliere fornicante licere uiro eius alteram ducere, quisquis uoluerit propter alias quaslisbet molestias carere uxore, cui iunctus est, prius eam moechari faciat sine fornicatione dimittendo, ut tunc ducat alteram, cum fuerit illa moecha nubendo, ac sic a priore peccato, quo eam moechari fecit, siue per baptismum siue per paenitentiam liberatus sine suo adulterio sibi habere uideatur, quam post prioris adulterium tamquam hinc soluto matrimonii uinculo alteram duxit. quod quidem si fuerit machinatus, et uxorem suam moecham faciet et ipse quamuis post adulterium coniugis aliam ducendo moechus erit nihilque illi proderit, quod tibi. credidit et non ei potius, qui nullo excepto ait: omnis qui reliquerit uxorem suam et aliam duxerit, moechatur. 
2.19	 Quibus omnibus consideratis atque tractatis restat, ut ab eis, qui haec fideliter audiunt, dicatur nobis, quod domino dictum est: si talis est causa cum uxore, non expedit nubere. quibus et nos quid respondeamus, nisi quod ipse respondit? non omnes capiunt uerbum hoc, sed quibus datum est. sunt enim eunuchi, qui de matris utero sic nati sunt; et sunt. eunuchi. qui facti sunt ab hominibus; et sunt eunuchi, qui se ipsos castrauerunt propter regnum caelorum. qui potest capere, capiat. ergo qui potest capiat, quod non omnes capiunt. possunt autem capere quibus hoc praestat dei misericordia occulta, sed non iniusta. sed in his omnibus, 1 Matth. 5, 32 14 Luc. 16, 18 19 Matth. 19, 10—12 1 dicente Tl 3 uiro eius licere T 4 propterea Tx 5 uiorS B coniunctus 2PP 6 facit BSP, 8. l. N, om. T 7 illa fuerit ES 8 facit R 9 adiutorio Y ei sibi ES 11 duxerit bd .12 faciat M 13 illi] ei T 14 crediderit ES 15 relinquerit BT 21 hoc uerbum E 26 capere 8. ezp . accipere m . 2 T 27 hi quibus bd praestat hoc T 28 dei om. BVESNI non iniusta] iusta N2bd instas P omnibus om. MP qui se ipsos castrauerunt propter regnum caelorum. alii sunt, qui in utroque sexu concubitum nesciunt, alii, qui experti et auersi sunt, partim quidem inlicite, partim uero licite experti. porro in his, qui licite experti sunt, quidam sunt, qui nonnisi licite, quidam et licite et inlicite. sunt quippe in eis, qui coniugia sua tantum sciunt; sunt autem, qui et alias feminas ac stupra quaelibet. sed qui post concubitum coniugum se ipsos castrant propter regnum caelorum, aut morte amittunt coniuges aut ex consensu cum eis continentiam profitentur aut necessitate diuortiorum, ne uiuis coniugibus se aliis copulando adulteria perpetrent, castrant se ipsos propter regnum caelorum, non ut clariores ibi esse possint, sed quod aliter esse ibi non possunt nam qui non ista necessitate se continent, sed boni adpetitione melioris, possent ibi esse etiam seruata pudicitia coniugali, quamuis in praemiis minoribus, tamen intus; qui uero propterea se continent, quia prioribus coniugibus uiuis timent aliis coniugari, maiorem curam debent gerere pro salute. quam gesserunt illi, a quibus continentia pro munere dilecta est ampliore. tunc quippe ibi erunt, si adulteri non erunt; si autem non continent, adulteri erunt, quia uiuentibus coniugibus pristinis non coniugibus alteris, sed adulteris adhaerebunt. et si a regno caelorum aberunt, ubi erunt, nisi ubi salui non erunt? 2 introque T concubitu P ali T 3 experti sunt P et auersi om. VES sunt om. P 4 in his] hi BTMBS hii. N 5 quidam qui T et illicite et licite VPBbd et licite om. P 7 acj aut S postegt (exp. m. 2) T potius P 8 coniug*um T castrauerunt T 10 continentiam] continent ia Ifc (exp. m. 2) T continent qui autem continentiam profitentur YES aut om. VES ex necessitate B2Bbd 11 se4 T perpetrant P castrantes M 13 sedpossont om. P ibi esse VBbd possint VBbd 14 sed ut VESM2tl bona T 15 meliores TMSVE possint VES 16 impraemiis B intus erunt VEMNIS quae BVETlS 18 coniungi B saluto B soluto T 19 delecta bd 20 si adulteri-adulteri erunt om. YES. in tng. add. N 21 ae continent lt pro uiuentibus S 22 alterisj propriis VEMWS 23 abierunt VE ab»erunt N 
