15	Huic rei simile est etiam illud, cum homines altius, quam si dormirent, subtrahuntur corporis sensibus et occupantur talibus uisis. et his enim adparent imagines uiuorum atque mortuorum; sed cum fuerint sensibus redditi, quoscumque mortuos uidisse se dixerint, uere cum eis fuisse creduntur nec adtendunt qui haec audiunt similiter ab eis absentium atque nescientium quorundam etiam imagines uisas esse uiuorum. homo quidam Curma nomine municipii Tulliensis, quod Hipponi proximum est, curialis pauper, uix illius loci duumuiralicius et simpliciter rusticanus, cum aegrotaret, ablatus a sensibus paene mortuus iacuit aliquot diebus: tenuissimus flatus in naribus, qui manu admota utcumque sentiebatur et erat exiguum uiuentis indicium, sepeliri ut exanimem non sinebat. nullos artus mouebat, nulla sumebat alimenta; nihil oculis, nihil ullo alio sensu corporis qualibet inpacta molestia sentiebat. uidebat tamen multa uelut in somnis, quae tandem aliquando post dies plurimos quasi euigilans uisa narrauit. ac primum mox ut aperuit oculos, eat aliquis, inquit, ad domum Curmae fabri ferrarii et uideat, quid ibi agatur. quo cum itum esset, inuentus est mortuus 1 cum homines etiam illud cum homines altius quam sqq. A altius quam] subito si E altius om. F 2 quasi Fm dormiant EF, corporalibus Eug et-uisis om. TMAEFKBlYCh 3 et s. I. o hi.\'l *is If> 5 se om. Eug eis 8. l. m. 2 y 6 ab eis om. m 7 scientium BTMAFY uisas] uiuas TMVA1 8 uiuorumj mortuorum T Cnrma] de turma curma BTRMAFCh tuliensis o 9 ipponi IZMAF YNBTEKy ypponi V pauper erat E 10 duumuiralicius BNTEF duumuiroclicius IZ duumuir alitjus K duumuir alicius RY duumuir ali- cuius MACh duumuir alitius (pr . i s. I.) m alicius rp 11 ablatis TEFVa a om. TEMFA$paene (ne s. l. m. Sf) N aliquod TYFZ1 diebus ita ut F 12 flatus erat N naribus eius EF quibus JVFp utcumque] uii EF ut cfi A quod illa F 13 et om. E erat in eo E exigium M uiuentis in eo F iudicium Tl inditll A; iudicium quod illum sepeliri sqq. EF ut a. I. E 14 sinibat N nullos] nullo modo T nullo A1 15 alio ullo N ullo om. T 19 inquid Y ait EFVp cur me Y curmoe II( curme IAEV 20 quo] quod Y fuisset β eo momento, quo iste fuerat sensibus redditus et paene a morte reuixerat. tunc intentis, qui aderant, illum exhiberi iussum esse, quando ipse dimissus est. indicauit seque illic unde redierat dixit audisse, quod non Curma curialis, sed Curma faber ferrarius ad loca illa mortuorum praeceptus fuisset adduci. in illis ergo uisis, tamquam somniis suis, inter eos defunctos, quos uidebat pro meritorum diuersitate tractari, agnouit etiam nonnullos, quos nouerat uiuos. ipsos autem uere forsitan credidissem, si non inter illa quasi somnia sua uidisset etiam quosdam, qui nunc usque adhuc uiuunt, clericos uidelicet aliquos regionis suae, a quorum ibi presbytero audiuit, ut apud Hipponem baptizaretur a me, quod et factum esse dicebat. uiderat itaque in illa uisione presbyterum, clericos, me ipsum, nondum scilicet mortuos, in qua postea uidit et mortuos. cur non etiam illos sicut nos uidisse credatur, utrosque scilicet absentes atque nescientes, ac per hoc non ipsos, sed similitudines eorum, sicut etiam locorum? nam et fundum uidit, ubi erat ille cum clericis presbyter, et Hipponem, ubi a me quasi baptizatus est: in quibus locis profecto non erat, quando illic sibi esse uidebatur. nam quid ibi 1 in quo N poenae K 2 reuiuexerat Y intenti 2n aderant om. Y adherant M dixit illum EF exiberi E exliibere AM 3 iussum] uisum f indicabat BTM ut dicebat EF iudicauit 9 seque) sicque E.F 4 se audisse EF 6 in om. F uisis in mg. m. 2 T somnis ATl in aomniie F suis] fuit IZFAM suis fuit Eb sillic nonnullos KY autem uere] ant umare (a ex e tn. 2) K 9 somnia] omnia Y 10 etiam om. E 11 scilicet β om. Y aliquos om . Tp religionis NK a (s. l. paene euan.) B; a legitur ante presbytero in BTMA&F praesbitero B prespitero T presbitero M 12 aput T ipponem IZFT MNEAYv ypponem V baptizetur M.A . 13 est esse V uidera Kl itaque] quippe P presbyrum N praesbiterum B presbiterorum FE presbiterQ KM clericos (cle 8. I. et cos ex cum m. 2) T clericorumque EF 14 mortuum EF 15 quur BIM et nos Y crederetur M.A . credetur BT1 creditur TlF 16 absentes ex habentes K 17 eorum] ipsorum N 18 presbiter ille cum clericis p presbiter BK prespiter TA et om. IZ ipponem NTIZEFYKMA ypponem V 19 quasi a me N me 8 (8 8. I. m. 2) K est om. K 20 namnesciebat in mg. Z ageretur eo tempore, nesciebat: quod procul dubio sciret, si uere ibi esset. uisa sunt igitur ista, quae non praesentantur in ipsis rebus, ut sunt, sed in quibusdam rerum imaginibus adumbrantur. denique post multa, quae uidit, etiam in paradisum se introductum esse narrauit dictumque sibi esse, cum inde dimitteretur rediturus ad suos: uade, baptizare, si uis esse in isto loco beatorum. deinde, ut a me baptizaretur, admonitus iam factum esse respondit. cui rursus ille, qui cum eo loquebatur, uade, inquit, uere baptizare; nam illud in uisione uidisti. post ista conualuit, perrexit Hipponem. pascha iam propinquabat. dedit nomen inter alios conpetentes, pariter cum plurimis incognitus nobis; nec illam mihi uisionem nec cuiquam nostrorum indicare curauit. baptizatus est, peractis diebus sanctis remeauit ad propria. biennio uel amplius transacto ego haec cuncta cognoui: primo per quendam meum eiusque amicum in conuiuio meo, cum quaedam talia loqueremur; deinde institi ac feci, ut haec mihi praesens ipse narraret adtestantibus honestis ciuibus suis et de mirabili eius aegritudine, ut iacuerit paene mortuus per dies plurimos, et de illo alio Curma fabro ferrario, quod commemoraui. superius, et de his omnibus, quae cum mihi diceret, iam 2 essent IZ praestantur BAEMT*yb praesentatar IZ restantur 1" praestatur T1 3 imaginibus rerum F 4 in post paradisum T paradysum Z 6 mitteretur IAEFMV$re*diturus K 7 isto] illo BTAEF beatorumj scorum V baptizatorum F deinde] denique A 8 iam-respondit om. Y cui rursus] curiosus Y 9 aere baptizarej rebaptizare MA baptizari .FFp 10 ita F cflualuit XA ipponem NTIZAEF 11 pasca TEF pascha autem A appropinquabat pr 12 pluribus N aliis plurimis β incognitis Fc ne M ille BTMA uisionem mihi P mihi] hi cp 13 nec) uel NIZAEYK cuiquamj alicui p nostrorum] conseruorum BTAFM 14 uiennio N 15 cnncta haec bd ista cuncta E primum N 16 meum om. B TAM nostrum cp cuiusque Y eiusdem N eias TE cum] dum IKEVYfibd quendam Y 17 loqueretur I ipse om. KY 18 onestis cp suis ciuibus P 19 iacuerat KY poenae K 20 alio illo E ferrario fabro E fabri cp cdmemoraui I 21 cum ex eum m . 2 T mihiJ nichil p iam scripsi: etiam BNTIZKMAEFRYChfabd om. Y et se tunc ab illo audisse recolebant atque firmabant. quamobrem sicut uidit baptismum suum et me ipsum et Hipponem et basilicam et baptisterium non in rebus ipsis, sed in quibusdam similitudinibus rerum, ita et alios quosdam uiuos eisdem nescientibus uiuis. Cur non ergo ita et illos mortuos eisdem nescientibus mortuis? 
16	Cur non istas operationes angelicas credimus per dispensationem prouidentiae dei bene utentis et bonis et malis secundum inscrutabilem altitudinem iudiciorum suorum? siue instruantur hinc mentes mortalium siue fallantur siue consolentur siue terreantur, sicut unicuique uel praebenda est misericordia uel inroganda uindicta ab illo, cui misericordiam et iudicium non inaniter cantat ecclesia. ut uolet accipiat quisque quod dicam. si rebus uiuentium interessent animae mortuorum et ipsae nos, quando eas uidemus, adloquerentur in somnis, ut de aliis taceam, me ipsum pia mater nulla nocte desereret, quae terra marique secuta est, ut mecum uiueret. absit enim, ut facta sit uita feliciore crudelis usque adeo ut, quando aliquid angit cor meum, nec tristem filium consoletur, quem dilexit unice, quem numquam uoluit maestum uidere. sed profecto quod sacer psalmus personat, uerum 10 cf. Rom. 11, 33 13 cf. Pa. 100, 1 1 et se tunc ab illo] se tunc ab illo NKE se nunc ab illo Y et nunc ab illo TAChy tunc ab illo V$BF et tunc ab illo M tunc ab illo se bd audisse se V$adque firmabant 11 et adfirmabant 12 2 et fin. om. N ipponem NTIZAEFK Ycp 3 in pr. om. F 4 alius Y uiros F 5 nioie-nescientibus om. Y uiuis attestabatur F 6 quur IZMB1 ita-angelicas in mg. m. 2 add. T 8 quur ZM ista Y orationes Y fieri credimus E dispensatione Y 9 dei prouidentiae E dei om. K 10 altitudinem inscrutabilem T 11 ut instruantur N falluntur K1 12 uel om. BAM est om. K 14 non \\1i4 (w. 2 exp.) T 15 dicemus E uiuentibus BTJlAEF 16 ipse NIZE ipsi cp eos NKYcp uidemus eas E 17 in somnis om. AFM 18 nocte] ratione KY 19 crudelis] crudis I credula F 20 quid β agit NY angitur BTIZF ne Tcp 21 unicae B mestum TIZEBFKY est: quoniam pater meus et mater mea dereliquerunt me, dominus autem adsumpsit me. si ergo dereliquerunt nos parentes nostri, quomodo nostris curis et rebus intersunt? si autem parentes non intersunt, qui sunt alii mortuorum, qui nouerint, quid agamus quidue patiamur? Esaias propheta dicit: tu es enim pater noster, quia Abraham nesciuit nos, et Israhel non cognouit nos. si tanti patriarchae, quid erga populum ex eis procreatum ageretur, ignorauerunt, quibus deo credentibus populus ipse de illorum stirpe promissus est, quomodo mortui uiuorum rebus atque actibus cognoscendis adiuuandisque miscentur? quomodo dicimus esse eis consultum, qui obierunt, antequam uenirent mala, quae illorum obitum consecuta sunt, si et post mortem sentiunt quaecumque in uitae humanae calamitate contingunt? an forte nos errando ista dicimus et hos putamus quietos, quos inquieta uiuorum uita sollicitat? quid est ergo, quod piissimo regi Iosiae pro magno beneficio promisit deus, quod esset ante moriturus, ne uideret mala, quae uentura illi loco et populo minabatur? quae dei uerba ista sunt. haec dicit dominus deus Israhel: uerba mea, quae audisti et ueritus es a facie mea, cum audisti, quae locutus sum de loco isto et qui commorantur in eo, ut deseratur et in maledicto sit, et conscidisti 1 Ps. 26, 10 5 Es. 63, 16 19 IV Reg. 22, 18-20 1 derelinquerunt KyB1 2 autem om. K ssumpsit Tl assumsit X me om. M ergo] ego Z 8 parentes] patres BTVAEFMTp 4 quid Y 5 nouerunt TFV$quidue] quid E yaaias Y isajas £ 6 enim om. Tl abraam F 7 nos et] nosset Kl et—nos om. F cognoui cpi nos om. N 8 eis] his BTMAFVfrbd 9 populis β ipse om. AM 10 promissus] creatus E 12 esse eis] eis faisse BTMA EFRfiV eis esse NKYy 13 post om. A 14 morte N 15 continguntur cp extingunt F ista om. E hos] eos JVFYptp 16 inquiêtayi (i med . 8. 1.) K inquietam M uita uiuorum BTEFRVYfcbd uita om. AM solitat Z qui Z ergo est V 17 piissimi BA iosie E 18 uentura ęTą.Qţ T 19 ista om. BTAEFM sunt] sunt hec E 20 pro eo quod uerba sqq. E 22 isto loco Tbd commemorantur BKX 23 ut-649, 5 in eo in mg. m. 1 T uestimenta tua, et fleuisti in conspectu meo, et ego audiui, dixit dominus sabaoth. non sic, ecce ego adponam te ad patres tuos, et adponeris cum pace; et non uidebunt oculi tui omnia mala, quae ego induco in locum hunc et qui commorantur in eo. territus iste dei comminationibus fleuerat et sua uestimenta consciderat; et fit omnium malorum futurorum de properatura morte securus, quod ita requieturus esset in pace, ut illa omnia non uideret. ibi ergo sunt spiritus defunctorum, ubi non uident quaecumque aguntur aut eueniunt in ista uita hominum. quomodo ergo uident tumulos suos aut corpora sua, utrum abiecta iaceant, an sepulta? quomodo intersunt miseriae uiuorum, cum uel sua ipsi mala patiantur, si talia merita contraxerunt, uel in pace requiescant, sicut huic Iosiae promissum est, ubi mala ulla nec patiendo nec conpatiendo sustineant, liberati ab omnibus malis, quae patiendo et conpatiendo, cum hic uiuerent, sustinebant? 
17	 Dixerit aliquis: si nulla est mortuis cura de uiuis, quomodo ille diues, qui apud inferos torquebatur, rogabat Abraham patrem, ut mittat Lazarum ad quinque fratres suos nondum mortuos et agat cum eis, ne ueniant et ipsi in eundem tormentorum locum? sed numquid quia hoc ille diues 1 tua] mea BIKI 2 dicit E sabahot IZ IJQO şįç K idcirco E 3 in pace Y 4 occuli K 5 inducam EFV$ commemorantur BxYl in eo in mg. N 6 comminationibus dei β dei] de TAFM de comminationibus B comminatione N 7 conciderat V sit Tl deproperata çp deproperatur amorte K 8 eeset quieturus E pace] parte ji 10 istam uitam E hominum uita Eug 11 hominibus TEFRftbd ergo om. Eug 12 utrum] aut utrum IZ obiecta Y iacent IZ 13 miseria K1 miseriis K2 ipsi sua NE;. ipsa AFM om. T patiuntur MAE 14 huic om. NEug Iosiae] ipsi BTMdEFV3 iosie Y iosiae ex iosuae K 15 promissum est] promisaione confirmatum est E nec mala ulla Eug ulla] nulla (n 8. I.) I, nulla β non K nec conpatiendo om. FMf 16 liberata E 17 hyic K 18 mortuis est p 19 debes Y1 quia K 20 abraam F mitteret EFVPZ*$bd 21 ageret EFVpbd uenirent EFV$bd et om. T 22 diues ille hoc p dixit diuea ille Y diues ille NTEY dixit, ideo quid fratres agerent uel quid paterentur illo tempore sciuit? ita illi fuit cura de uiuis, quamuis quid agerent omnino nesciret, quemadmodum est nobis cura de mortuis, quamuis quid agant utique nesciamus. nam si nihil de mortuis curaremus, non utique pro illis deo supplicaremus. denique Abraham nec Lazarum misit et Moysen ac prophetas hic eos habere respondit, quos audire deberent, ut ad illa supplicia non uenirent. ubi rursus occurrit, quomodo quid hic ageretur Abraham pater ipse nesciebat, ubi sciebat esse Moysen et prophetas, id est libros eorum, quibus homines oboediendo tormenta inferna euitarent, ubi denique nouerat diuitem illum in deliciis, pauperem uero Lazarum in laboribus doloribusque uixisse. nam et hoc illi ait: memento, fili, quia percepisti bona in uita tua, Lazarus autem mala. sciebat ergo haec, quae utique apud uiuos, non apud mortuos gesta fuerant. uerum non cum agerentur in uiuis, sed eis mortuis potuit Lazaro indicante cognoscere, ne falsum sit, quod ait propheta: Abraham nesciuit nos. 
18	 Proinde fatendum est nescire quidem mortuos quid hic agatur, sed dum hic agitur, postea uero audire ab eis. qui hinc ad eos moriendo pergunt, non quidem omnia, sed quae sinuntur indicare, qui sinuntur etiam ista meminisse, 1 cf. Luc. 16, 22 sqq. 13 Luc. 16, 25 1 quod pr. T in illo MAEFV$2 fuit illi E cura fuit AT facerent F 3 omnino om . Tl nescirept F nobis est Fp uobis M cura om. T 4 omnino utique p 6 abraam F ac] et At hac A2 prophetas quin immo hic sqq. EFpV hic-respondit om. TK 7 quos-prophetas in mg. m. 2 T ad om. Kl 8 hic om. TY 9 abraam T pater abraam F ipse om. TMAFV$ibi B esse sciebat FYp moysen esse et prophetae E 11 infemi ME ou*. V uitarent NIZAKv deuitarent p 12 diliciis Ttp delitiis Y 13 recepisti NEVp 14 bona] bona tua NBAM similiter mala V,1 15 quae) quia VF om. BTMA utique om . F[3 aput Y 16 faerant] sunt β non non Y cum non T in eis T mortuus Y defunctos 18 habraham T abraam F . 19 cum uoce Proinde incipit cod . X quod MA 20 nondum ? agatur K1 uero om. XV1 non audire F 22 sinunt BTA1 indicare-sinuntur om. X quae Kf isti <p ita KY et quae illos, quibus haec indicant, oportet audire.. possunt et ab , angelis, qui rebus, quae aguntur hic, praesto sunt, audire aliquid mortui, quod unumquemque illorum audire debere iudicat, cui cuncta subiecta sunt. nisi enim essent angeli, qui possent interesse et uiuorum et mortuorum locis, non dixisset dominus Iesus: contigit autem mori inopem illum et auferri ab angelis in sinum Abrahae. nunc ergo hic, nunc ibi esse potuerunt, qui hinc illuc quem deus uoluit abstulerunt. possunt etiam spiritus mortuorum aliqua, quae hic aguntur, quae necessarium est eos nosse et quos necessarium est ea nosse, non solum praesentia uel praeterita, uerum etiam futura spiritu dei reuelante cognoscere, sicut non omnes homines, sed prophetae, dum hic uiuerent, cognoscebant, nec ipsi omnia, sed quae illis esse reuelanda dei prouidentia iudicabat. mitti quoque ad uiuos aliquos ex mortuis, sicut e contrario Paulus ex uiuis in paradisum raptus est, diuina scriptura testatur. nam Samuhel propheta defunctus uiuo regi Sauli etiam futura praedixit: quamuis nonnulli non ipsum fuisse, qui potuisset magicis artibus euocari, sed aliquem spiritum tam malis operibus 6 Luc. 16, 22 16 cf. II Cor. 12, 2 18 cf. I Reg. 28, 7 sqq. 20 cf. de diu. quaest. ad Simpl. II quaest. III 1 haec om. Eug 3 aliquid audire F unumquemque] none quemque BTMA eorum F 4 subiacent E enim om. Eug 5 possunt NMA YEug pr . et om. V 6 ccntingit Kl 7 auferre Kx ferri AEFXVfy ferre M afferri ex auferri <p sinu JJNTKAY habraham T abraae F abraham ABl 8 nunc] non IZ \' ibi] illic ? ubi X hunc X illud I illum NcpX 10 quae alt.] quos Y quia F ea BTMAKYF 11 et-nosse in mg. Z om. F quod Y quae MABT non est BTKMA est om. E ea nosse] eos non nosse BMT2YA non solum necessarium non est eos non nosse non solum praesentia sqq. F praeterita uel praesentia bd 12 etiam om. MA 14 illizi] ipsi Y 15 iudicat M audiebat YKl mittit Y ad uinos om. X 16 aliquos (os add. m. 2) N aliquis Kl e om. BMA paulus quod EF paradysum N\' 17 raptus in mg. m. 2 T est] esse X samuel EFRYVX}vbd 18 defunctus] mortuus β Sauli etiam regi bd 19 nonnulli om. V potuit Zl potuisse TJlIA 20 tam om. F congruentem illius existiment similitudinem figurasse: cum liber Ecclesiasticus, quem Iesus filius Sirach scripsisse traditur et propter eloquii nonnullam similitudinem Salomonis pronuntiatur, contineat in laude patrum, quod Samuhel etiam mortuus prophetauerit. sed si et huic libro ex Hebraeorum quia in eo non est canone contradicitur, quid de Moyse dicturi sumus, qui certe et in Deuteronomio mortuus et in euangelio cum Helia, qui mortuus non est, legitur adparuisse uiuentibus? 
19	 Hinc et illa soluitur quaestio, quomodo martyres ipsis beneficiis, quae dantur orantibus, indicant se interesse rebus humanis, si nesciunt mortui, quid agant uiui. non enim solis beneficiorum effectibus, uerum ipsis etiam hominum aspectibus confessorem adparuisse Felicem, cuius inquilinatum pie diligis, cum a barbaris Nola obpugnaretur, audiuimus non incertis rumoribus, sed testibus certis. uerum ista diuinitus exhibentur longe aliter, quam sese habet usitatus ordo singulis creaturarum generibus adtributus. non enim quia in 2 cf. de doctr. chr. II 8, 13 4 cf. Eccli. 46, 13 7 cf. Dent. 34, 5 cf. Matth. 17, 3 18 cf. Ioh. 2, 9 1 existimant Y similitudinem om. Y flgura esset IZ 2 hie- SUS N filius om. BIZKMAYy1 syrae B syralic T syraac V sirac IZKMAF ae scripsisse Y traditur] testatur KY 3 eloquium BT nonnulla V nullam p 4 contineatyr (exp. m. 2) T laudem K samueel Y samuel EFVfrbd etiam] et MAKFVYBE 5 et om. B TMKAEFVYfibd, ebreorum KM ebraeorum BT hebreorum F 6 in eo] in eorum bd om. AE, in eo post ost legitur in T canhone B cannone <p in canone E moysi Z 7 deuthoronomio N deuteronomium Y 8 elya EV Elia bd legitur om. T1 9 uidentibus c uiuens F 10 Incipit cod. X Hic X quaestio soluitur T quonftmodo KNEug quodammodo (quod add. m. 2) Y sancti martyres T 11 ipsi NyEug orationibus Eug 12 agunt BTAFMVXa 13 affectibus FVp uerum-aspectibus in mg. Z etiam ipsis Abd ipsis om. X 14 cuiuB-diligis] ciuibus vel inquilinis (inquilis F) pie a se dilectis (delictis E) EFVfy 15 a om . Yep oppugnabatur V expugnaretur g pugnaretur X 16 certis testibus E testibus] certibus ..:V om. T certis rebus T 17 exibentur EF quam] ca Y ae BMAF$18 adtribuit Y uinum aqua, cum uoluit dominus, repente conuersa est, ideo non debemus, quid aqua ualeat in elementorum ordine proprio, ab istius diuini operis raritate uel potius singularitate discernere; nec quoniam Lazarus resurrexit, ideo mortuus omnis, quando uult, surgit aut eo modo exanimis a uiuente quomodo a uigilante dormiens excitatur. alii sunt humanarum limites rerum, alia diuinarum signa uirtutum; alia sunt, quae naturaliter, alia, quae mirabiliter fiunt, quamuis et naturae deus adsit, ut sit, et miraculis natura non desit. non igitur ideo putandum est uiuorum rebus quoslibet interesse posse defunctos, quoniam quibusdam sanandis uel adiuuandis martyres adsunt, sed ideo potius intellegendum est, quod per diuinam potentiam martyres uiuorum rebus intersunt, quoniam defuncti per naturam propriam uiuorum rebus interesse non possunt. 
20	Quamquam ista quaestio uires intellegentiae meae uincit, quemadmodum opitulentur martyres his, quos per eos certum est adiuuari: utrum ipsi per se ipsos adsint uno tempore tam diuersis locis et tanta inter se longinquitate discretis, siue ubi sunt eorum memoriae siue praeter suas memorias, ubicumque adesse sentiuntur, an ipsis in loco suis meritis congruo ab omni mortalium conuersatione remotis et tamen 4 cf. Ioh. 11, 44 1 uinum] unum M uolait fecit T1 3 ab] ad IZFA caritaţę (in mg . raritate) T rarite Bl raritatem IZAF singularitatem IZAF 4 neque V ideo] ita V 5 surget Eug surgit—modo] resurrexerunt tantummodo X eo] quo Y 6 uigiljante K exitatur F humanoram BTA1 7 limites] milites TFAX rerum om. X alia sunt p diuinorum MB om. T\' 9 Bssit NV ut sit om. KYf 10 rebus om. X posse om. KY 11 defunctis X 12 adBunt-martyres om. X 13 prouidentia (a . i potentia m. 2) T rebus om. T* intersont-rebus om. X 14 interesse non possunt] intersunt K 16 meae intellegentiae F uincat KYXM uicit f uicerit Eug 17 quemammodum NBX oppitulentur tp iis$bd quod Y 18 utrum om. MA ipsis T assint K asserit β 19 longitudine E 20 sine pr. om. X propter X 21 locis Tl 22 omni om . tp semotis NKYrp generaliter orantibus pro indigentia supplicantum — sicut nos oramus pro mortuis, quibus utique non praesentamur nec ubi sint uel quid agant scimus — deus omnipotens, qui est ubique praesens nec concretus nobis nec remotus a nobis. exaudiens martyrum preces, per angelica ministeria usquequaque diffusa praebeat hominibus ista solacia, quibus in huius uitae miseria iudicat esse praebenda, et suorum martyrum merita ubi uult, quando uult, quomodo uult, maximeque per eorum memorias, quoniam hoc nouit expedire nobis ad aedificandam fidem Christi, pro cuius illi confessione sunt passi, mirabili atque ineffabili potestate ac bonitate commendet. res est haec altior, quam ut a me possit adtingi, et abstrusior, quam ut a me ualeat perscrutari. et ideo quid horum duorum sit, an uero fortassis utrumque sit, ut aliquando ista fiant per ipsam praesentiam martyrum, aliquando per angelos suscipientes personam martyrum, definire non audeo. mallem ab scientibus ista perquirere. neque enim nemo est, qui haec sciat, non qui sibi scire uideatur et nesciat. dona enim dei sunt his alia et illis alia largientis secundum apostolum, qui dicit unicuique dari manifestationem spiritus 1 orantes X orationibus EtlfJ indigentiis IZEbd supplicantiura TAFVXp 3 Bcimusj sed X omnipotens deus VX 4 nobis pr. om. X 5 exaudiat FA2 exaudiet BTMAX misteria Y ministerifi ; 6 et praebeat A 7 praebendum F merita martyrum (martyrum Onl. K) KMKEVRXfibdEug meritum martyrum BT1 meritortl martvrura T1 martirum meritum F merito martyrum A 8 uult expedire nobis X quomodo uult, quando uult Eug quando uult om. I quomodo uult om. X maxime qui BF 9 nouit] nobis 1" expedire om. T nobis om. Y 11 mirabiliaque Kl hac X bonitatS o commendat E commendata X 12 res haec altior est TEFVabd est om. BMA haec om. A ut-quam om. V possit] debeat EłI!I 13 ualeat] possit E 14 duum V utrumque sit om. V ut om. JET 15 ista-aliquando om. X ipsa praesentia N aliquando-martyrulO om. Tx 16 persona YXl personas X3 17 mallem enim E a EVbd ab scientibus] absentibus M 18 non qui] numquid X sibi om. FA uideatur scire X post nesciat repetuntur numquid-nesciat in X 19 alia sfyyt K illis] his X largiendis <p largientes Bl 20 dati T ad utilitatem. alii quidem, inquit, datur per spiritum sermo sapientiae; alii sermo scientiae secundum eundem spiritum; alteri autem fides in eodem spiritu; alii donatio curationum in uno spiritu; alii operationes uirtutum; alii prophetia; alii diiudicatio spirituum; alii genera linguarum; alii interpretatio sermonum: omnia autem haec operatur unus atque idem spiritus diuidens propria unicuique prout uult. horum omnium spiritalium donorum, quae commemorauit apostolus, cuicumque data est diiudicatio spirituum, ipse scit ista sicut scienda sunt. 
