8	 Legimus in ecclesiastica historia, quam graece scripsit Eusebius et in latinam linguam uertit Rufinus, martyrum corpora in Gallia canibus exposita canumque reliquias atque ossa mortuorum usque ad extremam consumptionem ignibus concremata eosdemque cineres fluuio Rhodano, ne quid ad memoriam qualemcumque relinqueretur, inspersos. quod non ob aliud credendum est diuinitus fuisse permissum, nisi ut discerent christiani in confitendo Christum, dum contemnunt hanc uitam, multo magis contemnere sepulturam. hoc enim quod ingenti saeuitia de corporibus martyrum factum est, si eis quidquam noceret, quo minus beate requiescerent eorum uictoriosissimi spiritus, non utique fieri sineretur. re ipsa 11 cf. Ruf. Patrol. 21 sqq.; Euseb. 5, 1 ed. Migne uol . 19-24 1 cessare. Ubi copungitur sternitur ubi dns ac deus requirebat ubicumque sqq. X 2 enim om. T; enim-requies om. MACh iacet pr. K spiritus T 4 quod Xv siue sit E 5 exspectat N expe.tat M uitam suam $bd 6 cui-uitam om. TMKAFYCh detraxerat K exiens X 7 sed om. K 8 carng β ad poenam] eusebius (in mg . ad penii) V 9 reuiaescant NTATB1 reuiuescat Chi reuiuiscant KE reuiuescapt F hic finittur cod. X 10 istoria FY Jjjstoria N grecae B 11 eusibus E rufinus (s. I . hieronimus) A 12 galliis <p canumque] eorflque ACh Naquf (s. I . I nec non) F atque om. V 13 ossaque V consummationem NKo consumationem Y 14 rodano BTIZEKFVY15 inspresos Y 16 diuinis 1 17 discenrent K drent 3 in om. AEM xpo A contempnunt TMYK1 18 contempnere B condemnere Kx 19 ingente IZ seuitia TMKE martirum K 20 quicquam NTEMKfcCh beato NBIZMKCh beati EFR 21 sineretur fieri β sinerent (n fin. s. I.) K ergo ipsa fs ergo declaratum est non ideo dixisse dominum: nolite timere eos qui corpus occidunt et postea non habent quid faciant, quod non esset permissurus aliquid eos facere de suorum corporibus mortuorum, sed quoniam quidquid facere permissi essent, nihil quo minueretur christiana defunctorum felicitas fieret, nihil inde ad sensum post mortem uiuentium perueniret, nihil ad detrimentum saltem ipsorum corporum. quo minus integra resurgerent, pertineret. 
9	 Et tamen ex illo humani cordis affectu, quo nemo umquam carnem suam odio habet, si cognoscant homines aliquid post mortem suam suis corporibus defuturum, quod in sua cuiusque gente uel patria poscit sollemnitas sepulturae. contristantur ut homines et quod ad eos post mortem non pertinet, ante mortem suis corporibus timent: ita ut inueniatur in Regnorum libris deus per prophetam minari alteri prophetae, qui eius transgressus est uerbum, quod non inferretur cadauer eius in sepulcrum patrum eius. quae scriptura sic se habet. haec dicit dominus: quia inoboediens fuisti ori domini et non custodisti mandatum quod tibi 1 Luc. 12, 4 9 cf. Eph. 5, 29 18 III Reg. 13, 21. 22 1 est om. I 2 occidunt corpus T,1 habeant M 3 aliquid permissurus T eos om. V 4 mortuorum1 martirum Y quicquid TMYCh quid Kl facere om. T 5 permisisset cp 6 ad sensum] assensum T uiuendum N 7 proueniret Ncp nihil-pertineret om. F ealtim BMKCh 8 resurgent MAE 9 humani in mg. T quod N 10 hodio Yjft habuit E agnoscant N 11 post mortem suam aliquid F defuncturum Bl defunctorum TYb defunctis obesae (8. l . defuturum) R defunctis obesse EF 12 poscitj possit Y eollempnitas TV solempnitas Ch 13 et] ut m quos β non pertinet post mortem A Ch post mortem in mg. T 14 pertinet] pertiaebit pertinet IZNB pertinebit pertineat cp pertinet dolent K suis corporibus timent om. ChNBTIZYMKAy ita utj quod EF inoeniatur (ni 8. I.) T inuenitur EF 15 regum E 16 est om. V inferetur MKX ferretur Al 17 eius om. N\'fi sepulchrum MEKY eias- 635, 4 patrum om. V sic scriptura ACh sic habet RYbd 18 quoniam TRbd 19 praecepit tibi NIZRţrbà praecepit dominus deus tuus, et reuersus es et comedisti panem et bibisti aquam in loco in quo praecepit tibi, ne comederes panem neque biberes aquam, non inferetur cadauer tuum in sepulcrum patrum tuorum. quanti haec poena pendenda sit, si secundum euangelium cogitemus, ubi post corpus occisum nihil metuendum esse didicimus, ne membra exanima patiantur, nec poena dicenda est. si autem humanum erga suam carnem consideremus affectum, potuit inde terreri uel contristari uiuus, quod sensurus non erat mortuus; et haec erat poena, quoniam dolebat animus id de suo corpore futurum, quamuis cum fieret non doleret. hactenus enim uoluit dominus seruum suum plectere, qui non sua contumacia spreuerat praeceptum eius inplere, sed aliena decipiente fallacia oboedire se credidit, quando non oboediuit. neque enim putandum est ita fuisse interemptum morsu bestiae, ut ad supplicium tartareum eius deinde anima raperetur, quandoquidem ipsum eius corpus idem leo qui occiderat custodiuit iumento etiam, quo uehebatur, inlaeso et simul cum illa inmani fera intrepida praesentia ad sui domini funus adstante. quo mirabili signo adparet hominem dei cohercitum potius temporaliter usque ad mortem, quam punitum esse post mortem. de qua re apostolus, cum propter quasdam offensas commemorasset infirmitates 1 reuersusJ regressus E es et om . p 2 praecepitibi Z 3 comederis N biberis N 4 inferretur T sepulchrum TME sepulchro 9 5 quanta V si om. NTIZFYB\'KlJIA.tRI 7 dicinius IY nec o membrae K exanimata FEpAICh 8 dicendum eltt carnem suam p Y10 erat poena haec E quoniam] quod Fp qua F 12 non om. Ax actenus ChTEKBlMY 13 qui. B contumatia ZY contomatia sp 14 adimplere p 15 putandum] credendum F 16 interemtum BY baestiae K thartareum N 17 eius deinde] eiusdem Yy anima deinde E quodquidem ACh1 18 leo] loco T quod Ch1 uebatur Ch1 19 inmani] in manu V intrepidę.\' F 20 ad] et ad F aetante Vbd signtt Y appareret IZE 21 coercitum IZFR$f potius om. K temporaliter] corporaliter E 23 propter] pro EFV$quibusdam EFV p quaadam quorundam 9 offensis EF$ mortesque multorum, si enim nos ipsos, inquit, iudicaremus, a domino non iudicaremur; cum iudicamur autem, a domino corripimur, ne cum mundo damnemur. eum sane ipse qui deceperat in monumento proprio satis honorifice sepeliuit seque sepeliendum iuxta eius ossa curauit, ita sperans parci posse quoque ossibus suis, cum ueniret tempus, quando secundum illius hominis dei prophetiam Iosias rex Iuda in illa terra multorum eruit ossa mortuorum eisdemque ossibus sacrilega altaria, quae sculptilibus constituta fuerant, funestauit. pepercit quippe illi monumento, ubi iacebat propheta, qui ante annos amplius quam trecentos ista praedixerat; et propter ipsum nec illius, qui eum seduxerat, sepultura uiolata est. affectu namque illo, quo nemo umquam carnem suam odio habet, prouiderat cadaueri suo. qui occiderat mendacio animam suam. ex hoc igitur, quod carnem suam quisque naturaliter diligit, et illi poena fuit addiscere non eum futurum in sepulcro patrum suorum et huic cura prospicere, ut parceretur ossibus suis, si iuxta eum iaceret, cuius sepulcrum nemo uiolaret. 
10	 Hunc affectum martyres Christi certantes pro ueritate uicerunt. nec mirum quia contempserunt, quod non fuerant peracta morte sensuri, qui non potuerunt eis, quos uiuentes sentiebant, cruciatibus uinci. poterat utique deus. 1 I Cor. 11, 31. 32 5 cf. III Reg. 13, 24 sqq.; IV Reg. 23, 16 sqq. 1 mortes (que er.) M nos-3 a domino om. V inquid <p om. T 2 a domino om. E non] non a domino j3 non utique E 3 autt-m om . ? ac] ut non F hoc mundo Eff dampnemur Y 4 eum] cum BM 5 oasa eius bd curauit ossa A 6 parci posse sperans E quoque posse Vp quoque om. Nf 8 iude IZ 9 sculptibilibus X scultilibus IZy1 10 funestauit] festinauit F 12 seduierit T 13 affectuip K qua T A 14 habuit (s. l . t habet) E prouidit IZ 15 mendatio KM 16 naturaliter quisque E paena M 17 sepnlchro IZ sepulcrum E sepulcr$18 hac F pasceretur IZl iwcta; iusta Y 19 uigjlaret (s. gi pos. o) K 20 pro ueritate certantea bd 21 nec mirum om. TAMFB1 contemserunt NT condemserunt A\' 22 perhacta I more Tl securi Y qui] quod Y 23 cruciantibus;. itaque F qui leonem prophetae corpus, quod ipse occiderat, ulterius non permisit adtingere et fecit de peremptore custodem, poterat, inquam, a suorum interfectis corporibus canes, quibus fuerant proiecta, prohibere; poterat et ipsorum hominum innumerabilibus modis terrere saeuitiam, ne cadauera incendere, ne cineres dispergere auderent: sed hoc quoque experimentum multiplici uarietati temptationum deesse non debuit, ne fortitudo confessionis, quae inmanitati persecutionis pro corporis salute non cederet, pro sepulcri honore trepidaret, postremo, ne fides resurrectionis consumptionem corporum formidaret. debuerunt ergo et ista permitti, ut etiam post haec tanti horroris exempla martyres in Christi confessione feruentes huius quoque testes fierent ueritatis, in qua didicerant eos, a quibus sua corpora interficerentur, postea nihil habere quod facerent, quoniam quidquid mortuis corporibus facerent, utique nihil facerent, quando in carne omni uita carente nec aliquid sentire posset, qui inde migrauit, nec aliquid inde perdere, qui creauit. sed inter haec, quae fiebant de corporibus occisorum, cum martyres non ea metuentes magna fortitudine paterentur, tamen apud fratres luctus ingens erat, quod nulla dabatur potestas sanctorum funeribus iusta persoluere nec occulte subtrahere aliquid, sicut eadem testatur historia, 2 peremtorem M 3 aų K 4 ipaorum] ipsam BTKMAFVY} 5 teneri Å nec Y 6 ne cineres] nec ineres Kl nec in auras K2 nec in aerem ?p disperdere Y huic EF experimento EF 7 multiplex EF multiplici uarietate] multiplicauerit TA uarietateBM om. EF tentationi N tentatio EF ne om. Tl 8 immanidati V 9 pro om . 9 10 consummationem N consumgtionem (s . 4 add . p) F 11 ergo om. E ista] ita N 12 horroris] honoris BTMAFYob martyres (tyres add. m. 2) K 13 didicerant ex dicerent m. 2 T\' 15 quicquid TMY quiquid Nl facerent mortuis corporibus K utique nihil om. K; utique nihil facerent om. TMAFY 17 aliquid] aliud V sentire-aliquid om. At posse T possit IZE migraret TMKAFY 18 perderet NA2rp sed (ed 8. 1. m. 2) A qui BFT1 19 ea non bd eft etuentes Kx 20 ingens iactus E fluctus B erat om. N 21 iusta] ista K 22 occultae B oculte K occulta ^ aliquid occulte snbtrahere EK enptrahere m hystoria E istoria FjJ crudelium custodum uigiliae permittebant. ita cum illos, qui occisi fuerant, in dilaceratione membrorum suorum, in conflagratione ossuum, in dispersione cinerum miseria nulla contingeret, istos tamen, qui nihil eorum sepelire poterant, magna misericordia cruciabat, quia in nullo modo sentientibus ipsi quodam modo sentiebant et, ubi iam illorum nulla erat passio, erat istorum misera conpassio. 
11	 Secundum istam quam dixi miseram conpassionem laudantur illi et a rege Dauid benedicuntur, qui Saulis et Ionathae ossibus aridis sepulturae misericordiam praestiterunt. quae tandem misericordia praestatur nihil sentientibus: an forte reuocandum est in opinionem, quod infernum fluuium insepulti non poterant transmeare? absit hoc a fide christiana: alioquin pessime actum est cum tanta martyrum multitudine, quorum non potuerunt corpora sepeliri, et fallaciter eis ueritas dixit: nolite timere eos, qui corpus occidunt et postea non habent quid faciant, si eis tanta mala 1 cf. Eus. Hist. eccl. V, 1 9 cf. II Reg. 2, 5 12 cf. Yerg. Aen. 6, 327 16 Luc. 12, 4 1 qui in mg. m. 2 T 2 occisi om. TMAFB1 fuerant in mg. m. 2 T in fin. om. V 3 ossuum BNITyehZMKIElcpp ossurn r os suum A ossium FREPKlbd dispersione m. 2 ex dispensatione T contingeret et 9 4 in istos F nichil T sepelire] sentire F potuerant IZ magnal iniusti magna F 5 misericordia] seuitia F cruciebat T cruciabant Y in] his Mom. EFNlf sentientibus— modo om. Y sentientibus] his seuientibus F his sentientibus E 6 illorumj eorum p erit 1Z 7 erit F iustorft K1 miseraJ mira Nco miseria Blp misericordis IZ cQ passio cp 8 quam dixi in mg. T miram N Acp misericordem IZ miseria p co. passionem ? 9 Dauid-qui om. Nl sauli F 10 ionathe NMYo ionate T misericordie I 11 qug Y tandem] tafli EF misericorda IZ misericordia praestatur] multo. pdg misericordii e4 pstantibus mesericordia co. pstatur sqq. F misericordia cD. pstatur nihil sentientibus multum prodest misericorditer eam praestantibus E praestantur sp 12 hoc reuocandum TEFBVfod in opinionem] ad illam opinionem EFRVp in opinione NKYT2 inferni β 13 transmittere A 14 niultitudine martyrum T 15 poterunt B sepelire Tl eos N 16 et om. As 17 habeant M facere potuerunt, quibus inpedirentur ad loca exoptata transire. sed quia hoc sine ulla dubitatione falsissimum est nec aliquid obest fidelibus negata eorum corporibus sepultura nec aliquid, si exhibeatur infidelibus, prodest, cur ergo illi, qui Saulem et eius filium sepelierunt, misericordiam fecisse dicuntur et ob hoc a rege pio benedicuntur, nisi quia bene afficiuntur corda miserantium, quando ea dolent in mortuorum corporibus alienis, quae illo affectu, quo nemo umquam carnem suam odio habet, nolunt fieri post mortem suam corporibus suis, et quod sibi exhiberi uolunt, quando sensuri non sunt, aliis non sentientibus curant exhibere, dum ipsi sentiunt? 
12	 Narrantur uisa quaedam, quae huic disputationi non neglegendam uideantur inferre quaestionem. feruntur quippe mortui nonnulli uel in somnis uel alio quocumque modo adparuisse uiuentibus atque ubi eorum corpora iacerent inhumata nescientibus locisque monstratis admonuisse, ut sibi sepultura quae defuerat praeberetur. haec si falsa esse responderimus, contra quorundam scripta fidelium et contra eorum sensus, qui talia sibi accidisse confirmant, inpudenter uenire 1 iinpepdirentur K exoptataj exobtata IZrr exportata MEAK (s. I . f expectata) F experta (erta in ras.; in mg . pectata) T 2 ullaj aliqua E 3 eorum-7 in mortuorum in mg. inf. m. 2 T 4 exibeatur Ef fidelibug <p quur AM ergo om. V qui] cQ V 5 saule V saul FE et-sepelierunt om. V$filium eius TRbd sepeliendo E 6 et] sed et F sed TMA1 om. E ob] ex BFYTMEA pio rege V;i 7 quando et a (om. F) dolentibus pro mortuorum corporibus nondumque (que om. F) alienis illo affectu sqq. EF; quando et adolentift (8. l . I ea dolent B) mortuorum BTAKM et ea dolentium Y dolent non fieri mortuorum <p in] et Z 8 umquamj tamquam N 9 relicti nolunt EF quod (s. I. m. 2) uolunt A in corporibus EF 10 que o exiberi E 11 suntj possunt BM non om. MA1 exibere TE dum om. A1 ipsi om. BTIZAMY, er. in f 12 narratur Y quaedam om. TV 13 neglegenda FY inferre 8. I. m. 2 N inserere FY quaestionem om . F 14 nonnulli mortuorum T 15 corpora eorum F eorum om. E tacerent Bl iaterent M 16 ammonuisse NY 17 praeberent IZ praeberet Y esse om. V 19 sensum <p qui taliaJ qualia Y sibi talia p uidebimur. sed respondendum est non ideo putandum esse mortuos ista sentire, quia haec dicere uel indicare uel petere uidentur in somnis. nam et uiuentes adparent saepe uiuentibus dormientibus, dum se ipsi nesciant adparere, et ab eis haec quae somniauerint audiunt dicentibus, quod eos in somnis uiderint agentes aliquid uel loquentes. si ergo me potest aliquis in somnis uidere sibi aliquid quod factum est indicantem uel etiam quod futurum est praenuntiantem, cum id ego prorsus ignorem et omnino non curem, non solum quid ille somniet, sed utrum dormiente me uigilet, an uigilante me dormiat, an uno eodemque tempore uigilemus ambo siue dormiamus, quando ille somnium uidet, in quo me uidet: quid mirum, si nescientes mortui nec ista sentientes tamen a uiuentibus uidentur in somnis et aliquid dicunt, quod euigilantes uerum esse cognoscant? angelicis igitur operationibus fieri crediderim, siue permittatur desuper siue iubeatur, ut aliquid dicere de sepeliendis corporibus suis uideantur in somnis, cum id penitus nesciant, quorum illa sunt corpora. id autem aliquando utiliter fit siue ad uiuorum qualecumque solacium, ad quos pertinent illi mortui, quorum adparent imagines somniantibus, siue ut his admonitionibus generi humano sepulturae commendetur humanitas, quae, licet defunctis non opituletur, culpanda tamen inreligiositate 1 uidemur N 2 quia-indicare om. K qui (3 dicere om. A 3 sompnis V 4 ipsis M apparerere Y 5 quae] qui BNTIZÃFEf Eug . sompniauerint V somniauef p dicentes Bl somnis agentes aliquid uel loquentes uiderint bd 6 aliquis potest g 8 etiam] etiam id Eug 9 prorsus ego i3 ergo B e.go IT omnino] prorsus E omnino prorsus o 10 illi Z dormientg IZ me om. IZ euigilet IZ uigilantem I 11 me om. I edormiat I dormit BAl dormiet V 12 somnum Tl sumpnium V uidit Kl in quo] et in quo Eug . 13 quid] quod Tl ita N sapientes F 14 et] sed 1" 15 cognoscantur IZ 16 crederim Y crediderint <p permittantur 1\' 17 suis corporibus p 18 paenitus BM 19 id] ita F qualelJlcum. que B quale.cumque M 20 pertinet Bt 21 hiis Y ammonitionibus NKVY 23 opituleretur cp opitulentur TY in religione Y neglegitur. aliquando autem fallacibus uisis homines in magnos mittuntur errores, quos talia perpeti iustum est. uelut si quisquam uideat in somnis, quod Aeneas uidisse apud inferos poetica falsitate narratur, et ei cuiuspiam non sepulti adpareat imago loquaturque talia, qualia fertur locutus illi fuisse Palinurus, et cum euigilauerit, ibi corpus eius inueniat, ubi iacere inhumatum, cum somniaret, audiuit, admonitus et rogatus, ut sepeliret inuentum, et quia id uerum esse comperit, credat ideo mortuos sepeliri, ut eorum animae ad loca transeant, unde insepultorum animas inferna prohiberi lege somniauit: nonne ita credens plurimum a tramite ueritatis exorbitat? 
13	 Sic autem infirmitas humana sese habet, ut, cum mortuum in somnis quisque uiderit, ipsius animam se uidere arbitretur, cum autem uiuum similiter somniauerit, non eius animam neque corpus, sed hominis similitudinem sibi adparuisse non dubitet. quasi non possint et mortuorum hominum eodem modo nescientium non animae, sed similitudines adparere dormientibus. pro certo, cum Mediolani essemus, 5 cf. Verg. Aen. 6, 337 sqq.\' 1 fallatibus T1 fallaciis F nisis] suis his B suis hi FM uisis hig T uisis hii A 2 mittantur A talia perpeti] tali delusione appeti (delasione a. I.) F uelud Y 3 eneas NAEFYq 4 poetica] poetica usus (usus in ras.) B, IZM poetica 1134 T poetice causa EF falsitatis E et] et ut TIZEAKIMF eius NT\'MF non sepulti] insepulti F ó loquaturque] et loquatur EF loquatur Y loquatur qui T talia om. EFYA1 qualia om. TB1 refertur NIZBlf illi locutus bd locutus illis F locutus ille p locutus fuisse illi E pallinurus (in mg . polidorus) K 6 inueniatur Y 7 somniared Y ammonitus NKY 8 inuentumj uiuentum V 9 sepelire V 10 prohiberi inferna F prohibere KL 11 nonne (ne s. I. m . 2) K ita] ista NTKVfyd Eug a] ad Y exorbitatur f exhorbitat V 13 Sic] si TMFBlAa se M esse FAl cum] quem BTMKYEAFCh que F 14 mortuum post uiderit habent NlZVMfobd quemque EF arbitretur animam se uidere E anima Y 15 arbitratur V autem uiderit similiter uiuum E somniauerit om. E 16 neque] nec V homines in similitudinem F sibi similitudinem N 19 pro certo] porro Vf \' porro certe EF XXXXI Ang. Sect. V par. Iir. 41 audiuimus, quod cum debitum repeteretur a quodam defuncti patris cautione prolata, quod filio nesciente a patre iam fuerat persolutum, contristari homo grauissime coepit atque mirari. quod ei pater moriens non dixerit, quid deberet, cum fecisset etiam testamentum. tunc ei nimis anxio adparuit idem pater eius in somnis et ubi esset recautum, quo illa cautio uacuata fuerat, indicauit. quo inuento iuuenis atque monstrato non solum falsi debiti calumniam propulsauit, sed etiam paternum recepit chirographum, quod pater non receperat, quando est pecunia persoluta. hic utique putatur anima hominis curam gessisse pro filio et ad eum uenisse dormientem, ut docens. quod ignorabat, magna molestia liberaret. sed eodem ipso ferme tempore, quo id audiuimus, id est nobis apud Mediolanum constitutis Carthaginis rhetor Eulogius, qui meus in eadem arte discipulus fuit, sicut mihi ipse, posteaquam in Africam remeauimus, retulit, cum rhetoricos Ciceronis libros discipulis suis traderet, recensens lectionem, quam postridie fuerat traditurus, quendam locum offendit obscurum, quo non intellecto uix potuit dormire sollicitus. qua nocte somnianti 3 grauissime homo coepit p \'coepit grauissime E mirari] minari JI 4 quod deberet Eug 5 ei om. TKAEFMVYBa nimis om. Eug ancxio Y 6 eius om. Fj3 essent V recautum] reuocatum MAFE1, (in mg. m. 2) T recantum V quod TIZABaM uacua M euacuata Eug 7 fuerit EFIJ( 8 falsi solum E paternum om. F 9 cyrographum NVY cirographum BFa1 T* cirografum ETX chirografum IZ chyrographum <p chiragraphum M1 10 persoluta pecunia bd pecuniag persoluta (soluta Y) Υβ itaque BTMKYEAFRVCksf anima hominis putatur Y animam T 11 pro om. 1 filioli T dormiente YT* 12 a magna ITVbd magnam ? magna eum EFVBabd molestiam o liberaretur Eug terme ipso E 13 quo id] quod I id est] id A item bd om. Er\'Yp mediolanium HZ 14 cartaginis K cartagini* p rethor ZKE retor MA Y rhetor Eulogiusl rhetoricus cp 15 ipse mihi NTFayEug mihi om. A postea ipse T 16 affricam (af add. 8. 1. tn. 2) T, E} africa Yy rettulit NP rethoricos BTKAEM 17 dispulis Tl posttriduo IZ post tridufl F post diem NEVfa Eug post tridue A postero die K post tridie BM postremo (in mg . tridig m. 2) T 18 offendit] ostendit V 19 quadi T somniante TAF . ego illi quod non intellegebat exposui, immo non ego, sed imago mea nesciente me et tam longe trans mare aliquid aliud siue agente siue somniante et nihil de illius curis omnino curante. quomodo fiant ista nescio; sed quomodolibet fiant. cur non eodem modo fieri credimus, ut in somnis quisque uideat mortuum, quomodo fit, ut uideat et uiuum? ambobus utique nescientibus neque curantibus, quis uel ubi uel quando eorum imagines somniet. 
14	 Similia sunt autem somniis nonnulla etiam uisa uigilantium, qui turbatos habent sensus, sicut phrenetici uel quocumque furentes modo. nam et ipsi loquuntur secum, quasi uere praesentibus loquantur, <loquuntur> etiam cum absentibus quam praesentibus, quorum imagines cernunt siue uiuorum siue mortuorum. sed quemadmodum hi, qui uiuunt, ab eis se uideri et cum eis se colloqui nesciunt — neque enim re uera ipsi adsunt aut ipsi sermocinantur, sed turbatis sensibus homines talia uisa imaginaria patiuntur — eo modo et hi, qui ex hac uita migrarunt, sic affectis hominibus uidentur quasi praesentes, cum sint absentes et, utrum aliquis eos imaginaliter uideat, omnino nescientes. 1 illi ego E quae M quod non] ut A et immo E 2 et trans E B curis om. Eug 4 cnrente BxMl ista fiant V quomodolibet fiant] sicut hec fiunt F quomodouiuet (do uiuot in ras.) M 5 fiant om. A quur M credimus fieri BTMAFV$6 mortuumuideat in mg. m. 2 T uideat eum N Eug 7 uel ubi om. V \'8 quorum Vj} 9 somnis MAtp sompniis V in somnis F 10 frenetici BTIZAEFMYfo 11 modo furentes T nam et ipsi locuntur saepe cum uere praesentibus, locuntur etiam cum absentibus quorum imagines sqq. Eug secum quasi] saepe cum NVWp 12 quorum loquantur et tam cum absentibus quam praesentibus lincola subducta delenda assignantur in K loquantur] locuntur Noj locuntur addidi etiam J et tam Kbd 13 quam praesentibus om . <p quam] quasi cum EFR tamquam N quasi p quam cum VlJd si uiuortt Kl 14 sed] sed et o at EF quomodo EF hii AB 15 eis om . g se colloqui] quos F colloqui] cQloqui IZTIM conloqui K loqui AEVfc Eug nesciunt putant F 16 assunt V sunt tp turbati AFTEMB1 18 liii BA affectibus EFM affectus T hominum EF 19 quasi om. Y eos aliquis Pp aliqui Nz Eug 20 eos om. A eorum T Eug uideant © 41* 
