1.1	 Noueram te quidem fama celeberrima praedicante et frequentissimis atque ueracissimis nuntiis quanta esses dei gratia plenus acceperam, beatissime atque uenerande papa Bonifaci. sed posteaquam te etiam praesentia corporali frater meus uidit Alypius acceptusque a te benignissime ac sincerissime mutua miscuit dictante dilectione conloquia tecumque conuiuens et paruo licet tempore magno tibi iunctus affectu se simul et me refudit animo tuo teque mihi reportauit in suo, tanto maior in me tuae sanctitatis est facta notitia quanto certior amicitia. neque enim dedignaris, qui non alta sapis, quamuis altius praesideas, esse amicus humilium et amorem rependere inpensum. quid est enim aliud amicitia, quae non aliunde quam ex amore nomen accepit et nusquam nisi in Christo fidelis est, in quo solo esse etiam sempiterna ac felix potest ? unde accepta per eum fratrem, per quem te familiarius didici, maiore fiducia ausus sum aliquid ad tuam beatitudinem scribere de his rebus, quae hoc tempore episcopalem curam, si qua in nobis est, ad uigilantiam pro grege dominico stimulo recentiore sollicitant. 11 ef. Roni. 12, 16 1 Incipit sei augustini ad bonifaciuin papam 0 aurclii aug ad papS urbis rome bonefaciii lib. I contra eplas iuliani epi pelagianorum incipit B Incipiunt beati aug contra eplm pelagianorum libri quattuor ad boiiifatium epsm urbis rome (liti. mai.) C Explicit retractatio. Incipit liber primus beati augustini epi contra duas eplas Pelagianorum ad bonefacium papam D Incipit epl sci aureli augus aduersus epistl iuliani pelagiani ad bonifacium papa urbisG Incipit eiusdem. cpi. aug adnersus epistulam. iuliani pelagiani. ad bonifaeium papa urbis (lilt. mai.)L Incipit lib aureli agustiui ad papa bnnifaeium (litt. mai.) V; deeodd. EF cf. Pracj . 2 eeleberrimum F 4 atque] ac bvncGL bonefatiOa.c. bonefaci BDGL bonifati C 5 et iam (saepius) EF corporaliaJ corporaliterL corporari V alipiusOCGLV 6 mutua] tuaGL 7 conniuansGp.c. 8 magno] add. tamenZ) estiunctusGL effectu C affectus est mule Oml 9 sanct. tuaeL 10 est] et Ga. c. L quanto L(a in ras.) 11 esso 0 in ras. m2 humilius G a.c.L 12 amare C amoreL est Os.l.mZ 13 more Om1 14 solo] solet B ac Os.l.m2 15 post unde add. et EFbd te] ctGL 16 maiore Ga c. 18 ad uigilantiam] uigilantia B regeLml recentioriGL sollicituntOm2 
1.2	Noui quippe heretici, inimici gratiae dei, quae datur pusillis et magnis per Iesum Christum dominum nostrum, etsi iam cauendi euidentius apertiore inprobatione monstrantur, non tamen quiescunt scriptis suis minus cautorum uel minus eruditorum corda temptare. quibus utique respondendum esset, ne se ucl suos in illo nefando errore firmarent, etiam si non metueremus, ne quemquam catholicorum uerisimili sermone deciperent. cum uero non desinant fremere ad dominici gregis caulas atque ad diripiendas tanto pretio redemptas oues aditus undecumque rimari communisque sit omnibus nobis qui fungimur episcopatus officio — quamuis ipse in ea praemineas celsiore fastigio — specula pastoralis, facio quod possum pro mei particula muneris, quantum mihi dominus adiuuantibus orationibus tuis donare dignatur, ut pestilentibus et insidiantibus eorum scriptis medentia et munientia scripta praetendam, quibus rabies qua furiunt aut etiam ipsa sanetur aut a laedendis aliis repellatur. 
1.3	Haec autem quae duabus epistulis eorum respondeo, uni scilicet, quam dicitur Romam misisse Iulianus — credo, ut per illam quos posset suos aut inueniret aut faceret -, alteri autem, quam decem et octo uelut episcopi participes eius erroris non ad quoslibet, sed ad loci ipsius episcopum sua calliditate temptandum et ad suas partes, si posset fieri, traducendum ausi sunt Thessalonicam scribere, haec ergo, quae istis, ut dixi, duabus epistulis illorum ista disputatione respondeo, ad tuam potissimum dirigere sanctitatem non tam discenda quam examinanda et, ubi forsitan aliquid displicuerit, 2 cf. Rora. 7, 25 8 cf. Verg. Aen. IX GO. Ambrosii Exp. euang. Lucae VII 49 (CSEL XXXII p. IV 301, 26) 1 quippe] add. quod E 2 etsi iam ex et suamO 3 eidentiusOml inprobitate B 4 erud.-temptare C in ras. m2 5 esset resp. DEFbd in om.EF 6nequaquamGL quiquamOjni 7uerissimileGL 8 adominiciOmlC grecisC atque] nequeGL aq: diripiendasOml adiripiendasC 9 ante oues eras. 0 B communis sit causa F nobis omnibus GL 10 eo GL praeemineas bd 11 cekiore Ga.c. fastioOwl spec. past. facio Cs.l.m2 pastoraliOEFGL 13 operationibus Va. c . 14 muniet iactantia L (iact in ras. m2), Va. c . prętendant GL 15 feriunt Om1EF a s. l.B, om.F a lacd.] alendisCL 16 repel- lantur B propellaturGL 19 alte»riO decimZ, 20 partecepsOml 21 ad om.GL ipsius] illius D 22 tessalonicam 0 thesalonicam V thessalonicae DGL 23 quae istis om.GL istiC illorum] eorum B i*sta0 24tuaL potentissimum D diligere C 25 dicenda Lml emendanda constitui. indicauit enim mihi frater meus, quod eas illi dare ipse dignatus es, quae in tuas manus nisi uigilantissima diligentia fratrum nostrorum filiorum tuorum unire non possent. ago autem gratias sincerissimae in nos beniuolentiae tuae, quod eas me latere noluisti litteras inimicorum gratiae dei, in quibus repperisti meum nomen calumniose atque euidenter expressum. sed spero de domino deo nostro, quod non sine mercede, quae in caelis est, illi me lacerant dente maledico, quibus me pro paruulis, nc fallaci laudatori Pelagio perditi relinquantur, scd ucraci saluatori Christo liberandi offerantur, oppono. 
1.4	 Iam itaque Iuliani respondeamus epistulae. dicunt, inquit, illi Manichei, quibus modo non communicamus, id est toti isti, cum quibus dissentimus, quia primi hominis peccato, id est Adae, liberum arbitrium perierit et nemo iam potestatem habeat bene uiuendi:, sed omnes in peccatum carnis suae necessitate cogantur . Manicheos appellat catholicos more illius Iouiniani, qui paucos ante annos hereticus nouus uirginitatem sanctae Mariae destruebat et uirginitati sacrae nuptias fidelium coaequabat. nec ob aliud hoc obiciebat catholicis, nisi quia eos uideri uolebat accusatores uel damnatores esse nuptiarum. 
1.5	Liberum autem arbitrium defendendo praecipitant, ut de illo potius ad faciendam iustitiam quam dc domini adiutorio confidatur atque ut in se quisque, non in domino glorietur. quis autem nostrum dicat, quod primi hominis peccato perierit liberum arbitrium de genere humano ? libertas quidem periit per peccatum, sed illa, quae in paradiso fuit, habendi plenam cum 7 cf. Matth. 5, 12 11 Iulianus 16 cf. Aug. Dehaores. c. 82 (XLII 4G M) 23 cf. I Cor. 1,31 24-426,28 quis-dci fieri] d. Aug. Op. imp. 194 (XLV 1110M) 1 constituit L 2 ipse om.D 3 possint CEFld -1 beneuolentiae EF 5 uolnisti L (u init. s. l.), G a. c . 6 nomen meum DEFbd 7 de s. I. m2U slacerentL ne om.GL 9 fallacia L facili C pelaioO pelagione(7L 10 xpiOm1 11 itaGL illi inquit T7 12 manichaeiO conraunicamusO 13 de∗sentimus O adae 0(ae t.l.m2) 14 arbitrium s.l.mlG,om.L pcriitGLinras . habetOmf 15 necessitate»0 16 iouiani Vml ante paueos annos EPbd 17 haereticusU distrucbatL uirginitati∗0 uirginitate Va.c . 18 nuptiaeL hoc ob aliud B hoc om.0 19 qui La.c. eos om.D nolebatOa.c. 20 esse om. D 22 all. de om.Om1GL 25 hnmano genere DEFbd generi Uml periit s. I. m2 post pecc. 0 26 plenam 0 (e s. ras. m2) inmortalitate iustitiam. propter quod natura humana diuina indiget gratia dicente domino: si uos filius liberauerit, tunc uere liberi eritis, utique liberi ad bene iusteque uiuendum. nam liberum arbitrium usque adeo in peccatore non periit, ut per ipsum peccent maxime omnes, qui cum delectatione peccant et amore peccati et hoc eis placet quod eos libet. unde et apostolus: cum essetis, inquit, serui peccati, liberi fuistis iustitiae. ecce ostenduntur etiam peccato minime potuisse nisi alia libertate seruire. liberi ergo a iustitia non sunt nisi arbitrio uoluntatis; liberi autem a peccato non fiunt nisi gratia saluatoris. propter quod ammirabilis doctor etiam uerba ipsa disereuit: cum enim serui essetis, inquit, peccati, liberi fuistis iustitiae. quem ergo tunc fructum habuistis in his, in quibus nunc erubescitis? nam finis illorum mors est. nunc autem liberati a peccato, serui autem facti deo habetis fructum uestrum in sanctificationem, finem uero uitam aeternam. liberos dixit iustitiae, non \'liberatos\', a peccato autem non liberos, ne sibi hoc tribuerent, sed uigilantissime maluit dicere \'liberatos\' referens hoc ad illam domini sententiam: si uos filius liberauerit, tunc uere liberi eritis. cum itaque non uiuant bene filii hominum nisi effecti filii dei, quid est quod iste libero arbitrio uult bene uiuendi tribuere potestatem, cum haec potestas non detur nisi gratia dei per Iesum Christum dominum nostrum dicente euangelio: quotquot autem receperunt eum, dedit eis potestatem filios deifieri? 2 Ioh. 8, 36 7. 12 Rom. 6,20-22 21 Ioh. 8, 36 25 cf. Rom. 7, 25 26 Ioh. 1,12 lnatura*L diuina V 2 domino in euangelio GL 3 tunc mn.EF 4usque 0 (us s.l.m2) 5 ipsum] illud CDbd 6 amare C et om. DEFGL eos] eis B 9 aliqua C aliena Gm2 ergo om.OB 10 liberati D 11 amirabilis CDa.c . et admirabilisGL 12 istaGL disseruit (in mg. m1 ł discreuit) O 12 inquit om.Oml 13 fiiistiCml iustitiaeL 14 fnict. liab. tunc DEFbd tunc om.V 17 dei V sanctificatione BDVGp.c.L 18 nam liberosOB 21 refer«ensO filios C 22 liberauit B tunc mn.D estis V 23 filii hom.] homines b affecti B (e s. a) 24 uiuendo GL potestatatem 0 20 quodquod V 27eis om.B 
1.6	 Sed nc forte dicant ad hoc esse adiutos, ut haberent potestatem fieri filii dei- ut autem hanc accipere mererentur, prius eum libero arbitrio nulla adiuti gratia receperunt; haec est quippe intentio, qua gratiam destruere moliuntur, ut eam dari secundum merita nostra contendant —. ne forte ergo hanc euangelicam sententiam sic diuidant, ut meritum ponant in eo quod dictum est: quotquot autem receperunt eum ac deinde non gratis datam, sed huic merito redditam gratiam in eo quod sequitur: dedit eis potestatem filios dei fieri, numquid, si quaeratur ab eis quid sit receperunt eum\', dicturi sunt aliud nisi \'crediderunt in eum\' ? ut igitur et hoc sciant ad gratiam pertinere, legant quod ait apostolus: in nullo expauescatis a b aduersariis, quae quidem est illis causa perditionis, uestrae autem salutis, et hoc a deo, quia uobis donatum est pro Christo non tantum ut credatis in eum, sed ut etiam patiamini pro e o — nempe utrumque dixit esse donatum —, item quod ait: pax fratribus et caritas cum fide a deo patre et domino Iesu Christo. legant etiam illud, quod ipse dominus ait: nemo potest uenire ad me, nisi pater, qui misit me, traxerit eum. ubi ne quisquam putet aliud dictum esse \'uenire ad me\' quam \'credere in me\', paulo post, cum de suo corpore et sanguine loqueretur et seandalizati essent plurimi in sermone eius, ait: uerba, quae ego locutus sum uobis, spiritus et uita sunt. sed sunt quidam ex uobis, qui non credunt. deinde subiunxit euangelista : sciebat enim ab initio Iesus, qui essent credentes et quis 7. 9 Ioli. 1, 12 12 Phil. 1, 28. 29 18 Eph. 6, 23 21 Ioh. 6, 44 25. 28 Ioh. 6, G4—G6 1 adhnc 0m1 2 filii dei fieri B hanc autem C recipere V 3 eum om.Cml 4 mosliuntur (1 eras.) V 5 euangelica C 6 qaoOml 7 quod quod V 8 datum V 10 nunquid OmlD 11 et ex ei B, om.O 13 expauiscatis V 15 adeo EF 16 donatum] datumGL 18 aut Va.c . 19 patre nostro 0 20 domino nostro GL legat GL illud] aliud OL, om.Dbd dom. ait ipse D 24 cum] quam V 27 ex] iu GL non s.l.ni2Y 28 Iestis ab initio DKFbd 29 esset tradit. GL trad.] creditunis C traditurus esset eum. et dicebat: propterea dixi uobis, quia nemo potest uenire ad me, nisi fuerit ei datum a patre meo. sententiam scilicet iterauit qua dixerat: nemo potest uenire ad me, nisi pater, qui misit me, traxerit eum. et hoc propter credentes et non credentes se dixisse manifestauit exponens quod dixerat: nisi pater, qui misit me, t r a x e r i t cum, id ipsum aliis uerbis repetendo in eo, quod ait: nisi fuerit ei datum a patre meo. ille quippe trahitur ad Christum, cui datur ut credat in Christum. datur ergo potestas, ut filii dei fiant qui credunt in eum, cum hoc ipsum datur, ut credant in eum. quae potestas nisi detur a deo, nulla esse potest ex libero arbitrio, quia nec liberum in bono erit, quod liberator non liberauerit, sed in malo liberum habet arbitrium, cui delectationem malitiae uel occultus uel manifestus deceptor inseuit uel sibi ipse persuasit. 
1.7	Non itaque, sicut dicunt nos quidam dicere et iste audet insuper scribere, \'omnes in peccatum\' uelut inuiti \'carnis suae necessitate coguntur\', sed si iam in ea aetate sunt, ut propriae mentis utantur arbitrio, et in peccato sua uoluntate retinentur et a peccato in peccatum sua uoluntate praecipitantur. neque enim agit in eis etiam qui suadet et decipit, nisi ut peccatum uoluntate committant uel ignorantia ueritatis uel delectatione iniquitatis uel utroque malo et caecitatis et infirmitatis. sed haec uoluntas, quae libera est in malis, quia delectatur malis, ideo 4 Ioh. 6, 44 11 cf. Ioh. 1,12 datur ergo-praecipitantur) cf. Aug. Op. imp. I 94 (XLV 1110 M) 18 Iulianus, cf. p. 425,15 24 sed haec uoluntas—non potest uelle] cf. Aug. Op. imp. I 94 (XLV 1110 M). ibid. III 118 p. 1297 1 eum esset V 3 sententiam-dixerat in mg. Dml 4 intrauitL quia GL qua D nomo Oml 5 me misit V 6 et non credo om.GL 8 traxit C 9 fueri Oml ei ex et Vm2 10 ille] ipse GL in xpo GL 11 in om. Op. imp . ciun s.l.m20 12 datur lin. 0 14 quod] si C liberu Oml liberauit B liberum V (u ex corr. m2) 16 inseruit uit B (r d.) inseruit DGLb, (r s.l.) C inseuit in rus.V 18 insuper] et super C et omnes B uel GL iniutiBa.c. carni sue B 19 ea∗∗∗B propriaGa.c.L 20 suo D retenentur V(te in ras.) 21 a om.C precipitcnturGL 22 ait OmlC etiani in cisC suaditV sua detO nisi om GL 23 dilcctioneCL 24 iniquitatis om.D 25 quia-malis om.GL libera in bonis non est, quia liberata non est. nec potest homo boni aliquid uelle, nisi adiuuetur ab eo, qui malum non potest uelle, hoc est gratia dei per Iesum Christum dominum nostrum; omne enim quod non est ex fide, peccatum est. ac per hoc bona uoluntas, quae se abstrahit a peccato, fidelis est, quia iustus ex fide uiuit, ad fidem autem pertinet credere in Christum et nemo potest credere in eum, hoc est uenire ad eum, nisi fuerit illi datum. nemo igitur potest habere uoluntatem iustam, nisi nullis praecedentibus meritis acceperit ueram, hoc est gratuitam desuper gratiam. 
1.8	 Hoc isti nolunt elati et superbi nec purgando defensores, sed extollendo praecipitatores liberi arbitrii, qui non ob aliud nobis haec dicentibus indignantur. nisi quia gloriari in domino dedignantur. timuit tamen Pelagius episcopale indicium Palaestinum et, cum ei fuisset obiectum, quod diceret \'gratiam dei secundum merita nostra dari\'. negauit se dicere et eos, qui hoc dicerent. anathemando damnauit. nec tamen defendere aliud inuenitur in libris, quos postmodum scripsit, fraudem se putans hominibus iudicantibus fecisse mentiendo aut nescio quomodo suum sensum uerbis ambiguis obtegendo. 
1.9	 Sed iam uideamus quod sequitur. dicunt etiam, inquit, istas, quae modo aguntur, nuptias a deo institutas non fuisse; quod in libro Augustini legitur, contra quem ego modo quattuor libellis respondi. cuius Augustini dicta inimici nostri in ueritatis odium 1 nec potest-potest uelle] Aug. Op. imp. I 97 p. 1114 3 cf. Horn. 7, 25 4 Rom. 14, 23 6 Rom. 1,17. cf. ILib. 2, 4 7 cf. Ioh. 6, 66 13 cf. I Cor. 1,31 14 cf. De gcstis PcL 14, 30 (CSEL XLII 84, 5) 21 Iulianus 23 Dc nuptiis et conc. II 2 (CSEL XLII 254,14) 1 nec] non Op. imp. 2 uellenis Oml ab eo] EdCV a deoL 5 ab»s- trahit O abtrahit L a s. ras. m20 est om. V 6 qui Oml ad C (d s. l. m2) 7 xpo GL est] add. enim CEFV 9 nullus C ueram om.GL 11 coluntVn.c. etlatiOa.c. defensiores C(crp. m2) 12 liberi snntEF quodOml 13 dicen- tibus] add. nobis GL 14dnmGdmnL pylagiusC episcopalemL iudiu Cml 15 palcstinumODVGL 16 sc] add. hocGL et ex aut B 17 anathe- matizando BCm2DEFbd aliud tamen def. EFbd 19 putans s.l.m20 putant B iudicantibus s.lm20,om.B aut] an EF nesciendo aut quomodo D 20 sensum s.l.m20 21 etiam C qd 0 (d ndd. s.l.m2) inquit bis D 23 quatuor DEFbd libris Oa.c. 24 respondeo GL susceperunt . his eius calumniosissimis ucrbis breuiter uideo respondendum, quia repetit ea postea, ubi unlt ipse insinuare quasi contra nostra ista quid dicant. ubi cum illo, quantum res postulare uidebitur, domino adiuuante certandum est. nunc ergo respondeo nuptias a deo esse institutas et tunc, quando dictum est: propterea relinquet homo patrem suum et matrem suam et adhaerebit uxori suae et erunt duo in carne una, et nunc, propter quod scriptum est: a domino iungitur mulier uiro. neque enim aliud fit etiam nunc quam illud, ut adhaereat homo uxori suae et sint duo in carne una. de ipsis quippe nuptiis, quae nunc fiunt, consultus est dominus a Iudaeis, utrum liceret quacumque causa dimittere uxorem, et isto commemorato testimonio legis adiunxit: quod ergo deus coniunxit, homo non separet. hoc testimonium legis adhibuit etiam apostolus Paulus, cum uiros moneret, ut ab eis diligerentur uxores. absit ergo, ut in libro meo contra haec testimonia diuina iste aliquid legerit; sed uel non intellegendo uel magis calumniando in alium sensum conatur detorquere quod legit. librum autem meum, contra quem se quattuor libellis respondisse commemorat, post damnationem Pelagii Caelestiique conscripsi. quod ideo dicendum putaui, quoniam iste dicit \'ab inimicis suis in odium ueritatis dicta mea fuisse suscepta\', ne ideo quisquam existimet propter hunc librum meum inimicos gratiae Christi nonos hereticos fuisse damnatos. in eo autem libro defensio est potius quam reprehensio nuptiarum. GGen. 2,24 9 Prou. 19, 14 12 cf. Matth. 19,3 14 Matth. 19,6 16 ef. Eph. 5, 25 23 Iulianus . 1 susciperuntO eius] cnim D calumpniomssimis R 2 repeti teaOwii ea. PosteaGL 3 nostra s.l.m20 isti BEFd dicatD ibi BCEFd 5 a deo nuptias (om . esse) EFbd constitutasGL 9 scriptum ex dictum B ad no* (uirg. add, m2) 0 uiro mulier DEFbd 11 uxorisF ipsis om.GL quoqueD 12 nunc] add. quoque Db consep.nltus tu; D 13 quecumqueOwi 14 testimio C dnsZ) 15 separat Oml 17 in s.l.m20 lib»roO 18 iste mn.GL 19 in calumniando D conatus est B 20 quatuor D 21 commcrat Oml pclagi Gml p«elagi L(a eras.) 22 celestiique D celestique L conscribsi (ri s.l.m2)0 24 liunc L(n in ras.) 25 inimici GL 26 in eo] IdeoGL post libro add. s.l.m2 nico G 
1.10	Dicunt etiam, inquit, motum genitalium et commixtionem coniugum a diabolo fuisse repertam et propterea eos qui nascuntur innocentes reos esse et a diabolo fieri, non a deo, quia de hac diabolica commixtione nascuntur. hoc autem sine aliqua ambiguitate Manicheum est . immo sicut dicimus a deo nuptias institutas propter ordinatam generationem filiorum, ita dicimus filiorum gignendorum seminationem sine motu genitalium et sine commixtione coniugum nec in paradiso, si filii gignerentur, esse potuisse. sed utrum talis eorum motus atque commixtio fuisset, si nemo peccasset, qualis nunc est cum pudenda libidine, hinc est quaestio, de qua diligentius postea, si deus noluerit. disputabimus. 
1.11	 Quid tamen isti uelint, quid intendant, quo rem perducere moliantur, adiuncta istius uerba declarant, ubi ait nos dicere: propterea eos qui innocentes nascuntur reos esse et a diabolo fieri, non a deo, quia de hac diabolica commixtione nascuntur . cum itaque nos nec diabolicam dicamus coniugum commixtionem, maxime fidelium, quae fit causa generandorum qui postea regenerandi sunt filiorum, nec homines ullos a diabolo fieri, sed a deo, in quantum homines sunt, et tamen etiam de coniugibus fidelibus reos nasci. tamquam ex oliua oleastrum, propter originale peccatum et propter hoc esse sub diabolo, nisi renascantur in Christo, quoniam diabolus culpae auctor est, non naturae, contra illi paruulos dicentes nullum trahere originale peccatum et ideo non esse sub diabolo, quid efficere laborant, nisi ut illa dei gratia euacuetur in paruulis, qua eruit 1 Inlianus 15 Iulianus 21 cf. Rom. 11, 24 26 Col. 1, 13 1 inquit om.Binl niotum] totumflL genetaliuinF 2 propteeaOwi 3 innocentor B 4 commistione V 5 manifestuniOa.c. sicGmZL dnoL constitutasGL 6 filiorum] add . gignendorum B ita om.C 7 seminatione(;L genetalium V commixtioncm r 8 si s.l.C,om.GL generenturGL 9 potuisse bisD talis bisD 11 disputamus Om1 disputanimus L 13 intendimt T* rem perd.] semper ducereOL 14 aut Va.c . 15 proptea C innocenter OB noscuntur C lGadeoC aeC noscnntur Cml 17 coning∗um L 18 qui] quaeGmlL 19 regenerandae Gm1L hominem L diaboliL 20 adeo CD 21 oleatrum B 24 e contra EF 25 8 Oml 20 laburent Ctnl gratiae V pamolisOr quaeniit (a s.l.) r quaeODr. n o s, sicut dicit apostolus, de potestate tenebrarum et transtulit in regnum filii caritatis suae, quando quidem paruulos negant esse in potestate tenebrarum etiam ante domini liberatoris auxilium ita in eis laudantes opus creatoris, ut misericordaim destruant redemptoris? quam nos quoniam et in maioribus et in paruulis confitemur, \'hoc\' dicit \'sine aliqua ambiguitate esse Manicheum\', cum sit antiquissimum catholicum, unde nouum istorum dogma euertatur hereticum. 
1.12	Dicunt, inquit, sanctos in uetere testamento non caruisse peccatis, id est nec per emendationem a criminibus fuisse liberos, sed in reatu a morte fuisse deprehensos . immo dicimus uel ante legem uel tempore ueteris testamenti a peccatis fuisse liberatos non uirtute propria, quia maledictus omnis qui spem suam ponit in homine — et in hoc sine dubio maledicto sunt, quos etiam psalmus diuinus notat: qui confidunt in uirtute sua —, nec uetere testamento, quod in seruitutem generat, quamuis certae dispensationis gratia diuinitus datum sit, nec ipsa lege sancta et iusta et bona, ubi scriptum est: non concupisces, quoniam non est data, quae posset uiuificare, sed praeuaricationis gratia posita est, donec ueniret semen cui promissum est, sed liberatos esse per sanguinem ipsius redemptoris, qui est unus mediator dei et hominum homo Christus? Iesus. isti autem inimici gratiae dei, quae data est pusillis et magnis per legum Christum dominum nostrum, ideo dicunt antiquos homines dei perfectae fuisse 6 Iulianus, cf. p. 431, 4 9 Iulianus 13 Hicr. 17, 5 15 Ps. 48, 7 16 cf. Gal. 4, 24 18 cf. Rom. 7, 12 Ex. 20,17. Rom. 7, 7 19 cf. Gal. 3, 21. 19 21 cf. I Tim. 2, 5 23 cf. Rom. 7, 25 1 nos] cosGL 2 regno DG a. c. post filii eras. suae 0 claritatisGL suae s.l.m20 4 etiam om.Oml di Oml 5 reitemptoris Om1 redemtoris V nos om.GL quoniam om. B quoniam et] etiam s.l.m20 etiam et EF 6 minoribus B a.c. hec B dici OmlGL *sine*0 7 esse] add. sensurn OB 8 docmaO digma La.c . dogme uertatur V eucrtitur Lb hereticorum B ereticumGmi 9 ueteri OCm2GLb 10 emundationemGi suis se B libera- tosL,b in mg . 11 reprehensosGL uel om.L 12 nouirtute Oml 13 homo (inras. L) omnisGL 14 hominem L maledicti C (i jin. ex e),Lb 15pr. quodD 16 ueteri OGm2 ue»teri L uc«tcre V in om.EF seruitute CV genera*tL 17 certe OmlVGL grada V 18 lege.0 et pr. om.OB concupiseis V 19 praeuaricationiOml 22 homo s.l.m20 iustitiae, nc Christi incarnatione, passione, resurrectione, cuius fide salui facti sunt, credantur eguisse. 
