3.2	 \'Legem ueteris testamenti nos\' aiunt \'dicere non ob hoc datam fuisse, ut iustifiearet oboedientes, sed ut grauioris fieret causa peccati\'. prorsus non intellegunt quid de lege dicamus, quia id quod dicit apostolus, quem non intellegunt, dicimus. quis enim dicat non iustificari eos qui sunt legi oboedientes, quando, nisi iustificarentur, non possent esse oboedientes? sed dicimus lege fieri, ut deus quid fieri uelit audiatur, gratia uero fieri, ut legi oboediatur; non enim auditores legis, ait apostolus, iusti sunt apud deum, sed factores legis iustificabuntur. lex ergo auditores iustitiae facit, gratia factores. quod enim inpossibile erat legis, ait idem apostolus, in quo infirmabatur per carnem m, misit deus filium suum in similitudine carnis peccati et de peccato damnauit peccatum in carne, ut iustitia legis inpleretur in nobis, qui non secundum carnem ambulamus, sed secundum spirit u m. ecce quod dicimus, orent, ut aliquando intellegant, non litigent, ut numquam intellegant. inpossibile enim est legem inplere 8 Iulianus 15 Rom. 2, 13 18 Rom. 8, 3. 4 2 ea] add. quae r 3 queOml,mn.b protcxpreB 6 seeundoqu*eO 8 legem B (1 in mg.) dire Om] dixisse D 9 datu V oboedientem V grauior Vb lOdicimusC lldixitB 12 obo* dientes F (e eras.) nisi] si non D si b (in mg . al nisi) 13 obo*dientes V 14 gratia-oboediatur om.OB 15 obo*diatur V 18 inpossiuile Oml legi Cm2DVb eidem Cml 19infirmamur D per] in D 20 similitudinem ODb 24o*rentO litigent r (i pr. in ras.) 25 inpossiuile Oml est enim CDEFbd impleri BD per carnem, hoc est per carnalem praesumptionem, qua superbi ignorantes dei iustitiam, id est quae ex deo est homini ut sit iustus, et suam uolentes constituere, tamquam per eorum non adiutum diuinitus arbitrium lex possit inplcri, iustitiae dei non sunt subiecti. ideo iustitia legis in eis inpletur, qui non secundum carnem ambulant, id est secundum hominem ignorantem dei iustitiam et suam uolentem constituere, sed ambulant secundum spiritum. quis autem ambulat secundum spiritum, nisi quisquis agitur dei spiritu? quotquot enim spiritu dei aguntur, hi filii sunt dei. ergo littera occidit, spiritus autem uiuificat. nec littera malum est, quia occidit, sed malos praeuaricatione conuincit. lex enim sancta et mandatum sanctum et iustum et bonum. quod ergo bonum est, inquit, mihi factum est mors? absit. sed peccatum, u t appareat peccatu m, per bonum mihi operatum est mortem, ut fiat supra modum peccator aut peccatum per mandatum. ecce quod est \'littera occidit\'. aculeus enim mortis est peccatum, uirtus autem peccati lex; auget quippe prohibendo peccati desideria et inde occidit, nisi subueniendo uiuificet gratia. 
3.3	Ecce quod dicimus, ecce unde nobis obiciunt, quod sic \'legem\' dicamus \'datam ut grauioris sit causa peccati\', non audientes apostolum dicentem: lex enim iram operatur; ubi enim non est lex, nec praeuaricatio, et: lex praeuaricationis gratia proposita est, donec ueniret semen cui promissum est, et: si dataesset lex quae posset uiuificare, omnino ex lege esset iustitia. sed conclusit scriptura omnia sub 2 cf. Rom. 10, 3 5 cf. Rora. 8, 4 8 Rom. 8, 14 10 II Cor. 3, 0 12Rom. 7,12. 13 18 I Cor. 15, 56 22 Iulianus 23 Rom. 4, 15 24 Gal. 3, 19. 21. 22 1 hoc est pracsumptionem om.i\' quia CEF qu»a I\' 2 innorantes B 4 posset b sint V 6 uolentes V 7 ambulabant 0 quis-spiritum in mg. mZ add. OV 8 agitur] ambulat OB quodquod V 9 dei spiritu DEFbd liii V 11 praeuaricationes C 16 super CEFV peecator aut] peccans Db 17 quod] quid DEFbd 19 perhibendo C 20 uiuificaretO adiuuet r,6 in mg . 21 sic] si V 22 dicamus bis pos. D grauior V grauioresset O (t add.m2) 25 posita CDEFbd 27 possit r omnino] uere D peccato, ut promissio ex fide Iesu Christi daretur credentibus . hinc est quod uetus testamentum ex monte Sina, ubi lex data est, in seruitutcm generat, quod est Agar. nos autem, inquit, non sumus ancillae filii, sedliberae. non sunt itaque filii liberae, qui legem acceperunt litterae, qua possent non solum peccatores, uerum etiam praeuaricatores insuper demonstrari, sed qui spiritum gratiae, quo lex ipsa sancta et iusta et bona possit inpleri. ecce quod dicimus, intendant et non contendant, inluminentur et non calumnientur. 
3.4	Baptisma quoque, inquiunt, non uere homines nouos facere asserunt, id est non plenam dare remissionem peccatorum, sed ex parte filios dei fieri, ex parte autem saeculi filios, id est diaboli, remanere contendunt . mentiuntur, insidiantur, tergiucrsantur; non hoc dicimus. omnes enim homines, qui sunt filii diaboli, etiam filios saeculi, non autem omnes filios saeculi etiam filios diaboli dicimus. absit enim ut filios diaboli dicamus fuisse sanctos patres Abraham, Isaac et Iacob et alios huiusmodi, quando per nuptias generabant, et eos fideles, qui usque nunc et deinceps adhuc generant. nec tamen possumus contradicere domino dicenti: filii saeculi huius nubunt et tradunt ad nuptias. quidam ergo filii saeculi huius sunt et tamen filii diaboli non sunt; quamuis enim diabolus auctor sit et princeps omnium peccatorum, non tamen filios diaboli faciunt quaecumque peccata. peccant enim et filii dei, quoniam, si dixerint se non habere peccatum, se ipsos seducunt et ueritas in eis non est, sed ea condicione peccant, qua sunt adhuc filii huius saeculi; quaucro gratia sunt filii dei, non utique peccant, quia omnis qui natus est ex deo non peccat. filios autem diaboli infidelitas facit, quod peccatum proprie uocatur, quasi solum 2cf. Gal.4,34 3 Gal. 4, 31 lOIulianus 12 cf. Rom. 9, 8. Luc. 20, 34. I Ioh. 3,10 19 Luc. 20, 34 24 cf. I Ioh. 1, 8 27 cf. I Ioh. 3, 9 3 data esset D seruitute Vtnl generans Vb 5 liberae filii EFbd acciperunt V G possint V 7 quod C 10 no*uosO 12 filios saeculi DEFbd 13 contendantOml 14 omnes—diciraus om.D 16 dicamus diaboli D camus (cm . di) C 17 ysaac BC alios] filios C 18 et pr. om.0 19 dominocontradicere EFbd dicenteO 20huiussaeculiB tradunturO 22 diab. sit autor sit et B sit auctor EFbd omnium et princeps D peccatorum omnium B 26 filii adhuc DEFbd post filii eras . di n utique peccant B 28 ppriecatur Om1 proprium b sit, si non exprimatur quale peccatum sit, sicut apostolus cum dicitur, si non exprimatur quis apostolus, non intellegitur nisi Paulus, quia pluribus est epistulis notior et plus omnibus illis laborauit. unde quod ait dominus de spiritu sancto: ipse arguet mundum de peccato, infidelitatem intellegi uoluit. hoc enim cum exponeret ait: de peccato quidem, quia non credi derunt in me, et ubi ait: si non uenis seme te locutus eis fuissem, peccatum non haberent. non enim peccatum antea non habebant, sed ipsam uoluit intellegi diffidentiam, qua nec praesenti et loquenti crediderunt pertinentes ad eum, de quo dicit apostolus: secundum principem potestatis aeris, qui nunc operatur in filiis diffidentiae. ergo in quibus non est fides, filii sunt diaboli, quia non habent in interiore homine cur eis dimittatur quidquid hominis infirmitate uel ignoratione uel omnino aliqua mala uoluntate committitur; illi autem filii dei, qui utique si dixerint se non habere peccatum, se ipsos decipiunt et ueritas in eis non est, profecto, quod sequitur: \'cum confitentur peccata sua\' — quod filii diaboli non faciunt uel non secundum fidem quae filiorum dei propria est faciunt —, \'fidelis est et iustus qui dimittat eis peccata et mundet eos ab omni iniquitate\'. ut autem plenius intellegatur quod dicimus, audiatur ipse Iesus, qui filiis dei utique loquebatur dicens: si autem uos cum sitis mali, nostis bona data dare filiis uestris, quanto magis pater uester, qui in caelis est, dabit bona petentibusse!si enim filii dei non essent, non eis diceret: pateruester, qui in caelis est. et tamen eos malos esse dicit et nosse bona dare filiis suis. numquid inde mali, 2ICor. 15,10 3-6 Ioh. 16, 8. 9 7 Ioh. 15, 22 11 Eph. 2, 2 16 cf. I Ioh. 1,8 18 cf. I Ioh. 1, 9 22 Matth. 7, 11 1 si 8.l.r duale-exprimatur om.Om] 2 si add. Om3 6 quia] quod BCDVbd crediderunt 0(ider s.l.m3) 7 fuissem eis D ei l7 9 anle antea eras. anteaB antea s.l.Otn3,om.D habebant 0 (bant in mg. m3) differentiam 0 diferentia D 10 et ex ncc B 12 oparatur C 14 quicquid nomine iniirmitatis uel igcorantiae EF nominis C uel infirmitate DVbd 15 uel ignorantiae in mg. B ignorantiae BDEFbd committurOmJ 17 eis ex nobis 0 profecto credendo B 18 quo D ficiunt] sint D uel] quç D 20 demittat V 22 filius V 25 se om. B fili Oml esset Om1 26 noster B 27 nosse (e s.l.) esse D unde filii dei? absit, sed inde mali, unde adhuc filii saeculi, iam tamen filii dei facti pignore spiritus sancti. 
3.5	Baptismus igitur abluit quidem peccata omnia, prorsus omnia factorum, dictorum, cogitatorum, siue originalia siue addita siue quae ignoranter siue quae scienter admissa sunt; sed non aufert infirmitatem, cui regeneratus resistit, quando bonum agonem luctatur, consentit autem, quando sicut homo in aliquo delicto praeoccupatur, propter illud gaudens in actione gratiarum, propter hoc autem gemens in allegatione orationum, ibi dicens: quid retribuam domino pro omnibus quae retribuit mihi ? hic dicens: dimitte nobis debita nostra; propter illud dicens: diligam te, domine, uirtus mea, propter hoc dicens: miserere mei, domine, quoniam infirmus sum; propter illud dicens: oculim eis emper ad dominum, quoniam ipse euellet de laqueo pedes meos, propter hoc dicens: turbatus est prae ira oculus meus, et innumerabilia, quibus diuinae litterae plenae sunt, quae alternis uocibus uel exultando de dei bonis uel maerendo de nostris malis a filiis dei dicuntur ex fide, quamdiu adhuc filii sunt etiam saeculi huius pro uitae huius infirmitate, quos tamen deus a filiis diaboli non solum lauacro regenerationis, sed ipsius etiam quae per dilectionem operatur fidei probitate discernit, quia iustus ex fide uiuit. haec autem infirmitas, cum qua usque ad corporis mortem defectu et profectu alternante contendimus magnique interest quid uincat in nobis, regeneratione alia consumetur, de qua dominus dicit: in regeneratione, cum sederit filius hominis in sede maiestatis suae, sedebitis et uos super 6 cf. II Tim. 4, 7 7 cf. Gal. 6,1 9 Ps. 115, 3 11 Matth. 6, 12 12 Ps. 17,2 13 Ps. 6,3 14 Ps. 24,15 16 Ps. 30,10 21 cf. Tit. 3, 5. Gal. 5, 6 22 cf. Rom. 1, 17 26 Math. 19, 28 lalt. filiisC 2 spu0 3baptismuD peccato Oml 4 dittorum B cogi- tatorum 0(pr. t s.Lml) adita C 5 admissa 0 (d s.l.ml) amissa C 8 gaudent V in actio C 9 alligatione morationumO quidJquiC 12 illud] hoc EF diligan C 13 mei] micliiD quiaEFd 15 uellet C 17 plenaOmZ 18 uicibus Dd,b (in mg. al uocibus) 19 quandiu 0 filiis C 20 huius om.b 23 autem] add . est D est autem b qua usque-mortem omY 24 magisque Ir quid 0(d s.l.mT) 25 uindicantOml nunc uincatF nobis] add. donec DVb quid in F consumentur C consumatur D 27 et uos s.l.Om2, om.D sedes duodecim et cetera. regenerationem quippe hoc loco nullo ambigente nouissimam resurrectionem uocat, quam Paulus quoque apostolus et adoptionem et redemptionem nuncupat dicens?: sed etiam nos ipsi primitias habentes spiritus et ipsi in nobismeti ipsis ingemescimus adoptionem expectantes, redemptionem corporis n o s t r i. numquid non per lauacrum sanctum regenerati, adoptati, redempti Į:umus? et tamen restat regeneratio, adoptio, redemptio, quam in fine uenturam nunc patienter expectare debemus, ut tunc filii saeculi huius ex nulla parte iam simus. quisquis igitur baptismati derogat, quod modo per illud percipimus, corrumpit fidem; quisquis autem iam nunc ei tribuit, quod quidem per ipsum, sed tamen postea percepturi sumus, amputat spem. nam si a me quispiam quaesierit, utrum per baptismum salui facti fuerimus, negare non potero dicente apostolo: saluos nos fecit per lauacrum regenerationis et renouationis spiritus sancti. sed si quaesierit, utrum per idem lauacrum omni prorsus modo iam nos fecerit saluos, respondebo: non ita est. item quippe idem dicit apostolus: spe enim salui facti sumus. spes autem quae uidetur non est spes; quod enim uidet quis, quid et sperat? si autem quod non uidemus speramus, per patientiam expectamus. salus ergo hominis in baptismate facta est, quia dimissum est quod peccati a parentibus traxit uel quidquid etiam proprie ante baptismum ipse peccauit; salus uero eius tanta post erit, ut peccare omnino non possit. 4 Rom. 8, 23 15 Tit. 3, 5 19 Rom. 8, 24. 25 1 scdcni Oml et cctera om.b 2 ambigente nullo CDEFbd 3 et pr.om.li redemtionem V noncupat B 4 sed] cd C spiritus habentes EFbd 5 ingemi- scimus BDEFbd 7 nunquidO 8 adoptiuiO et redempti DEFbd redemti/J 9 fine V m2 ucnturumOm2 10 huius sacculiEFVbd 11 baptismatis r quomodo V post illud eras . per illudO 12 eiscr non per ipsum F(non add. m2) 13 accepturi D 14 quisquam DEFbd facto C 15 saUuosO 17 spu Oml 19idem quippeitcm Dbd 21 quis, quidjquicquid B et om.OBD 23 dissum C 24 peccatum b apJ parentibus V a s. erp. cx Cm2 25 eius] hominis Db, om.EF post erit] esse non poteritO esse poterit Db ut omnino peccari V 
3.6	 Quibus ita se habentibus ex his etiam illa quae deinceps nobis obiciunt refelluntur. quis enim catholicus dicit, quod nos dicere iactitant, \'spiritum sanctum adiutorem uirtutis in testamento uetere non fuisse\', nisi cum uetus testamentum sic intellegimus, quemadmodum dixit apostolus: a monte Sina in seruitutem generans ? sed quia in eo praefigurabatur nouum, qui hoc intellegebant tunc homines dei secundum distributionem temporum ueteris quidem testamenti dispensatores et gestatores, sed noui demonstrantur heredes. an uero illum ad testamentum nouum negabimus pertinere, qui dicit: cor mundum erea in me, deus, et spiritum rectum innouain uisceribus meis? aut illum qui dicit: posuit super petram pedes meos et direxit gressus meos et in misitin os meum can ticum nouum, hymnum deo nostro? uel illum ante testamentum uetus, quod est a monte Sina, patrem fidelium, de quo dicit apostolus: fratres, secundum hominem dico, tamen hominis confirmatum testamentum nemo inritum facit aut superordinat. Abrahae dictae sunt promissiones et semini eius. non dicit: \'et seminibus\' tamquam in multis, sed tamquam in uno: \'et semini tuo\', quod est Christus. hoc autem dico, inquit, testamentum confirmatum a deo quae post quadrigentos et triginta annos facta est lex non infirmat ad euacuandam promissionem. si enim ex lege hereditas, iam non ex promissione; Abrahae autem per promissionem donauit deus? 
3.7	Hic certe si quaeramus, utrum hoc testamentum, quod dicit confirmatum a deo non infirmari a lege quae post quadringentos 3 Iulianus 5 Gal. 4, 24 10 Ps. 50,12 12 Ps. 39,3. 4 16 Gal. 3, 15-18 1 sese D 2 repcllantur O repelhintur B dicat DEFbd quod nos] quos V 3 iactant CDEF testamento uetere 0 (i ml) ueteri testamento DEFbd 4 talentum Oml 5 apostolus dixit EFbd a monte Sina om.EF 6 hęc D 7 ueteri D 9 nouum] uetus V negauimus V 10 qui ex qucd 0 spm r i i u B 12 sU V supra b 12dire*xitO gressos V 14 ante s.l.Oml 15 synaT7 19 et alt.] in B ex EF 21 cristus C 22 quod s.l. Om2EF, om.CV 23 quadrigentos V et om.EFV factum b est om.CEFV 26repromissionem DEF 28 hoc om D honestamentum C 29 quadrigentos V et triginta annos facta est, utrum nouum an uetus intellegendum sit, quis responderedubitet\'nouum\',sed in propheticis latebris occultatum, donec ueniret tempus quo reuelaretur in Christo ? nam si dixerimus \'uetus\', quid erit illud a monte Sina in seruitutem generans? ibi enim facta est lex post quadringentos et triginta annos, qua lege hoc testamentum promissionis Abrahae infirmari non posse confirmat et hoc quod factum est ad Abraham uult potius ad nos pertinere, quos uult esse filios liberae, non ancilla, heredes ex promissione, non lege, cum dicit: si enim ex lege hereditas, iamnon ex promissione; Abrahae autem per pro missionem donauit deus, ut quod facta est lex post quadringentos et triginta annos ad hoc subintrauerit, ut abundaret delictum, cum per peccatum praeuaricationis conuincitur hominis superbia de sua iustitia praesumentis, et ubi abundauit delictum, superabundaret gratia per fidem iam humilis hominis in lege deficientis et ad dei misericordiam fugientis. ideo cum dixisset: s i enimexlegehereditas, iam non ex promissione; Abrahae autem per promissionem donauit deus — tamquam ei diceretur: ut quid ergo postea lex facta cst?—, subiunxit atque ait: quid ergo lex? cui mox interrogationi reddidit: praeuaricationis gratia proposita est, donec ueniret semen cui promissum est. hoc identidem ita dicit: si enim qui ex lege heredes sunt, exinanita est fides et euacuata est promissio. lex enim iram operatur; ubi enim non est lex, nec 4Gal. 4, 24 9 Gal. 3,18 12 cf.Rom.o,20 16 Gal. 3,18 20 GaI. 3,19 23 Rom. 4, 14. 15 1 trigintas C(exp. m3) utrum om- r 2 dubitet] poteritO non poterit B 3 diximus Oml 4 syna 1\' 5 quadrigentos Tx G habralie Ii nonposse confirmat mn.OB 7 pr . ad] ab OEFbd 8 ex Op. c . 10 repromissionem DEF 11 que B lex est DEFrbd quadrigentos V 12 et om. CEFV habundar et OBCV 13 per om.C hominesC 14 iustia 0 et otn-EF 15 superhabiindaret B superabundauit CDEFbd per fidem iam hic monstratur humilitas hominis B humilitas OCml hominum Oml lege*0 16 confugientis B 18 abraha autem**promissionem 8.1.0m2 repromissionem BD 19 postea facta est lex Db lex postea facta estO/i postea m2 ex posita 0 subiuxit B subinxit D 20 interrogationi*O 21 pposita B posita DEF 22est]su:itC idemptidem B 23 ergo exinanita OB 24 pr . est] sunt C alt . est om D lex — 494,5 promissio om EF 25 lex nOli est B praeuaricatio. quod ait in illo testimonio: si cnim ex lege hereditas, iam non ex promissione;Abrahae autem per promissionem donauit deus, hoc in isto ait: si enim qui per legem heredes sunt, exinanita est fides et euacuata estpromissio, satis ostendens ad fidem nostram pertinere — quae noui est utique testamenti —, quod per promissionem donauit deus Abrahae. et quod ait in illo testimonio: quid ergo lex? atque respondit: praeuaricationisgratiapropositaest, hoc in isto similiter subdidit: lex enim iram operatur; ubi enim non est lex, nec pracuaricatio. 
3.8	Siuc igitur Abraham siuc ante illum iusti siue post eum usque ad ipsum Moyscn, per quem datum est testamentum a monte Sina in seruitutem generans, siuc ceteri prophetae post eum et sancti homines dei usque ad Iohannem Baptistam, filii sunt promissionis et gratiae secundum Isaac filium liberae non ex lege, sed ex promissione heredes dei, coheredes autem Christi. absit enim, ut Noe iustum et prioris temporis iustos et quicumquc ab illo usque ad Abraham iusti esse potuerunt uel conspicui uel occulti negemus ad supernam Hierusalem, quae mater est nostra, pertinere, quamuis anteriores tempore inueniantur esse quam Sarra, quae ipsius liberae matris prophetiam figuramque gestabat. quanto euidentius ergo post Abraham, cui sic declarata est ipsa promissio, ut pater multarum gentium diceretur, quicumque deo placuerunt filii promissionis habendi sunt! non enim ex Abraham et deinceps iustorum generatio uerior, sed prophetia manifestior repperitur. 
3.9	Ad testamentum autem uetus, quod est a monte Sina in seruitutem generans, quod est Agar, illi pertinent, qui 1. 8 Gal. 3,18. 19 4. 10 Rom. 4, 14. 15 13 cf. Gal. 4, 24 17 cf. Rom. 8,17 20 cf- Gal.4,26 23 cf. Gen-17,4 24 cf. Rom. 9,8 27 cf. Gal- 4,24 3 promissione V repromissionem OmlD 4 lege V 5 est alt. om.DEFVbd 6 ostendit Vb utique est EFbd est om.D 7 per om.D deus donauit CV 9 posita DEF 10 subdidit similiter DEFbd 15 iohanne V iiliOml 16 filium 0(ium in ras. m2) 17 dei] suntOB 19 non potuerurit C 20 hyerusalem 17 hrtmO nostra est CDEFbd quamuis enim EF 21 anterioris OV anteriorei inueniuntur EF libera*e 0 liberare C 22 gestat OB 24 diceret C 26 reperitur ODEF cum acceperint legem sanctam et iustam et bonam, putant sibi ad uitain litteram posse sufficere et ideo qua fiant factores legis diuinam misericordiam non requirunt, sed ignorantes dei iustitiam et suam iustitiam uolentes constituere iustitiae dei non sunt subiecti. ex hoc genere fuit illa multitudo, quae aduersus deum in heremo murmurauit et idolum fecit, et illa, quae iam in ipsa terra promissionis fornicata est post deos alienos. sed haec in ipso quoque ueteri testamento ualde reproba est multitudo. illi etiam, quicumque ibi erant, sola quae ibi deus pollicetur terrena promissa sectantes et quid pro nouo testamento ea ipsa significent ignorantes eorum adipiscendorum amore et amittendorum timore dei praecepta seruabant, immo non seruabant, sed sibi seruare uidebantur; neque enim fides in eis per dilectionem operabatur, sed terrena cupiditas metusque carnalis. sic autem praecepta qui facit procul dubio inuitus facit ac per hoc in animo non facit; mauult enim omnino non facere, si secundum ea quae cupit et metuit permittatur inpune. ac per hoc in ipsa uoluntate intus est reus, ubi ipse qui praecipit inspicit deus. tales erant filii terrenae Hierusalem, de qua dicit apostolus: seruit enim cum filiis suis, pertinens ad testamentum uetus amon te Sinain seruitutem generans, quod est Agar. ex ipso genere fuerunt, qui dominum crucifixerunt et in eadem infidelitate manserunt. inde sunt etiam adhuc eorum filii in ingenti multitudine Iudaeorum quamuis iam nouo testamento, sicut prophetatum est, per Christi sanguinem patefacto atque firmato et a flumine, ubi baptizatus magisteriumque professus est, usque ad terminos terrae euangelio diffamato. qui ludaei secundum prophetias quas legunt per omnes sunt terras ubique dispersi, 1 cf. Rom- 7, 12 2 cf- Iac- 4,11 3 cf- Rom- 10, 3 5 cf. Xum-16, 41 7 cf I Par- 5, 25 13 cf- Gal. 5, 6 19 Gal. 4, 25. 24 25 cf. Mattli. 3, 16-17 2 litteraO qua fiant] quasi sint D(sint s-l-) 3queruntZ) 4 uolcntes iustitiam 0 iustitiam om. DEF 6 eremo EF haerrmo V 7 quoque in ipso lJ 8 uetere CDEFlxl reprobataC reprobata Dbd 10 quod Om1 significat r significant Oml 12 conserllabant EF immo non scriiabant om.Oml 13 enim otn V eis] add. quę D 14 carnales V autem] enim D 15 magis uultEFd 16 facte Om1 17 praecppit V 18 hycrusalem V ihrlm D 19 suis om. EF 20 syna r 22 infelicitate 0 infidelitatc ex infirmitate D adhuc etiam filii eoruni CDEFbd 23 in om-DEF iudeorum V 25 et a ex ea Om2- baptizatos C 26 iudei V 27 prophetas quosOB ut ex eorum quoque codicibus christianae non desit testimonium ueritati. 
3.10	Et uetus igitur testamentum deus condidit, quia deo placuit usque ad plenitudinem temporis promissis terrenis tamquam in praemio constitutis promissa uelare caelestia et populo terrenis bonis inhianti et propterea durum cor habenti quamuis spiritalem, tamen in tabulis lapideis legem dare. exceptis quippe librorum ueterum sacramentis, quae sola significandi ratione praecepta sunt — quamquam et in eis, quoniam spiritaliter intellegenda sunt, recte lex dicitur spiritalis — cetera certe, quae ad pietatem bonosque mores pertinentia non ad aliquam significationem ulla interpretatione referenda, sed prorsus ut sunt dicta facienda sunt, profecto illam dei legem non solum illi tunc populo, uerum etiam nunc nobis ad instituendam recte uitam necessariam nemo dubitauerit. si enim Christus nobis abstulit illud grauissimum multarum obseruationum iugum, ne carnaliter circumcidamur, ne pecorum uictimas immolemus, ne sabbato septeno dierum uolumine redeunte ab operibus etiam necessariis quiescamus et cetera huiusmodi, sed ea spiritaliter intellecta teneamus remotisque umbris significantibus in rerum ipsarum quae significantur luce uigilemus, numquid propterea dicturi sumus non ad nos pertinere quod scriptum est, ut alienum quodcumque perditum quis inuenerit reddat ei qui perdidit et alia multa similia, quibus pie recteque uiuere discitur, maximeque ipsum Decalogum, qui duabus illis lapideis tabulis continetur, excepta sabbati obseruatione carnali, quae spiritalem sanctificationem quietemque significat? quis enim dicat non debere obseruare Christianos, ut uni deo religionis obsequio seruiatur, ut idolum non colatur, ut nomen domini non accipiatur in uanum, ut parentes honorentur, ne adulteria, homicidia, furta, falsa testimonia 7cr. Ex. 24,12 22 cf. Leu. 6,3.4 24 cf. Ex. 20.2-17 25cf. Ex.20,11 1 ex o}n.CEF quoque om.1\' 3 cordidit 0 (con sl, i pr- ex e) 4 ante terr. eras. terrenis B in om. V impracmio C 5 ualere EF 6 inhianti ex hinianti 0 9 ante quon. eras . quam B quoniam om- Db 10 quae om. h 11 pcrtinenentia B 14 rectam uitam EF necessaria C 15 nobis xps V jcps suo loco eras. post nobis s.l. add.0 16 ugum Om 1 pr . nec B 17 septimo I) 18 ea»0 20 nunquid 0 22 quisquis Dbd iuenerit Oml 23 uiuere om. D -dicitur DEF maximūque B 25 sanctif ] significationem DEF 29 non homicidia EF perpetrentur, nc uxor, nc omnino res ulla concupiscatur aliena? quis est tam iinpius, qui dicat ideo se ista legis non custodire praecepta, quia est ipse Christianus nec sub lege, sed sub gratia constitutus? 
