1.1	princeps corusco sidere pulclirior, 
1.2	Parthis sagittas tendere doctior, 
1.3	eques Gelonis imperiosior, 
1.4	quae digna mentis laus erit arduae? 
1.5	quae digna formae laus erit igneae? 
1.6	te Leda mallet quam dare Castorem; 
1.7	praefert Achilli te proprio Thetis; 
1.8	victum fatetur Delos Apollinem: 
1.9	credit minorem Lydia Liberum. 
1.10	tu cum per altas impiger ilices 
1.11	freno citatum cornipedem reges 
1.12	ludentque ventis instabiles comae^ 
1.13	telis iacebunt sponte tuis ferae 
1.14	gaudensque sacris vulneribus leo 
1.15	admittet hastam morte superbior. 
1.16	Venus reversum spernit Adonidem, 
1.17	damnat reductum Cynthia Virbium. 
1.18	cum post labores sub platani voles 
1.19	virentis umbra vel gelido specu 
1.20	torrentiorem fallere Sirium 
1.21	et membra somno fessa resolveris: 
1.22	quantus uret tum Dryadas calor! 
1.23	quot aestuantes ancipiti gradu 
1.24	furtiva carpent oscula Naides!
1.25	quis vero acerbis horridior Scythis, 
1.26	quis beluarum corde furentior,
1.27	qui, cum micantem te prope viderit,
1.28	non optet ultro servitium pati,
1.29	qui non catenas adripiat libens
1.30	colloque poscat vincula libero? 
1.31	tu si nivalis per iuga Caucasi 
1.32	saevas petisses pulcher Amazonas,
1.33	peltata pugnas desereret cohors
1.34	sexu recepto; patris et inmemor
1.35	inter frementes Hippolyte tubas 
1.36	strictam securim languida poneret
1.37	et seminudo pectore cingulum
1.38	forti negatum solveret Herculi,
1.39	bellumque solus conficeret decor.
1.40	Beata, quae te mox faciet virum 
1.41	primisque sese iunget amoribus.
2.1	Age cuncta nuptiali
2.2	redimita vere tellus
2.3	celebra toros eriles;
2.4	omne nemus cum fluviis,
2.5	omne canat profundum 
2.6	Ligures favete campi,
2.7	Veneti favete montes,
2.8	subitisque se rosetis
2.9	vestiat Alpinus apex
2.10	et rubeant pruinae. 
2.11	Athesis strepat choreis
2.12	calamisque flexuosus
2.13	leve Mincius susurret
2.14	et Padus electriferis
2.15	admoduletur alnis; 
2.16	epulisque iam repleto
2.17	resonet Quirite Thybris
2.18	dominique laeta votis
2.19	aurea septemgeminas
2.20	Roma coronet arces. 
2.21	procul audiant Hiberi,
2.22	fluit unde semen aulae,
2.23	ubi plena laurearum
2.24	imperio feta domus
2.25	vix numeral triumphos. 
2.26	habet hinc patrem maritus,
2.27	habet hinc puella matrem
2.28	geminaque parte ductum
2.29	Caesareum flumineo
2.30	stemma recurrit ortu. 
2.31	decorent virecta Baetim,
2.32	Tagus intumescat auro
2.33	generisque procreator
2.34	sub vitreis Oceanus
2.35	luxurietur antris. 
2.36	Oriensque regna fratrum
2.37	simul Occidensque plaudat;
2.38	placide iocentur urbes,
2.39	quaeque novo quaeque nitent
2.40	deficiente Phoebo. 
2.41	Aquiloniae procellae,
2.42	rabidi tacete Cauri,
2.43	taceat sonorus Auster.
2.44	solus ovantem Zephyrus
2.45	perdominetur annum. 
3.1	Solitas galea fulgere comas,
3.2	Stilicho, molli necte corona,
3.3	cessent litui saevumque procul
3.4	Martem felix taeda releget.
3.5	tractus ab aula rursus in aulam 
3.6	redeat sanguis, patris officiis
3.7	iunge potenti pignora dextra.
3.8	gener Augusti pridem fueras,
3.9	nunc rursus eris socer Augusti.
3.10	quae iam rabies livoris erit? 
3.11	vel quis dabitur color invidiae?
3.12	Stilicho socer est, pater est Stilicho.
4.1	Attollens thalamis Idalium iubar
4.2	dilectus Veneri nascitur Hesperus,
4.3	iam nuptae trepidat sollicitus pudor,
4.4	iam produnt lacrimas flammea simplices.
4.5	ne cessa, iuvenis, comminus adgredi, 
4.6	impacata licet saeviat unguibus.
4.7	non quisquam fruitur veris odoribus
4.8	Hyblaeos latebris nec spoliat favos,
4.9	si fronti caveat, si timeat rubos;
4.10	armat spina rosas, mella tegunt apes. 
4.11	crescunt difficili gaudia iurgio
4.12	accenditque magis, quae refugit, Venus,
4.13	quod flenti tuleris, plus sapit osculum.
4.14	dices o! quotiens, “hoc mihi dulcius
4.15	quam flavos deciens vincere Sarmatas!”
4.16	Adspirate novam pectoribus fidem
4.17	mansuramque facem tradite sensibus.
4.18	tam iunctis manibus nectite vincula,
4.19	quam frondens hedera stringitur aesculus,
4.20	quam lento premitur palmite populus, 
4.21	et murmur querula blandius alite
4.22	Unguis adsiduo reddite mutuis.
4.23	et labris animum conciliantibus
4.24	alternum rapiat somnus anhelitum.
4.25	amplexu caleat purpura regio 
4.26	et vestes Tyrio sanguine fulgidas
4.27	alter virgineus nobilitet cruor.
4.28	tum victor madido prosilias toro
4.29	nocturni referens vulnera proelii.
4.30	Ducant pervigiles carmina tibiae 
4.31	permissisque iocis turba licentior
4.32	exultet tetricis libera legibus.
4.33	passim cum ducibus ludite milites,
4.34	passim cum pueris ludite virgines.
4.35	haec vox aetheriis insonet axibus, 
4.36	haec vox per populos, per mare transeat!
4.37	formosus Mariam ducit Honorius.
