22	Sed quaeris fortasse uel de hoc ipso aliquam accipere rationem, qua tibi persuadeatur non prius ratione quam fide te esse docendum. quod facile potest, si modo aequum te. praebeas. sed ut commode fiat, uolo quasi respondeas interroganti et primo dicas mihi, quare tibi uideatur non esse credendum. quod ipsa, inquis, credulitas, a qua creduli nominantur, uitium quoddam mihi uidetur esse, alioquin hoc nomen non pro conuicio obiectare soleremus. nam si suspiciosus in uitio est, eo quod non conperta suspicatur, quanto magis credulus, qui hoc a suspicioso differt. quod ille incognitis aliquam, iste nullam tribuit dubiationem. interim accipio hanc opinionem ac distinctionem. sed scis etiam curiosum non nos solere appellare sine conuicio, studiosum uero etiam cum laude. quamobrem adtende, si placet. etiam inter ' 1 istud SpMVmb 3 possftt b 8 maxime M maxime m* ... 11 ualitudinemque SMm 18 uera] uere ChMp uerePS religionis Mpb ni/si (B er.) S si M p b 15 assequatur (a ex i corr.) 8 et om.,b sine (ne 8. I. a m. 2) Ch 16 grauia Ch iniri P1 SMpVmb ft % 18 que S1 persuadexur Sl ' haec duo quid tibi distare uideatur. id certe respondes. quod quamuis uterque agatur magna cupiditate noscendi, curiosus tamen ea requirit. quae nihil ad se adtinent. studiosus autem contra quae ad sese adtinent requirit. sed quia non negamus ad hominem pertinere coniugem ac liberos et eorum salutem, si quispiam peregre positus, quemadmodum ualeant ac sese agant sua coniux ac liberi. omnes aduenientes sedulo percontetur, magna utique ducitur cupiditate noscendi. et tamen. hunc studiosum non uocamus, qui et magno opere scire uult et ea, quae ad se maxime pertinent. quare iam intellegis eo uaccillare istam definitionem studiosi, quod omnis quidem studiosus ea nosse uult, quae ad se pertinent, non tamen omnis. qui id agit. studiosus uocandus est, sed is. qui ea, quae ad animum nutriendum liberaliter atque ornandum pertinent, inpensissime requirit: tamen studentem recte appellamus praesertim addentes, quid studeat audire. nam etiam suorum studiosum possumus appellare, si suos tantum diligit. non tamen adiunctione nulla communi nomine studiosorum dignum putamus. audiendi autem cupidum, quemadmodum se sui haberent, non appellarem studiosum audiendi, nisi gaudens bona fama id ipsum saepe uellet audire; studentem uero, etiamsi semel. refer nunc animum ad curiosum et dic mihi, utrum si quis fabellam libenter audiret nihil sibi omnino profuturam, id est rerum ad se non pertinentium, neque id odiose atque crebro, sed rarissime ac modestissime uel in conuiuio uel in aliquo circulo ulloue consessu, uidereturne tibi curiosus ? non opinor, sed certe habens illius rei curam, cum libenter audiret, profecto uideretur. quapropter etiam 1 respondeas S respondens Ch respondebis p 3 tamen om. Ch. que Ch studiosis S studiosins M 4 requiret V 7 conionx SYb 8 percunctetur b 9 magnopere SPpMVmb 11 diffinitionem SMVm I 18 qui id] quid Ch quid P 15 inpemsissime S impendissime V tn inpensissima M 18'ad ianclione V 21 fama bona SMVmb 22 refert V 25 otiose Ch odiose (c in d mut.)P ac modestissime om. ClI, •« 26 consessu SP concessu M 28 cum] qum P . audire SMVmb curiosi definitio ea regula. qua studiosi, emendanda est. uide igitur, utrum et illa superiora emendanda sint. cur enim non et suspiciosi nomine indignus sit, qui aliquando aliquid suspicatur, et creduli, qui aliquando aliquid credit? itaque ut inter studentem alicuius rei et omnino studiosum rursumque inter curam habentem atque curiosum, ita inter credentem et inter credulum plurimum interest. 
23	 Sed nunc uide, inquies, utrum in religione credere debeamus. neque enim si concedimus aliud esse credere, aliud credulum esse, sequitur, ut nulla culpa sit in religionibus credere. quid? si enim et credere et credulum esse uitiosum est, quemadmodum et ebrium et ebriosum esse? quod qui certum existimat, nullum mihi habere posse amicum uidetur. si enim turpe est aliquid credere, aut turpiter facit, qui amico credit, aut nihil amico credens quomodo amicum uel ipsum uel se appellet. non uideo. hic fortasse dicas : concedo aliquid aliquando esse credendum; nunc expedi, quomodo in religione turpe non sit credere antequam scire. faciam, si potero. quocirca ex te quaero, quid existimes in grauiore culpa esse, religionem tradere indigno, an id quod ab eis, qui illam tradunt, dicitur credere. si, quem dicam indignum, non intellegis, eum dico, qui ficto pectore accedit. concedis, ut arbitror, magis culpandum esse tali homini pandere si qua sunt sancta secreta quam religiosis uiris de ipsa religione aliquid adfirmantibus credere. neque enim te aliud respondere decuerit. quare nunc fac putes eum adesse, qui tibi religionem sit traditurus: quonam modo illi fidem facturus es uero animo te accedere neque quicquam in te, quod ad hanc rem i •« 1 difinito S difinitio M diffiniti m diffiniti V ea (a corr. ex i) S qua] » quę SM qg<? m1 2 sint emendanda V m emendanda sint (in mg. tn 2 adscr.) S non om. Ch 3 elp et non b qui-creduli inf. text. tn.2 add.S' 7 et inter credulum scripsi: et incredulum Ch et credulum SpPMVmb 8 nunc] hanc Ch uides Ch . 10 sequetur Ch incredere in religionibus V in credere rel. m1 11 si 8. I. p 12 qui] si Tm 13 existimatur Vx, 14 turbe V 17 credendo Ch 19existimet Ch 22 ficto (a corr. in i) S concedit Ch 23 culpamdQ Ch 24 secreta sancta SVm 25 te om . V adtinet, doli atque simulationis esse? dices bona tua conscientia nihil te fingere, quantis poteris id ipsum adserens uerbis, sed tamen uerbis. non enim animi tui latebras, ita ut intime sciaris, homo homini aperire possis. at ille si dixerit: ecce credo tibi; sed nonne est aequius, ut etiam tu credas mihi, cum tu beneficium, si aliquid ueri teneo, sis accepturus, daturus ego? quid respondebimus nisi esse credendum? 
24	Sed, inquis, nonne erat melius, rationem mihi redderes. ut ea quocumque me duceret, sine ulla sequerer temeritate? erat fortasse; sed cum res tanta sit, ut deus tibi ratione cognoscendus sit, omnesne putas idoneos esse percipiendis rationibus, quibus ad diuinam intellegentiam mens ducitur humana. an plures, an paucos ? paucos, ais, existimo. horumne I n numero esse te credis? non est meum, inquis, hoc respondere. illius ergo putas etiam hoc tibi credere: quod quidem facit. tu tantum memento iam eum bis credidisse tibi incerta dicenti, te illi religiose admonenti ne semel quidem uelle credere. uerum fac ita esse uero animo te ad accipiendam religionem accedere et ita paucorum te esse hominum, ut rationes. quibus ad certam cognitionem uis diuina perducitur, capere possis: quid ? ceteris hominibus, qui tam sereno ingenio praediti non sunt, negandam religionem putas? an eos pedetentim quibusdam gradibus ad illa summa penetralia esse ducendos? uides plane, quid sit religiosius. neque enim tibi quiuis homo in rei tantae cupiditate ullo modo deserendus I S & eque uis m non 4jntimęSMadCk5eaequussf1equeuismnon est equi USPJJ n equ$uis V nonnest (n init. in ras.) Ch 7 ergo ChP bU respondenisi p2 8 reddere V 10 cum om. V ratione tibi Sm 11 putes V ideneos V percipiendis (os corr. in is) S 13 paucos (ante ais) om. Ch 14 te esse V cre4?l?dis P tibi respondere V 15 cre- 1 I dece (de ex re) S qdd ipsę facit (qdê ipsę m . 2 add.) M 16 bis] uis i te lib . uix credidisset ibi b 17 dicendi Ch dicendi p1 de Ch 18 uella SMVb uelles (s in raa.) m fac itaj facta M uero] et uero SPpMVmb 19 te 8. I. corr. add. Ch 21 caperę M 22 an eos in penetralia esse dqcendos m (in mg. m 2 add.) V pedetemtim P pedetemptim SMp 24 docendos// Ch uites Ch uidens p 25 cupiditatę M ullu Ch aut respuendus uideri potest. sed nonne censes, nisi primo credat se ad id, quod instituit, peruenturum. mentemque subplicem praebeat et quibusdam magnis necessariisque praeceptis obtemperans quadam uitae actione perpurget, non eum esse aliter illa, quae pure uera sunt, adepturum? censes profecto. quid ergo istis, quorum de genere te esse iam credo, qui facillime diuina secreta ratione certa capere possunt. si hac uia ueniant, qua illi qui primitus credunt, numquid tandem oberit? non arbitror. sed tamen, ais. quid eos morari opus est? quia etsi facto sibi nihil nocebunt, nocebunt tamen exemplo ceteris. uix enim est, qui de se tantum sentiat, quantum potest; sed qui minus, excitandus est, qui amplius, reprimendus, ut neque ille desperatione frangatur, neque iste praecipitetur audacia. quod facile fit, si etiam ii, qui ualent uolare, ne cui sint periculoso inuitamento, paulisper cogantur incedere. qua etiam ceteris tutum est. haec est prouidentia uerae religionis, hoc iussum diuinitus, hoc beatis maioribus traditum, hoc ad nos usque seruatum: hoc perturbare uelle atque peruertere, nihil est aliud quam ad ueram religionem sacrilegam uiam quaerere. quod qui faciunt, nec si eis concedatur quod uolunt, possunt quo intendunt peruenire. cuiusmodi enim libet excellant ingenio, nisi deus adsit, humo repunt. tunc autem adest, si societas humana in deum tendentibus curae sit. quo gradu nihil firmius in caelum reperiri potest. ego quidem huic rationi non possum resistere; nam nihil sine cognitione esse credendum qui possum dicere? cum et amicitia, nisi aliquid credatur, quod certa ratione demonstrari non potest, omnino nulla sit, et saepe dispensatoribus seruis sine ulla culpa dominorum credatur. in religione uero quid 1 cessej>* nu cesses Ch e censijs P 2 credas Ch 4 perpurgetur b eum] B enim Ch esse om. V 5 ceses p1 6 te (8. I. a m. 2) p te esse] de esse Ch 7 rationi Ch 10 nichil sibi V 18 disperatione S frangatur] plangatur Ch 14 hi ChPpb 15 inuitamentum SMmb in uita mentum F 17 a beatis (a 8. I.) P 20 sagrilegam Ch ne V 22 assit P hdmo (u am. 2) PV 23 societati humanae Pp ChSMb 24 reperire V 26 cognitione] ratione (8. l. am. 2) m om. r esse («. lam.2)S 27 probari 1* iniquius fieri potest, quam ut dei antistites nobis non fictum animum pollicentibus credant, nos eis praecipientibus nolimus credere ? postremo quae potest esse uia salubrior quam idoneum primo fieri percipiendae ueritati, adhibendo iis fidem, quae ad praecolendum et ad praecurandum animum sunt diuinitus constituta? aut si iam prorsus idoneus sis, circuire potius aliquantum qua tutissimum est ingredi, quam et tibi esse auctorem periculi et ceteris temeritatis exemplum. 
25	 Quare iam superest. ut consideremus, quo pacto hi sequendi non sint, qui se pollicentur ratione ducturos. nam quomodo sine culpa possimus sequi eos, qui credere iubent, iam dictum est; ad hos autem sponsores rationis non modo sine uituperatione. sed etiam cum aliqua laude se uenire nonnulli putant: sed non ita est duae sunt enim personae in religione laudabiles: una eorum, qui iam inuenerunt, quos etiam beatissimos iudicare necesse est; alia eorum, qui studiosissime et rectissime inquirunt. primi ergo sunt iam in ipsa possessione, alteri in uia, qua tamen certissime peruenitur. tria sunt alia hominum genera, profecto inprobanda ac detestanda. unum est opinantium, id est eorum, qui se arbitrantur scire quod nesciunt; alterum eorum, qui sentiunt quidem se nescire. sed non ita quaerunt, ut inuenire possint; tertium eorum, qui neque se scire existimant nec quaerere uolunt. tria sunt item uelut finitima sibimet in animis hominum distinctione dignissima: intellegere, credere, opinari. quae si per se ipsa considerentur, primum semper sine uitio est, secundum aliquando cum uitio, tertium numquam sine uitio. nam intellegere magna et honesta uel etiam 1 inquius Chp 2 nolumus V 8 uiatia Ch 4 pcipiendae Ch pcip. (uirg. er.) p ueritatis b his ChpSMmVb iis (ex his corr.) P 6 iam om. V circtlire b aliquantulum V 10 docturos SMb k < 12 os P 13 landeseuenire Ch nonnulla Pp 14 duę enl p. in rel. sl b 16 eat om. V 17 iam] etiam SAf om. Y mb alter Ch 19 est] et Ch 20 eorum] corti Ch 21 eorum om. V 25 opinari (re in ri corr.) S 26 uitio. et hoc ad eandem beatitudinem referre debemus. in hac enim nita quantumque (q?rtic11q;&) id sciatur nondum est beatissimum quoniam incomparabiliter limge est amplius quod inde nescitur SMVmbpP (m . 2 del. omnia) . diuina, beatissimum est; intellegere autem superflua, nihil nocet, sed fortasse discere nocuit, cum tempus necessariorum occuparent. ipsa etiam noxia non intellegere, sed facere aut pati miserum est. non enim si quis intellegat. quomodo possit inimicus sine suo periculo occidi, intellegentia ipsa, a cupiditate reus est; quae si absit, quid innocentius dici potest? credere autem tunc est culpandum, cum uel de deo indignum aliquid creditur uel de homine facile creditur. in ceteris uero rebus si quis quid credit, si se id nescire intellegat, nulla culpa est. credo enim sceleratissimos coniuratos uirtute Ciceronis quondam interfectos: atqui id non solum nescio, sed etiam nullo pacto me scire posse certo scio. opinari autem duas ob res turpissimum est: quod et discere non potest, qui sibi iam se scire persuasit, si modo illud disci potest,' et per se ipsa temeritas non bene adfecti animi signum est. nam etiamsi hoc ipsum, quod de Cicerone dixi, scire se quisquam arbitratur, quamquam nihil eum inpediat a discendo, quia res ipsa nulla scientia teneri potest, tamen quod non intellegit multum interesse, utrum aliquid mentis certa ratione uideatur, quod intellegere dicimus, an famae uel litteris credendum posteris utiliter commendetur, profecto errat. neque quisquam error turpitudine caret. quod intellegimus igitur, debemus rationi, quod credimus, auctoritati, quod opinamur, errori. sed intellegens omnis etiam credit, credit omnis et qui opinatur; non omnis qui credit intellegit; nullus qui opinatur intellegit. haec ergo tria si ad illa quinque hominum genera, quae paulo ante commemorauimus, referantur, id est 2 docet S1 necessariorfl (corr. ex necessarius) S 8 ipse p ipsa Ch etiam] autem M noxia. Ch 4 si (8. I. m . 1) p 5 a] ac non SPp MVbm . 6 est om. Ck 11 cicaronis M atque SMVm 12 certe iSTm 18 et discere] ediscere SVPtn ędiscere M 14 dici Chb 16 cicęrone M 17 impedia1;ltP 19 menti ChpMVm menti (s m. 2 add.) P 20 nidetnr M teneatur b (in marg. al uideatur) fama Ch 22 inteUigimus b (in marg. al . scimus) igitur om. Ch 23 opinatur Ch et qui opinatUr errori V 24 credit alt. om. Ch 25 nullus- intellegit om. P (sed ras. quattuor uoc.) 26 haec ergo] hęrgo p . duo probanda, quae priora posuimus, et tria reliqua uitiosa: inuenimus primum beatorum genus ipsi ueritati credere, secundum autem studiosorum amatorumque ueritatis auctoritati. in quibus duobus generibus laudabiliter creditur. in primo autem uitiosorum, id est eorum, qui opinantur se scire quod nesciant, est profecto uitiosa credulitas. cetera duo inprobanda genera nihil credunt: et illi qui uerum quaerunt cum desperatione inueniendi, et illi qui omnino non quaerunt. et hoc dumtaxat in rebus ad aliquam pertinentibus disciplinam. nam in alio uitae actu prorsus nescio quo pacto possit homo nihil credere. quamquam in illis etiam qui se in agendo probabilia sequi . dicunt, scire potius nihil posse quam nihil credere uolunt uideri. quis enim quod probat non credit? aut quomodo est illud quod sequuntur, si non probatur, probabile? quare duo genera possunt esse aduersantium ueritati: unum eorum, qui scientiam tantum obpugnant, non fidem, alterum eorum, qui utrumque condemnant: qui tamen utrum in rebus humanis inueniri possint, rursus ignoro. haec dicta sunt, ut intellegeremus nos retenta fide illarum etiam rerum, quas nondum conprehendimus. a temeritate opinantium uindicari. nam qui dicunt nihil esse credendum nisi quod scimus, hi unum cauent nomen opinationis, quod fatendum est turpe ac miserrimum; sed si diligenter considerent plurimum interesse, utrum se scire quis putet, an quod nescire se intellegit. credat aliqua auctoritate commotus, profecto errores et inhumanitatis atque superbiae crimen euitabunt. e 4 duorum SPpMVmb 6 nesciunt V 10 uitaacijtuj) pactuCft M y 11 probauilia Ch 12 uoluit S1 13 credat r 14 sequntur (q ex c fact.) S sequitur m secuntur ChM quare 1 quadere (de m 2 add.) P U d 15 aduersarium Ch ueriti Ch 17 contempnant 82 condempnant Mm 18 rursus] prorsusCft 19 quas] quia Ch 20 operantium Ch 21 hiJ id Ch ant. SpMVmb 22 qpinionis Sm 23 si diligenter considere//t (n er . quis m. 8 add.) P 25 erroris SPpMVmb 26 supeniiae Ch euitabunt scripsi: euitauit Ch uitauit SMb uitabit (b ex u corr.) V inuitauit p uitabunt Vtn XXV Aii;. iwt. 6. n 
26	 Quaero enim, si quod nescitur, credendum non est, quomodo seruiant parentibus liberi eosque mutua pietate diligant, quos parentes suos esse non credant. non enim ratione ullo pacto sciri potest, sed interposita matris auctoritate de patre creditur; de ipsa uero matre plerumque nec matri, sed obstetricibus, nutricibus, famulis. nam cui furari filius potest aliusque subponi, nonne potest decepta decipere? credimus tamen et sine ulla dubitatione credimus, quod sciri non posse confitemur. quis enim non uideat pietatem, nisi ita sit, sanctissimum generis humani uinculum. superbissimo scelere uiolari? nam quis uel insanus eum culpandum inputet, qui eis officia debita inpenderit, quos parentes esse crediderit, etiamsi non essent? qui contra non exterminandum iudicauerit, qui ueros fortasse parentes minime dilexerit, dum, ne falsos diligat, metuit? multa possunt adferri, quibus ostendatur nihil omnino humanae societatis incolume remanere, si nihil credere statuerimus, quod non possumus tenere perceptum. 
27	Sed nunc accipe, quod iam facilius me tibi persuasurum esse confido. cum de religione, id est cum de colendo atque intellegendo deo agitur, ii minus sequendi sunt, qui nos credere uetant, rationem promptissime pollicentes. nam nemini dubium est omnes homines aut stultos aut sapientes esse. nunc autem sapientes uoco non cordatos et ingeniosos homines, sed eos, quibus inest, quanta inesse homini potest, ipsius hominis deique firmissime percepta cognitio atque huic cognitioni uita moresque congruentes: ceteros autem cuiusque modi artibus inertiisque adfecti sunt, quolibet uictu probandi siue inprobandi, stultorum in numero deputauerim. quae cum ita sint. quis mediocriter intellegens non plane uiderit stultis utilius atque salubrius esse praeceptis obtemperare sapientium 1 credendo Ch 3 cred$nt M 8 scire ChMlapb 10 supperuissimum Ch celere Ch scęlere M 11 putet SPpMVmb 14 dum ne] nedum ne Ch falso Ppb 15 auferri Ch aferri p 16 humane Ch incolome SM,,,, 20 hi lib. b 22 aut stultos esse aut sapientes V 25 firmissimae Ch 26 cuius V cuiusca Ch 27 uel inerciis V sint Mm7b quodlibet p uictu-stul om. Ch siue inprobandi om. P quam suo iudicio uitam degere? nam omne factum, si recte factum non est, peccatum est; nec recte factum esse ullo modo potest, quod non a recta ratione proficiscitur. porro recta ratio est ipsa uirtus. cui autem hominum uirtus nisi sapientis animo praesto est? solus igitur sapiens non peccat. stultus ergo omnis peccat. nisi in iis factis, in quibus sapienti obtemperauerit; a recta enim ratione talia facta proficiscuntur nec, ut ita dicam, dominus sui facti stultus existimandus est, cum est tamquam instrumentum ministeriumque sapientis. quare si omnibus hominibus non peccare quam peccare melius est, melius profecto stulti omnes uiuerent, si serui possent esse sapientium. atque hoc si in rebus minoribus, ut in mercando uel colendo agro, in uxore ducenda, in suscipiendis educandisque liberis, in ipsa denique re familiari administranda expedire nemo ambigit, multo magis in religione. nam et res humanae promptiores ad dinoscendum sunt quam diuinae et in quibuscumque sanctioribus et praestantioribus, quo maius eis obsequium cultumque debemus, eo sceleratius periculosiusque peccatur. nihil igitur nobis restare admodum uides, quamdiu stulti sumus, si nobis uita optima et religiosa cordi est, nisi ut quaeramus sapientes, quibus obtemperando dominationem stultitiae neque ita multum sentire, dum inest nobis, et euadere aliquando possimus. 
28	 Hic rursus oritur difficillima quaestio. quonam enim modo stulti sapientem inuenire poterimus, cum hoc nomen, tametsi nemo fere audeat palam, plerique tamen ex obliquo sibi uindicant. cum de rebus ipsis, quarum cognitione constat sapientia, ita inter se dissentiant, ut aut nullum eorum, aut It 2 (pr.) est m2 6 stultus-peccat om. Ch isp hia ChSM VJbm 7 obtem i perarat V 9 tamquam om. S V m 10 quam peccare om. C", a 11 JppHps profectus Ch 19 peccator Ch ftmodQ Chp ammodum P* domlnttlonem comoda M amodo b 21 damnationê Y 22 nobis inest Y 24 quononftin uam] quoda Ch quo P qm p* 26 ferre SVm 27 uendicant V n 28 interesse V dissentiat S'1 . dissentiat Ch dissentiunt Vm ut] uti SMp nulli CI" S* certe unum necesse sit esse sapientem? sed quinam iste sit, cum ab stulto requiratur, quo pacto queat dinosci plane atque percipi, omnino non uideo. neque enim quibuslibet signis cognoscere aliquid potest nisi illud ipsum, cuius ea signa sunt,. nouerit. atqui sapientiam stultus ignorat. non enim ut aurum et argentum ceteraque id genus et cognoscere, cum uideas. et non habere concessum est, ita sapientiam mentis eius oculo qui ea careat, uideri fas est. sensu enim corporis quaecumque adtingimus, forinsecus nobis offeruntur, et ideo licet quoque res alienas oculis cernere, cum earum uel eius generis nos. nihil habeamus. quod autem intellectu capitur, intus apud animum est nec id habere quicquam est aliud quam uidere. caret autem stultus sapientia; non igitur nouit sapientiam non enim oculis eam posset uidere: non autem potest uidere et non habere neque habere ac stultus esse. nescit hanc igitur, et dum nescit, in alio loco cognoscere non potest. non ergo fotest quamdiu stultus est, quisquam certissima cognitione inuenire sapientem, cui obtemperando tanto stultitiae malo liberetur. 
29	Huic igitur tam inmani difficultati, quoniam de religione quaerimus, deus solus mederi potest: quem nisi et esse et humanis mentibus opitulari credimus, nec quaerere quidem ipsam ueram religionem debemus. quid enim tandem tanto molimine inuestigare cupimus? quid optamus adtingere? quo peruenire desideramus? eone quod esse aut ad nos pertinere non credimus ? nihil est tali mente peruersius. tune, cum beneficium a me petere non auderes aut certe inpudenter auderes, nisi daturum esse me crederes, inuentionem religionis postulatum uenis, cum deum neque esse neque, si sit, curare nos 2 queąęat Ch queat M quieat p quaeat P* 3 signis quibuslibet SJfm VPpb 4 sunt signa V 5 nouerint V atrqui (u er) S aut quis M h aut qui b 6 aut arg. V 7 sapientia Ch 12 abere p2 haberecaret (m . 2 inf. text scr.) Ch 13 care t (a er.) S careat M careat P* t teat 14 posse p1 possat (m. 2 corr.) P potest om . uidere Ch 15 nequehabere i om.Ch ac] autCTi etS fl g scit hanc Vm 18 cuius F 22 nec]ne SM Vm t 26 ali P con Ch 28 nisi-crederes om. SMVPpmb putes ? quid ? si tanta res est, quae nisi sedulo atque omnibus uiribus quaesita nequeat reperiri? quid? si ipsa difficillima inuentio ad capiendum ac proferendum. quod inuentum erit, mentem quaerentis exercet? quid enim oculis nostris hac luce iucundius et familiarius? quam tamen perpeti atque tolerare post diuturnas tenebras nequeunt. quid exhausto aegrotatione corpori adcommodatius quam cibus et potio ? uidemus tamen conualescentes refrenari atque cohiberi, ne saturitati ualentium committere sese audeant. cibisque ipsis agere, ut ad illum morbum, quo eos repudiabant. reuertantur. de conualescentibus loquor. quid? ipsos aegrotantes nonne urgemus, ut aliquid sumant ? in quo profecto nobis cum tanta molestia non obtemperarent, si se illum morbum euasuros esse non crederent. quando ergo tu te operosissimae ac laboriosissimae inquisitioni dabis ? quando tantam, quanta ipsa res digna est, curam negotiumque tibi audebis inponere, cum id, quod quaeris, esse non credas ? recte igitur catholicae disciplinae maiestate institutum est, ut accedentibus ad religionem fides persuadeatur ante omnia. 
30	 Itaque ille haereticus — siquidem de his nobis sermo est, qui se christianos dici uolunt — quam mihi rationem adferat, quaeso te? quid est, unde me a credendo ueluti a temeritate reuocet? si nihil me credere iubet, hanc ipsam ueram religionem ullam in rebus humanis esse non credo: quam cum esse non credo, non quaero. at ille, ut opinor, quaerenti monstraturus est; ita enim scriptum est: quaerens 26 Matth. 7, 8. ua. 1 quodsi Ch nisijsi V hominib1 p 2 q,sita p quaesitantae Ch ceque■ at Ch nell; at p 8 at p ac proferendum om. SPp Mm Vb h h 4 ae S 5 iocundius SMVmb 6 exausto V exausto P 7 uideamus S iim JfVm uideamua P 8 saturati S saturari p 9 cibusquę Ch ut II o nt adJ ut ad mi 10 quo] quq P1 qui mb repudiabat SPpMVaib 18 morbtl nonaeirent d euasuros V 14 te tu SVmb inquisitioni (ne corr. in ni) 15adbisp nanis Ch tantfl M tanta (a corr. ex Q) P3 tantap quanta] quantS Ch ut Sm quam b om. Mp ipsA Ok cura Ch 17 credas] potes b 22 me om. p 23 iubet] dubitet SMVmb 25 quam] qui m 26 monstraturum CK inueniet. ad eum igitur, qui me uetat credere, non uenirem, nisi aliquid crederem. estne ulla maior dementia quam ut ei sola, quae nulla scientia subnixa est, fide displiceam, quae ad eum ipsum me sola perduxit? 
