11	 Quae cum ita sint, audi etiam earundem scripturarum totidem condiciones et differentias; nam necesse est totidem occurrant. aut enim utiliter scripsit quispiam et non utiliter ab aliquo intellegitur, aut utrumque inutiliter fit, aut utiliter intellegit lector, cum ille contra, qui legitur, scripserit. horum trium primum non inprobo, ultimum non curo. nam neque possum reprehendere hominem, qui nulla sua culpa male intellectus est, nec moleste habere quemquam legi, qui uerum non uiderit, cum obesse legentibus nihil uideam. unum igitur genus est probatissimum et quasi purgatissimum, cum et bona 11 hi Im 2 cum] si in mg. V 4 uifjere S mi P pbaretur m2 5 cuipiam om. Pp S M V mb 6 sibi uoluisse S V m 11 stultius V 13 essetnec Ch 14 succenseret SM Vmb 16 quidquod (m . 2 corr. ex quicquid) S 19 existimare Smb diceret SP 20 corundem Ch i earundem P (o in a corr.) 23 utrum V fty et in mg scpserit M 26 nam neque] namque S 28 uidebam V scripta sunt et in bonam partem accipiuntur a legentibus. id quoque tamen adhuc in duo diuiditur; non enim penitus excludit errorem. nam euenit plerumque, ut cum bene senserit scriptor, bene etiam lector sentiat, sed aliud quam ille et saepe melius, saepe inferius.utiliter tamen. cum autem et hoc sentimus, quod ille quem legimus — et id est uitae bene agendae adcommodatissimum — cumulatissime sese habet ueritas nec aliunde aperitur falsitatis locus. quod genus cum de rebus obscurissimis lectio est, rarissimum omnino est neque id mea sententia liquido sciri, sed tantummodo credi potest. quibus enim argumentis absentis uel mortui hominis uoluntatem ita colligam, ut de illa iurare possim, cum etiam si praesens interrogaretur, multa esse possent, quae, si malus non esset, officiosissime absconderet? illud autem nihil ad rem cognoscendam ualere arbitror, qualis fuerit ille, qui scripsit; honestissime tamen bonus creditur, cuius litteris generi humano posteritatique consultum est. 
12	Quamobrem uellem mihi isti dicerent, in quo genere ponant ecclesiae catholicae quem putant errorem. si in primo, graue omnino crimen, sed defensionem longam non requirit; satis est enim negare ita nos intellegere, ut illi, cum inuehuntur, existimant. si in secundo, non minus graue est, sed eadem uoce refellentur. si in tertio, nullum crimen est. age ac deinde scripturas ipsas considera. quid enim libris obiciunt ueteris quod dicitur testamenti? numquidnam, quod boni sunt, sed male intelleguntur a nobis? at eos ipsi non accipiunt. an quia nec boni sunt nec bene accipiuntur? at hoc superior defensio satis expugnat. an illud dicent: quamuis bene a uobis accipiantur, mali sunt tamen? quid est aliud uiuos, cum quibus res agitur, aduersarios absoluere atque olim mortuos, cum quibus nulla 1 accipitur V 4 senserit Y 9 mea] in ea b 11 hominis (es corr. in is) P 13 malas S 14 absconderem Ch 16 generi/ (a er.) S 18 uellem—quo om. Ch 20 longinquam SMPpVmb satis enim est Sm .. 26 a] ad Ch at] ad Ch a4 P 27 accipiantur S ad P ad Y satis] 1 hoc qui sasit Ch 29 tamen sunt V Qd 6 aliud ^ uiuos m- cum om Ch contentio est. accusare? ego quidem illos uiros et omnia utiliter memoriae mandasse et magnos ac diuinos fuisse et illam legem dei iussu ac uoluntate promulgatam esse et conditam credo et id, quamquam perpauca eius generis librorum sciam, persuadere tamen facile possum. si mihi aequus et minime pertinax animus adhibeatur. atque id faciam, cum copia nobis data fuerit beniuolarum aurium ac mentis tuae; sed hoc cum potero. nunc autem nonne mihi satis est, quoquo modo se ista res habeat, deceptum non fuisse? 
13	 Testor, Honorate, conscientiam meam et puris animis inhabitantem deum nihil me existimare prudentius, castius. religiosius, quam sunt illae scripturae omnes, quas testamenti ueteris nomine catholica ecclesia retinet. miraris, noui. non enim dissimulare possum longe aliter nobis fuisse persuasum. sed nihil est profecto temeritatis plenius, quae nobis tunc pueris inerat, quam quorumque librorum expositores deserere, qui eos se tenere ac discipulis tradere posse profitentur, et eorum sententiam requirere ab his, qui conditoribus illorum atque auctoribus acerbissimum nescio qua cogente causa bellum indixerunt. quis enim sibi umquam libros Aristotelis reconditos et obscuros ab eius inimico exponendos putauit, ut de his loquar disciplinis, in quibus lector fortasse sine sacrilegio labi potest? quis denique geometricas litteras Archimedis legere magistro Epicuro aut discere uoluit, contra quas ille multum pertinaciter nihil earum, quantum arbitror, intellegens disserebat? an istae scripturae legis planissimae sunt, in quas isti quasi uulgo expositas inpetum faciunt frustra et inaniter? qui mihi similes uidentur illi mulierculae, quam iidem ipsi solent deridere, quae irata, quod ei sol iste laudaretur et a manichaea quadam femina colendus commendaretur, ut erat religiose simplex, concita exiluit et eum locum, quem sol 2 mandasse memoriae V 4 id om. V 5 aecus Ch et om. Vm (s. I.) . 6 fuerit data V 7 beneuolarum SMPpm 15 pleniusq' SM pleniusq m III 20 bella m2 bella V enim om. m inqufi sibi S 30 machiae a,quada p1 n. 31 exiliunt M eiiluaT (ix a m. 2) Ch eiiliuit Vm XXV. Ang. aect. 6. 2 per fenestram inlustrauerat, crebro pede percutiens: ecce solem deumque tuum calco' clamare coepit. stulte omnino atque muliebriter — quis negat? — sed nonne tibi tales uidentur isti, qui ea, quae non intellegunt, aut cur, aut omnino qualia sint, quamue iacentibus similia, subtilia tamen intellegentibus atque diuina, magno inpetu orationis maledictisque lacerantes, quia eis inperiti plaudunt, aliquid se proficere existimant? quicquid est, mihi crede, in scripturis illis altum et diuinum est: inest omnino ueritas et reficiendis instaurandisque animis adcomodatissima disciplina et plane ita modificata, ut nemo inde haurire non possit. quod sibi satis est. si modo ad hauriendum deuote ac pie, ut uera religio poscit, accedat. quod ut tibi probem, multis rationibus et longiore oratione opus est. agendum enim tecum prius est, ut auctores ipsos non oderis, deinde ut ames; et hoc agendum quouis alio modo potius quam exponendis eorum sententiis et litteris, propterea quia si Vergilium odissemus. immo si non eum, priusquam intellectus esset, maiorum nostrorum commendatione diligeremus, numquam nobis satis fieret de illis eius quaestionibus innumerabilibus, quibus grammatici agitari et perturbari solent; nec audiremus libenter, qui cum eius laude illas expediret, sed ei faueremus, qui per eas illum errasse ac delirasse conaretur ostendere. nunc uero cum eas multi ac uarie pro suo quisque captu aperire conentur, his potissimum plauditur, per quorum expositionem melior inuenitur poeta, qui non solum nihil peccasse, sed nihil non laudabiliter cecinisse ab eis etiam, qui illum non intellegunt, creditur. itaque in quaestiuncula magistro deficienti et quid respondeat non habenti suscensemus potius quam illum mutum uitio Maronis putamus. iam si ad defensionem suam peccatum tanti 4 eunt M 5 qufi uera dicentibus S Vx, 6 diuina magno] diuino ////V9 Ch 11 non s. I. S2 om. Mb 12 poscit (corr. ex possit) S 16 ex exponendis V 17 quia sij quasi Ch uirgilitl b inmo Ok m 19 fieret satis Y 22 expedires Ch 24 captu-potissimum om. Ch MQ 26 peccatg, S 28 qufstiunculis V 29 habent Ch succensemus SM Vmb auctoris adserere uoluerit. uix apud eum discipuli uel datis mercedibus remanebunt. quantum erat, ut similem beneuolentiam praeberemus eis, per quos locutum esse sanctum spiritum tam diuturna uetustate firmatum est? sed scilicet intellegentissimi adulescentes et miri rationum exploratores non euolutis saltem illis litteris, non quaesitis magistris. non aliquantum nostra tarditate accusata, non denique uel mediocri corde concesso eis, qui huiusmodi litteras per totum orbem tam longo tempore legi, custodiri tractarique uoluerunt, nihil apud illos credendum putauimus, eorum qui istis inimici infestique sunt uoce commoti, apud quos falsa pollicitatione rationis inaudita milia fabularum credere et colere cogeremur. 
14	 Sed nunc quod institui peragam, si possum, et sic apud te agam, ut fidem catholicam non interim aperiam, sed ad scrutanda eius magna mysteria eis. quorum animae sibi curae sunt, spem diuini fructus et inueniendae ueritatis . ostendam. nemo dubitat eum, qui ueram religionem requirit, aut iam credere inmortalem esse animam, cui prosit illa religio, aut etiam id ipsum in eadem religione uelle inuenire. animae igitur causa omnis religio; nam corporis natura quoquo modo se habeat, nullam curam ac sollicitudinem incutit ei, praesertim post mortem, cuius anima tenuerit quo beata sit. animae igitur causa uel solius uel maxime uera, si qua est, religio constituta est. haec autem anima — uidero quam ob causam et hoc obscurissimum esse confiteor — errat tamen ac stulta est, ut uidemus, donec adipiscatur percipiatque sapientiam, et fortasse ipsa est uera religio. num te ad fabulas mitto? num aliquid cogo te temere credere? animam nostram dico errore ac stultitia inretitam et demersam uiam, si 2 ut similem] utimilg Ch beniuolentiam S M Pp2 mb 3 spirir tum sanctom SPp M Vm b 5 mirationum ChV exploratioQes V 6 saltim SM Fnt1 8 eiusmodi b tam] at Ch 15 ainime V o tm 20///quom V 21 ac] a Ch 28 es Ch 24 uiderp ms 25 hoc om. SpPMVmb ee 26 adepiscatur Ch 27 (et 28) num] nunc P 28 te. mere P ('Fe c4 temedere p me credereS2 te mecum credere T w» te me credere Mtemere om. b 2* qua est, quaerere ueritatis. si hoc in te non est, da ueniam et participare mecum, quaeso, sapientiam tuam; sin id, quod dico, agnoscis in te, simul, obsecro, quaeramus uerum. 
15	Puta nos adhuc neminem audisse cuiuspiam religionis insinuatorem. ecce res noua est a nobis negotiumque susceptum. quaerendi sunt, credo, huius rei, si ulla est, professores. fac nos repperisse alios aliud opinantes et diuersitate opinionum ad se quemque trahere cupientes. sed inter hos excellere famae interim celebritate quosdam atque omnium paene occupatione populorum. utrum isti uerum teneant. magna quaestio est; sed nonne prius sunt explorandi, ut, quamdiu erramus, si quidem homines sumus, cum ipso genere humano errare uideamur? 
16	At enim apud paucos quosdam est ueritas. scis ergo iam quae sit, si scis, apud quos sit. nonne dixeram paulo ante, ut quasi rudes quaereremus? sed si ex ipsa ui ueritatis paucos eam tenere coniectas, qui uero sint, nescis, quid? si ita pauci sunt, qui uerum sciunt, ut auctoritate sua multitudinem teneant, unde se in illa secreta expedire et quasi eliquare paucitas possit? nonne uidemus, quam pauci summam eloquentiam consequantur, cum per totum orbem rhetorum scholae adulescentium gregibus perstrepant? numquidnam inperitorum perterriti multitudine, quicumque boni oratores euadere uolunt, Caecilii sibi potius aut Eruci orationibus quam Tullianis nauandam operam existimant? haec adpetunt omnes, quae maiorum auctoritate firmata sunt. eadem inperitorum turbae discere moliuntur. quae a paucis doctis discenda recepta sunt; adsequuntur autem perpauci, agunt pauciores, clarescunt paucissimi. quid? si tale quiddam est uera religio. quid? si multitudo 2 sin id] si in id Ch si/n id fi er.) P si non id M si id m b si iij id S siinid p 4 audiesse Ch 5 a nobis om. Ch p suceptum V 6 que?re4?ndi Squ§ credcndi Mque credenda fl b 7 alios]alius Ch 8 fame b 9 ppene S poene Ch 12 errante in mg . 1 errare S 13 at] aut Fx II 15 ueritas 8 V ueritas mt 18 expedire teneant et quasi V 21 num ft qui ia b 23 ęruci M erucii b tullian tf (u corr . in i) S npuanda flit nouanda V 25 sint V imperitorum (ra mut. in ri) S 28 quidreligio om. 1r . similitudo S similitudo M imperitorum (ra corr. iit ri) S inperitorum frequentat ecclesias, sed nullum argumentum est ideo neminem illis mysteriis factum esse perfectum. et tamen si tam pauci studerent eloquentiae quam pauci sunt eloquentes, numquam nos parentes nostri magistris talibus commendandos putarent. cum igitur ad haec studia nos multitudo inuitauerit, quae inperitorum parte copiosa est, ut id, quod pauci adipisci possunt, adamaremus. cur nobis esse similem in religione nolumus causam, quam cum magno animae discrimine fortasse contemnimus? si enim uerissimus et sincerissimus dei cultus, quamuis sit apud paucos, apud eos tamen est, quibus multitudo quamquam cupiditatibus inuoluta et a puritate intellegentiae remota consentit-quod fieri posse quis dubitet? — quaero, si quis temeritatem uecordiamque nostram arguat, quod non apud eius magistros eam diligenter inuestigamus, cuius inueniendae nobis magna cura inest, quid respondere possimus? deterruit me multitudo? cur ab studio artium liberalium uix huic praesenti uitae aliquid commodi adferentium, cur ab inquirenda pecunia, cur ab honore adipiscendo, cur denique a conparanda et retinenda bona ualetudine, postremo cur ab ipsa beatae uitae adpetitione, cum his omnes occupentur, pauci excellant, nulla deterruit multitudo? 
17	At absurda ibi dici uidebantur. quibus adserentibus? nempe inimicis, qualibet causa, qualibet ratione — non enim hoc nunc quaeritur — tamen inimicis. cum legerem, per me ipse cognoui. itane est? nulla inbutus poetica disciplina Terentianum Maurum sine magistro adtingere non auderes, — Asper, Cornutus, Donatus et alii innumerabiles requiruntur, ut quilibet poeta possit intellegi, cuius carmina et theatri plausus uidentur captare — tu in eos libros, qui quoquo modo se habeant, sancti tamen diuinarumque rerum pleni prope to Õ inuitauerit (corr. ex imitauerit) S 6 imperitord m7 7 adamares V 9 contempnimus Vet] est Ch 18 teneritatem Ch e 19 oalitudine 8 M V m b y20 occupantur ChpM Y b occQpantur SP1 v 23 nunc hoc V 24 inimicis S inimicis (u corr. in i) M 25 es (ex 8 fact.) . SVm nulla] inilla M 29 captaret. Ut Ch q qm rng quomodo Ch V tius generis humani confessione diffamantur, sine duce inruis et de his sine praeceptore audes ferre sententiam nec si tibi aliqua occurrunt, quae uideantur absurda, tarditatem tuam et putrefactum tabe huius mundi animum, qualis omnium stultorum est, accusas potius quam eos, qui fortasse a talibus intellegi nequeunt? quaereres aliquem pium simul et doctum. uel qui talis esse multis consentientibus diceretur, cuius et praeceptis melior et doctrina peritior fieres. non facile reperiebatur? cum labore inuestigaretur. deerat in ea terra, quam incolebas? quae causa utilius cogeret peregrinari? in continenti prorsus latebat aut non erat? nauigaretur. si in propinquo trans mare non inueniebatur, progredereris usque ad illas terras, in quibus ea, quae illis libris continentur. gesta esse dicuntur. quid tale fecimus, Honorate? et tamen religionem fortasse sanctissimam — adhuc enim quasi dubitandum sit loquor — cuius opinio totum iam terrarum orbem occupauit, miserrimi pueri pro nostro arbitrio iudicioque damnauimus. quid? si illa, quae nonnullos inperitos in eisdem scripturis uidentur offendere, eo sunt ita posita, ut cum res abhorrentes a sensu qualiumcumque hominum, nedum prudentium atque sanctorum, legerentur, secretam significationem multo studiosius quaereremus? nonne cernis, ut Catamitum bucolicorum, cui pastor durus effluxit, conentur homines interpretari et Alexim puerum, in quem Plato etiam carmen amatorium fecisse dicitur, nescio quid magnum significare, sed inperitorum iudicium fugere adfirment, cum sine ullo r et 1 iųruissęąde 81 irmisset de M inraisse de Ch irruisset et de b 11 2 si tibi] sibi Ch sibi P 3 uidebantar S V 4 putre factum S tabe M ri 9 repperiebatur S repperiebatur M 12 progrederis S progrederes M qua ea que 13 terras qeełl!l qib' illis ma quę ea in quibus V 15 religione Ch 16 loquor (a in o corr.) M 19 eo ita sint pos-ita V 20 aborrentes S C 22 catamiium V catamictl6 28 buccolicorumjj bufcolicorumP ef//I//Bitw i CA. effulsis V Ctiuentur m* 24 alexin S rm 26 imperitorum (ra in ri corr.) S affirmant (in mg. signo r app.) m V cum om. V fn sacrilegio poeta uberrimus uideri possit libidinosas cantiunculas edidisse? 
18	Sed reuera reuocabat nos atque prohibebat a quaerendo aut alicuius legis sanctio aut aduersantium potentia aut sacratorum persona uilis aut fama turpis aut institutionis nouitas aut occulta professio? nihil horum est. omnia diuina et humana iura permittunt quaerere catholicam fidem: tenere autem et colere per humanum certe ius licet. si de diuino quamdiu erramus, incertum est: nemo inbecillitatem nostram terret inimicus - quamquam ueritas atque animae salus si diligenter quaesita, ubi tutissime licet, inuenta non fuerit, cum quouis discrimine quaeri debeat - omnium dignitatum et potestatum gradus huic diuino cultui deuotissime inseruiunt; honestissimum est religionis nomen et praeclarissimum. quid inpedit tandem perscrutari atque discutere pia et sedula inuestigatione. utrum hic est illud. quod sincerissime nosse et custodire paucos necesse est, etiamsi omnium in id gentium uoluntas fauorque conspiret? . 
19	Quae cum ita sint, fac nos, ut dixi, nunc primum quaerere, cuinam religioni animas nostras purgandas instauran dasque tradamus. procul dubio a catholica ecclesia sumendum exordium. plures enim iam christiani sunt, quam si Iudaei simulacrorum cultoribus adiungantur. eorundem autem christianorum, cum sint haereses plures atque omnes se catholicos uelint uideri aliosque praeter se haereticos nominent, una est ecclesia, ut omnes concedunt: si totum orbem consideres, refertior multitudine; ut autem qui nouerunt adfirmant, etiam ueritate sincerior ceteris omnibus. sed de ueritate alia quaestio est. quod autem quaerentibus satis est. una est catholica, cui haereses aliae diuersa nomina e • ito <3 reu$r$4 sacrgrfl S1 5 personabilis Ch faJ,'ma (o corr. in a) S nouita Ch 7 iura] natura Ch 8 si de] sine SVm 11 quaesita] qng ait antMb quasita aut SVm 15 pię Ch 16 est] sit SPpMVmb 17 faborque Ch e 18 conspiceret V 21 procul] propter V a om. Ch 25 nominvntS1 nominant M b 27 nouerint Y 30 est (post una) om. V inponunt, cum ipsae singulae propriis uocabulis, quae negare non audeant, appellentur. ex quo intellegi datur, iudicantibus arbitris, quos nulla inpedit gratia, cui sit catholicum nomen, ad quod omnes ambiunt, tribuendum. sed ne id loquacissime aut superfluo quispiam disserendum putet. una est certe, in qua ipsae quodam modo etiam humanae leges christianae sunt. nullum ego hinc praeiudicium fieri uolo, sed exordium quaerendi oportunissimum iudico. non enim metuendum est, ne uerus dei cultus nullo proprio robore innixus ab eis. quos fulcire debeat, fulciendus esse uideatur; sed certe perfectae felicitatis est, si potuerit ibi uerum inueniri, ubi et inquisitio eius et retentio securissima est: si non potuerit, tum demum alia quocumque periculo adeunda atque rimanda sunt. 
20	 His igitur constitutis, quae, ut opinor. ita iusta sunt, ut obtinere apud te istam causam quouis aduersario debeam, edam tibi, ut possum, cuiusmodi uiam usus fuerim, cum eo animo quaererem ueram religionem, quo nunc exposui esse quaerendam. ut enim a uobis trans mare abscessi, iam cunctabundus atque haesitans. quid mihi tenendum, quid dimittendum esset — quae mihi cunctatio in dies maior oboriebatur, ex quo illum hominem, cuius nobis aduentus, ut nosti, ad explicanda omnia, quae nos mouebant, quasi de caelo promittebatur, audiui eumque excepta quadam eloquentia talem quales ceteros esse cognoui — rationem ipse mecum habui magnamque deliberationem iam in Italia constitutus. non utrum manerem in illa secta, in quam me incidisse paenitebat, sed quonam modo uerum inueniendum esset. in cuius amorem suspiria mea nulli melius quam tibi nota sunt. saepe mihi o 2 appellantur V 4 nelJ id (cui er. uid.) S 6 ipse Ch 7 gb, 9 innix/os// M 10 folciendos V perfecte Ch 11 poteritaMTm nbi et] ▼ va nbit Ch 12 poterit Ym 13 alio quocumque ade$nd$m atque irmanda/// Iq'. est p2 pericula M atque] et 82 16 istft m (.-- m. 2 add.) ad- Y uereari Ch 16 eo] sco V 18 abcessi M V cunctabundra S 22 quasi] quae si Ch 26 manere Ch SM pIp 27 esse Ch esset («. l.)p amorem (m. corr. add.) Ch 28 sunt (eras.) P uidebatur non posse inueniri magnique fluctus cogitationum mearum in academicorum suffragium ferebantur. saepe rursus intuens, quantum poteram, mentem humanam tam uiuacem, tam sagacem, tam perspicacem, non putabam latere ueritatem, nisi quod in ea quaerendi modus lateret, eundemque ipsum modum ab aliqua diuina auctoritate esse sumendum. restabat quaerere, quaenam illa esset auctoritas, cum in tantis dissensionibus se quisque illam traditurum polliceretur. occurrebat igitur inexplicabilis silua, cui demum inseri multum pigebat; atque inter haec sine ulla requie cupiditate reperiendi ueri animus agitabatur. dissuebam me tamen magis magisque ab istis. quos iam deserere proposueram. restabat autem aliud nihil in tantis periculis, quam ut diuinam prouidentiam lacrimosis et miserabilibus uocibus. ut opem mihi ferret, deprecarer. atque id sedulo faciebam; et iam fere me commouerant nonnullae disputationes Mediolanensis episcopi, ut non sine spe aliqua de ipso uetere testamento multa quaerere cuperem, quae, ut scis, male nobis commendata execrabamur. decreueramque tamdiu esse catechumenus in ecclesia, cui traditus a parentibus eram, donec aut inuenirem, quod uellem, aut mihi persuaderem non esse quaerendum. oportunissimum ergo me ac ualde docilem tunc inuenire posset, qui posset docere. hoc ergo modo et simili animae tuae cura sit. diu quoque te adfectum uides; et si iam satis tibi iactatus uideris finemque huiusmodi laboribus uis inponere, sequere uiam catholicae disciplinae, quae ab ipso Christo per apostolos ad nos usque manauit et abhinc ad posteros manatura est. 2 hachademicoram Ch achademicorum S M V m inchademi corum p ferbantur (r in ras.) Ch 7 quaenam] nam que Ch 8 quisquam V 9 ineispicabilis V 10 haec om. V 12 autem om. V 14 mirabilib' M mihi] nisi Ch 17 capere Ch 18 decreraque (ra corr. ex ta) m decreberamque Ch 19 tamdiu om. V cathecuminus Ch S M PI m b cathecnminos V caticnminus p 21 opportunissimum SPMb 22 m? do- cilem V posset si fuisset qui P (si fuisset m. 2 s. I. scr.) dicere r m tibi 23 cura m'2 sit] siSM 24 huiusmundi Ch 25iamponerer 26 ad] a Ch 
21	 Ridiculum, inquis. istuc est, cum omnes hanc se profiteantur tenere ac docere. profitentur hac omnes haeretici, negare non possum, sed ita, ut eis, quos inlectant, rationem se de obscurissimis rebus polliceantur reddituros, eoque catholicam maxime criminantur, quod illis, qui ad eam ueniunt, praecipitur, ut credant, se autem non iugum credendi inponere, sed docendi fontem aperire gloriantur. quid, inquis, dici potuit, quod ad eorum laudem maxime pertineret? non ita est. hoc enim faciunt nullo robore praediti, sed ut aliquam concilient multitudinem nomine rationis: qua promissa naturaliter anima gaudet humana nec uires suas ualetudinemque considerans sanorum escas adpetendo, quae male committuntur nisi ualentibus, inruit in uenena fallentium. nam uera religio, nisi credantur ea. quae quisque postea, si se bene gesserit dignusque fuerit, adsequatur atque percipiat, et omnino sine quodam graui auctoritatis imperio inire recte nullo pacto potest. 
